id,created_at,text,retweet_count
1247014244966678529,2020-04-06 04:12:19,"Read updates in Chinese: 新冠病毒疫情最新消息
https://t.co/uimZhYFanX",14
1247014072912097281,2020-04-06 04:11:38,"—A tiger at the Bronx Zoo tested positive for the coronavirus, and other big cats there appear ill
—Queen Elizabeth II, in a rare televised address, urged Britain to display resolve, as Prime Minister Boris Johnson entered the hospital

Latest updates:
https://t.co/9v4hipZ06R",196
1247006141835509761,2020-04-06 03:40:07,"Last week, the captain of the aircraft carrier Theodore Roosevelt, who had appealed to his superiors for help, was fired.

By Sunday, friends said, Capt. Brett E. Crozier had come down with the coronavirus himself. https://t.co/a7rwD26bev",658
1246999855706386432,2020-04-06 03:15:08,"RT @jodikantor: This is what a socially distanced funeral looks like. 

The question of how we will mourn while apart is so difficult. But…",253
1246996078228049920,2020-04-06 03:00:07,"Facing the prospect of a brutal few weeks, some U.S. governors say they had been left to compete for critical equipment in the absence of a consistent coronavirus strategy and coordination from the Trump administration
https://t.co/h83iJQ2DG1",142
1246989546031665152,2020-04-06 02:34:10,"El vocabulario y las estadísticas que usamos para hablar del coronavirus ofrecen una falsa sensación de precisión cuando, en realidad, la información disponible solo muestra una fracción de lo que sucede.
https://t.co/tp3xjnKhh9",102
1246989368394428417,2020-04-06 02:33:28,"Les statistiques et le vocabulaire que nous utilisons pour parler du coronavirus donnent une fausse impression de précision, alors qu’en réalité l’information que nous avons ne reflète qu’une partie de ce qui se passe.
https://t.co/J0KcvJl0JG",47
1246989213062627329,2020-04-06 02:32:50,"Le statistiche e il lessico che utilizziamo per parlare di coronavirus danno una falsa impressione di precisione. In realtà, le informazioni di cui disponiamo mostrano solo una frazione di ciò che sta avvenendo.
https://t.co/Rjo1uLRrST",10
1246989112630009857,2020-04-06 02:32:27,"我们谈论新冠病毒时使用的统计数据和词汇给人以精准的假象，而现实是，我们所掌握的信息仅代表冰山一角。
https://t.co/2u5kblfEBr",9
1246988126570102785,2020-04-06 02:28:31,"The meaning of phrases like ""widespread testing,"" ""the peak"" and ""lockdown"" also varies widely across the world, and in some cases even varies within a single country.

Read more from our reporter @perezpena.
https://t.co/t58U2ePTq9",25
1246988124607176704,2020-04-06 02:28:31,"Similarly, you may have seen assertions that Italy and Spain have high mortality rates, Germany's is low, and China's is in between. But counting the dead is as flawed and inconsistent as counting the infected. https://t.co/t58U2ePTq9 https://t.co/cLsKHZduin",38
1246988122711343104,2020-04-06 02:28:31,"""Confirmed cases,"" for example, depend on how countries are testing and how they report numbers. Experts say most infections are going undetected, so national tallies are incomplete pictures that may not be comparable — and that's if countries are forthcoming about their data. https://t.co/ycsgUmi9aE",58
1246986251019980810,2020-04-06 02:21:04,"The statistics and vocabulary we use to talk about the coronavirus offer a false sense of precision while in reality, the information we have shows only a fraction of what’s going on.
https://t.co/vlDe1HDrlZ",359
1246981007804432387,2020-04-06 02:00:14,"In 2013, CNN executives told Chris Cuomo he could no longer interview his brother on TV. But crises often transform the broadly accepted rules of media, writes @benyt
https://t.co/MrfKaj369p",113
1246975936412692480,2020-04-06 01:40:05,"The  coronavirus has scrambled America's politics, and both parties are trying to figure out where the ideological lines will settle before Election Day
https://t.co/R4BBBCcIdx",53
1246970639510110209,2020-04-06 01:19:02,"Health experts are throwing everything they have at understanding and fighting the coronavirus. Economists, too, have broken from other work to explore what they can add to understanding a world upended by disease.
https://t.co/R92tyYwSto",105
1246965900860952576,2020-04-06 01:00:12,"U.S. military officials are seeking $20.1 billion in additional spending on equipment, exercises and defense investments to counter China
https://t.co/y4Ps1V6cKp",77
1246961346949844992,2020-04-06 00:42:07,"""In the early days of collecting,"" the Museum of the Bible's chief curatorial officer said, ""there really were not qualified individuals involved.""
https://t.co/IpfLODPfPh",34
1246957056348819457,2020-04-06 00:25:04,"For the second straight day, President Trump promoted the use of the anti-malaria drug hydroxychloroquine against the advice of doctors. The drug's effectiveness against the coronavirus is unproven, and health experts say more study is needed.
https://t.co/BBkHwtYgHG",282
1246955538224689153,2020-04-06 00:19:02,"Grass-roots progressive groups built an organizing juggernaut focused on congressional races and down-ballot campaigns for 2020. That was pre-pandemic.
https://t.co/cgEX25Uc3M",55
1246950766499291136,2020-04-06 00:00:04,"As the coronavirus continues to spread across the U.S., many influencers are using their platforms to educate their followers. But some of the posts circulating on social media display behavior that defies current guidelines to cease nonessential travel. https://t.co/lL7r6cRDzq",47
1246949949310451712,2020-04-05 23:56:49,"RT @AsteadWesley: NEW: Progressive candidates and grassroots groups built an organizing machine for summer 2020, built on door knocks. Now,…",187
1246945990923423744,2020-04-05 23:41:06,"Just a few weeks ago, Mary Roman, an 84-year-old senior Olympian, was practicing shot put in a local batting cage. She died on Monday from complications caused by the coronavirus, her family said.
https://t.co/NKR91uQB2b",465
1246940710873509890,2020-04-05 23:20:07,"This meditation in 10 easy steps is an exercise to help your body release the stress of constantly bracing for a disaster
https://t.co/H3Fs96EL8o",159
1246935682968440835,2020-04-05 23:00:08,"In Opinion

""Increasingly, when I leave the house I find myself not relaxed and rejuvenated by exercise and fresh air but anxious and frustrated at the terrible social distancing job my neighbors are doing,"" writes Eleanor Barkhorn. https://t.co/F7AqLt8DMv",129
1246930633366089732,2020-04-05 22:40:04,"A tiger at the Bronx Zoo has tested positive for the coronavirus, in what's believed to be a case of ""human-to-cat transmission.""

The USDA said only one tiger was tested, but several other lions and tigers at the zoo show symptoms of respiratory illness.
https://t.co/R3tscPipSL",1313
1246925343824449543,2020-04-05 22:19:03,"""The idea that we’re all supposed to be positive all the time has become an American obsession.""

Kate Bowler is a religion scholar and best-selling author who is sharing daily reflections on Instagram during the coronavirus pandemic. https://t.co/DOp9uD473b",92
1246920586128916493,2020-04-05 22:00:09,"This pantry staple can be transformed into so many meals. Here’s how to push it from side dish to star.
https://t.co/6dkkGUIRkC",64
1246916787402428419,2020-04-05 21:45:03,"“I love this village. But I can’t survive here much longer.” 

Climate change is remaking the Himalayan region of Nepal, putting millions of South Asians who depend on its water resources at risk, and pushing villagers to move to lower altitudes. https://t.co/PT8voFDy30",257
1246913014718181377,2020-04-05 21:30:03,"By Sunday there were more than 91,000 coronavirus cases in Germany, but in the village of Oberammergau, there are no known cases.
In 1633 the village, ravaged by a pandemic, made a pledge to God. Now they have been forced to to abandon their promise.  https://t.co/3llFPaw53L",121
1246907505470554115,2020-04-05 21:08:10,"Breaking News: Prime Minister Boris Johnson of Britain has been admitted to a hospital for tests. He announced he had the coronavirus in March.

Downing Street insisted the move was a precaution and that he remains at the helm of the government.
https://t.co/YCChNrpzv2",301
1246901436769882114,2020-04-05 20:44:03,"Beneath the veil of silence, there are indications that the coronavirus situation in Hungary may be graver than records show https://t.co/dBDZ4JxNhv",49
1246901434567835650,2020-04-05 20:44:02,New restrictions on journalism that the government deems harmful to the coronavirus response have made it harder to research the scale of the pandemic in Hungary. Many doctors are reluctant to speak out publicly and hospitals have been barred from releasing information.,62
1246901432856514560,2020-04-05 20:44:02,"—Orban threw a cloak of secrecy over a Chinese-funded railway in Hungary
—He shared plans to scrap state recognition of gender transition
—His deputy considered stripping powers from city mayors, many of whom are from opposition parties",24
1246901431258566659,2020-04-05 20:44:02,"In the days since the Hungarian Parliament gave Orban the right to rule indefinitely by decree, nominally in the name of combating the coronavirus pandemic, his government has been energized by much other than the disease. https://t.co/dBDZ4JxNhv",40
1246890377300316160,2020-04-05 20:00:06,"In Opinion

""I pray for the safety of every medical team working to save lives. But I also pray for our leaders to lead, to put the safety of their citizens far, far above partisan pandering,"" writes Margaret Renkl. https://t.co/BhTIQ7Gu1C",180
1246886597850730496,2020-04-05 19:45:05,Retail campaigning has become all but impossible amid the coronavirus public health crisis. Campaign officials and strategists are trying to carefully game out this new reality. https://t.co/JsuzEAhFPL,32
1246882314493341697,2020-04-05 19:28:04,Jeff Schoep led America’s largest neo-Nazi group for 2 decades. He now says he wants to help destroy it. https://t.co/zAp3c3yTr1,90
1246875305266024448,2020-04-05 19:00:13,"In Opinion

""We can use these searches to help detect unknown Covid-19 outbreaks, particularly in parts of the world with poor testing infrastructure,"" writes Seth Stephens-Davidowitz. https://t.co/qHjVce5GNG",56
1246871351073349632,2020-04-05 18:44:30,A 1960s actress waged legal combat with a toy company for ownership over her husband’s sea-monkey fortune. Listen to @jackhitt tell you a story that is as crazy as it sounds. https://t.co/tTnh2gpDPl,59
1246870591929450496,2020-04-05 18:41:29,"RT @RaphaelMinder: He fought as a teenager in the Spanish Civil War, and five years later drove straight past the Nazis to the city hall to…",619
1246867730340478977,2020-04-05 18:30:07,"""We may be about to confront death on a scale few of us have ever known, while being stripped of time-honored consolations: wakes, funerals, shivas. When the hour calls for togetherness, we will be apart,"" writes Jodi Kantor. https://t.co/98HlHvDhl2",137
1246860726746185728,2020-04-05 18:02:17,"Queen Elizabeth II, in a rare televised speech, will urge Britons to confront the coronavirus with self-discipline and resolve. It is only the third time in her 66-year reign that she has made such an address, apart from her annual Christmas message. https://t.co/6UkXsDDL4h",684
1246856406277513220,2020-04-05 17:45:07,"James Cai’s case was completely new to his doctors. When he grew severely ill, he tapped a network of Chinese and Chinese-American medical colleagues who helped save his life, Susan Dominus reports for @NYTmag. https://t.co/dohuV1laoY",150
1246853996645670914,2020-04-05 17:35:32,RT @juliebosman: The death toll from coronavirus is terrifyingly high. The reality is even higher. @sarahkliff and I investigated: https://…,921
1246842603104079873,2020-04-05 16:50:16,"“We definitely think there are deaths that we have not accounted for.”

Across the U.S., even as coronavirus deaths are being recorded in terrifying numbers — many hundreds each day — the true toll is likely much higher, experts say. https://t.co/7lpXpf5t9d",544
1246836678129602560,2020-04-05 16:26:43,"RT @susandominus: Reader, he survived. And it was a privilege to tell his story: https://t.co/4o1O6zzN7N",377
1246834501076074497,2020-04-05 16:18:04,"For now, keeping the lockdown in place — even for longer than is strictly necessary — is the safest way for Italy to ensure that the virus does not keep spreading.

See more from @atmccann, @PopovichN, @jwf825. https://t.co/7wfdPtWeaw",126
1246832490049941505,2020-04-05 16:10:05,"Breaking News: A Navy captain who was removed from command of a coronavirus-stricken aircraft carrier tested positive for Covid-19, friends say https://t.co/cofAEn2VBB",638
1246829706747535360,2020-04-05 15:59:01,"Italy's lockdown was scheduled to lift on April 3 but officials extended it because the country was still reporting thousands of new infections daily.

“If we started to loosen the measures, all our efforts made so far would have been in vain,” Prime Minister Giuseppe Conte said.",158
1246829704545554432,2020-04-05 15:59:01,"Lombardy, the Italian region where the coronavirus outbreak was first detected, has been hit hardest.

But Lombardy may also be the first area of Italy to see the lockdown’s positive effects. Provinces that limited mobility sooner reduced the rate of infection more quickly. https://t.co/efGptERCAK",81
1246829701483692034,2020-04-05 15:59:00,"Now a month into the nationwide lockdown, the number of new coronavirus cases in Italy seems to be decreasing. But more than 124,000 people have tested positive for Covid-19. And the country's death toll is the highest in the world and still rising. https://t.co/wSWQGJehF8",83
1246829698715443200,2020-04-05 15:58:59,"These extreme measures appear to have worked: Most people stopped moving around.
 
Researchers found sharp reductions in travel after each lockdown took effect. https://t.co/7wfdPtWeaw https://t.co/RHOsJEg4et",52
1246829696504999937,2020-04-05 15:58:59,"But the March 8 order leaked early, and many people fled the area before it took effect.

Just 2 days later, more than 10,000 people across Italy had been infected with the coronavirus. The prime minister banned all nonessential movement across the entire country on March 10. https://t.co/jZIiQhNqR4",55
1246829694173020160,2020-04-05 15:58:58,"Officials closed schools, museums and theaters and canceled religious and sporting events, as more cases were reported across northern Italy.

But others played down the threat of the virus.

A surge of new cases persuaded the government to lock down much of the north on March 8. https://t.co/QxarE00lmO",47
1246829691689893889,2020-04-05 15:58:58,"As the coronavirus spread, the Italian government created “red zones” around 10 towns in Lodi and around the town of Vo’ in Padua province, effectively quarantining 50,000 people. https://t.co/7wfdPtWeaw https://t.co/0Sdp5oboaQ",49
1246829689156644865,2020-04-05 15:58:57,Italy identified its first case of local coronavirus transmission in the province of Lodi on Feb. 20. A cluster of cases appeared to be connected to a 38-year-old man there. https://t.co/7wfdPtWeaw https://t.co/tLctqv1JGk,74
1246829687420133376,2020-04-05 15:58:57,"Italy underestimated the coronavirus outbreak at first, then officials ordered a national lockdown to contain it.

A month later, officials warn it is still too soon to reopen. https://t.co/7wfdPtWeaw",1000
1246822413565923328,2020-04-05 15:30:02,"Wilhelm Burmann, a revered ballet master and teacher who trained generations of dancers, including Alessandra Ferri, Julio Bocca, Maria Kowroski and Wendy Whelan, died on Monday. He was 80. https://t.co/lMxXu68apD",96
1246821142696001538,2020-04-05 15:24:59,RT @arappeport: NEW: Top Democrats press Mnuchin to accelerate airline bailout: “Assistance must not come with unreasonable conditions that…,61
1246818658598424577,2020-04-05 15:15:07,Prime Minister Viktor Orban of Hungary can now rule indefinitely by decree. Doctors worry he won’t use that power to improve the country’s coronavirus response. https://t.co/dBDZ4JxNhv,282
1246814952624717826,2020-04-05 15:00:24,"Chinese-Americans in New York and New Jersey are uniting to fight the coronavirus even as they face racist remarks and some physical attacks. Using mostly WeChat, small groups are creating vast networks to find supplies for doctors and nurses. https://t.co/NpT9OU3pCv",405
1246808573893640193,2020-04-05 14:35:03,"Senator Chuck Schumer and Speaker Nancy Pelosi are urging Treasury Secretary Steven Mnuchin to quickly provide American airlines with direct payroll assistance, and to avoid insisting on overly restrictive terms that could deter companies from taking aid https://t.co/D437UsMs10",150
1246804804896280576,2020-04-05 14:20:04,Small groups from the Chinese-American community in New York and New Jersey are uniting to fight the coronavirus even as they face racist remarks and some physical attacks. They are creating vast networks via WeChat to find supplies for doctors and nurses. https://t.co/jcc9wq6m7o,1024
1246799787053154305,2020-04-05 14:00:08,"As some nations scramble to find protective gear to fight the coronavirus pandemic, Finland has an enviable stockpile of personal protective equipment like surgical masks https://t.co/K8QrJD1Zrb",253
1246794729087516672,2020-04-05 13:40:02,"The coronavirus pandemic has stranded more than one million Chinese students around the world. Fear, politics and the competing priorities of the Chinese government stand in their way of getting home. https://t.co/bQgd9XQeEp",99
1246789713421361159,2020-04-05 13:20:06,Authorities across the United States are reporting an explosion of scams as fraudsters try to capitalize on panic over the coronavirus pandemic  https://t.co/gWFreBDSie,222
1246788447286804480,2020-04-05 13:15:04,"For today, April 5, here’s how to follow the latest on the coronavirus outbreak. We’ll update this every day. 

🌎 Live updates from around the world: https://t.co/kHX9t1C43z
🗽 The latest in New York: https://t.co/tZ78dl2HPg https://t.co/kpvmlISn8N",76
1246784664397844480,2020-04-05 13:00:02,"12 doctors and the chief executive of the New Jersey hospital where Michele Acito works contracted the coronavirus. A colleague died. Ms. Acito was still holding it together, then her mother-in-law, sister-in-law and brother-in-law became ill. https://t.co/oCtC5cKCpy",238
1246779634685030400,2020-04-05 12:40:03,"President Trump appeared to suggest that the government was stockpiling an anti-malarial drug in the hope of treating the coronavirus. Only anecdotal reports and one clinical trial have shown benefits, and the F.D.A. hasn't approved it to treat the virus. https://t.co/qlVNv7jVhv",161
1246774599976726528,2020-04-05 12:20:03,"A Chinese human rights lawyer who took up sensitive cases of journalists, democracy advocates and followers of banned spiritual movements was released from prison after being held for nearly 5 years, his wife said https://t.co/MxdAqj5I70",164
1246769598051028992,2020-04-05 12:00:10,"News Analysis: President Trump's decision to fire the intelligence community’s inspector general underscores his intense distrust of the government that he's overseeing at one of the most dangerous periods in modern American history, writes @peterbakernyt https://t.co/KSVMM2eUVS",390
1246764533722632192,2020-04-05 11:40:03,Weekend briefing: Here’s what you need to know about the week’s top stories https://t.co/mOQYwNQuwB,42
1246756977537167360,2020-04-05 11:10:01,"“We realized the virus was here too late.” Italy’s leaders waited weeks to lock down the country as the coronavirus spread. A month later, officials warn it’s still too soon to open back up. https://t.co/cQg01KBnnB",875
1246754492718202880,2020-04-05 11:00:09,"Independent play encourages time management, organizational skills and more in children. @NYTParenting has tips for parents to encourage it in their kids (and get time alone as a bonus). https://t.co/ddAaCIq17e",91
1246741879577808897,2020-04-05 10:10:02,"""I probably did 3 tattoos a week there.""

When Joe Kintz deployed to Iraq in 2006 as a bomb technician with SEAL Team 5, he took along something unusual: his own tattoo kit. https://t.co/OwdEOTv485",40
1246733319682867200,2020-04-05 09:36:01,"In 1820, the British poet John Keats spent 10 days quarantined as typhus raged. For @nytimestravel, the author Frances Mayes reflects on reading him while sheltering in place. “Across the 200 years, the anguish still vibrates.” https://t.co/iLE4aDO83y",135
1246724304210968576,2020-04-05 09:00:11,"Serve this with rice or rice vermicelli noodles, or tuck it into a lettuce cup or pita with yogurt and fresh herbs
https://t.co/eTE8IE3OBz",60
1246711684141645827,2020-04-05 08:10:02,"Here’s a list of enlightening, entertaining and even uplifting documentaries, to brighten up your darker days https://t.co/Bjic82yWyD",218
1246702885892653057,2020-04-05 07:35:05,Looking for a new game? Try some of these suggestions from our reporters and editors. https://t.co/ZyURLUAEor,42
1246694071927783425,2020-04-05 07:00:03,"Just 5 days after the application process open, Berlin had distributed more than $1.4 billion in coronavirus aid to more than 150,000 self-employed individuals or small businesses https://t.co/M1bqiu30fB",1155
1246681497672790018,2020-04-05 06:10:05,"While the coronavirus has kids at home more, it has relaxed some parents’ stances on communication apps. @NYTParenting has tips from experts on how to keep your kids safe online. https://t.co/SrNCm2IqCJ",64
1246668912537808896,2020-04-05 05:20:05,"As cultural institutions wrestle with how to bring art to the public during the pandemic, smaller ones like the Underground Museum are also trying to figure out how to continue serving communities that have come to rely on them in other ways https://t.co/liL00KF3Hg",69
1246663210364780544,2020-04-05 04:57:25,Read updates in Chinese: 新冠病毒疫情最新消息 https://t.co/oNvdg0zU7v,23
1246661616998940672,2020-04-05 04:51:06,"The latest on the coronavirus: 
—President Trump warned of new hot spots in Pennsylvania, Colorado and Washington, DC
—“The next 2 weeks are extraordinarily important,” said Dr. Deborah Birx, the White House coronavirus response coordinator

Read more. https://t.co/JsHhMXPSMp https://t.co/UBluOfokZB",175
1246648803450654720,2020-04-05 04:00:11,"Nearly 40,000 people flew from China to the U.S. after President Trump enacted travel restrictions that he claims cut off the coronavirus, a New York Times analysis found https://t.co/nt0BZNKDUu",1960
1246643747623927810,2020-04-05 03:40:05,"A new study suggests that even in U.S. counties with a single reported coronavirus case, there's a more than 50% likelihood that a sustained, undetected outbreak — an epidemic — is already taking place.

Explore the data county by county here. https://t.co/KNitS4tPSs",714
1246638714106843137,2020-04-05 03:20:05,"""Everyone in New York City is currently required to spend most of their time hidden away. But there aren’t any extra rules for people like me who just stepped off an international flight."" https://t.co/jWbracb5WY",186
1246633678702346244,2020-04-05 03:00:04,"As hospitals across the U.S. brace for a surge of coronavirus patients, doctors, nurses and other health care workers — even in emerging hot spots — are being furloughed, reassigned or told they must take pay cuts https://t.co/zsox8bjcxx",845
1246628643566243840,2020-04-05 02:40:04,"Scenes from a new America, in: 

Miami
Erie, Colo.
Atlanta
Boston
Amherst, Mass.
Pittsburgh
Norman, Okla.
Orlando, Fla.
Pascagoula, Miss.
Portsmouth, Ohio
Los Angeles
North Kansas City, Mo.
Kirkland, Wash.
Berkeley, Calif.
New York
and Newton, N.C. https://t.co/oz4bwDxqKo",145
1246623613199036416,2020-04-05 02:20:05,"“I’m already pretty well-conditioned to spend a lot of time in isolation."" In places where social distancing was already a way of life, the relentless pandemic has begun to reshape the economy. https://t.co/K0HZ9Jgahl",109
1246618622887329792,2020-04-05 02:00:15,"There are about 2 dozen medical professionals in Congress, including 17 doctors and a former health secretary. Some are drawing on their expertise to push for more aggressive federal measures to fight the coronavirus.
https://t.co/7XelTuIjFe",123
1246615590275604486,2020-04-05 01:48:12,"RT @SominiSengupta: Since this story was published, I heard from several people, including a pediatrician in training redeployed to adult C…",70
1246613548790353921,2020-04-05 01:40:05,A man said he spent 5 hours with his dying mother at a Texas nursing home before learning she had tested positive for the coronavirus. He's now grieving in self-quarantine. https://t.co/2bP34dmSc5,275
1246608508650426369,2020-04-05 01:20:03,"“I don’t like having to wake up in the morning and feeling like I have to be ready for battle with major corporations.”
https://t.co/yU8sGPlrPn",68
1246604572241670152,2020-04-05 01:04:25,RT @marclacey: A virtual recovery meeting. A police officer donned in a face mask. A pastor without a congregation. A funeral director tryi…,58
1246603527134294016,2020-04-05 01:00:16,"The coronavirus pandemic is not just impacting parents and pregnant people, but prospective parents forming families through surrogacy, foster care and adoption as well https://t.co/gmfudfV5Xt",56
1246598458863235072,2020-04-05 00:40:07,"Nonprofit community health centers are a crucial link in a fragmented American health care system that too often fails to reach into poor neighborhoods. Now, just when they're most needed, the coronavirus pandemic has depleted their revenues. https://t.co/1yNiSmW7Mp",175
