id,created_at,text,retweet_count
1249779399861420032,2020-04-13 19:20:03,"President Trump's trade adviser Peter Navarro, who is now coordinating the country’s medical supply chain, accused health experts of being ""tone deaf,"" arguing that a prolonged economic shutdown could carry its own negative health effects https://t.co/YogyVVy5e3",144
1249774423818866695,2020-04-13 19:00:16,"Contrary to popular belief, the famous Rolling Stones logo wasn't meant to represent Mick Jagger’s tongue and lips — at least intentionally https://t.co/ckBYeW9tnK",81
1249769334643331072,2020-04-13 18:40:03,"The U.S. Supreme Court on Monday said it would hear arguments by telephone over 6 days in May — and for the first time, the public will be able to listen in live https://t.co/fHTAR8Ygjz",207
1249763474026172417,2020-04-13 18:16:46,"Bernie Sanders has endorsed Joe Biden, taking a major step toward bringing unity to the Democratic Party’s effort to unseat President Trump https://t.co/jzfomaNahy",2463
1249759333212135425,2020-04-13 18:00:19,"RT @AsteadWesley: NEW: I interview @AOC abt Joe Biden and Democratic unity. What concessions she wants (plenty), if they've ever talked (no…",937
1249756767623557120,2020-04-13 17:50:07,"Rudimentary hygiene. Casual human proximity. Our correspondent's travels with the French Foreign Legion in West Africa capture a time before the coronavirus outbreak, when full-body contact and shared surfaces were still OK. https://t.co/RNJSWPkDY0",64
1249752979944738818,2020-04-13 17:35:04,"“We will be forced to recognize that asking and accepting help is not a moral failing but a human need. Social animals require society in order to survive,” Tanzina Vega writes for @NYTparenting. https://t.co/049KxfzGcW",118
1249750470282919943,2020-04-13 17:25:06,President Trump’s re-election campaign and the Republican National Committee said Monday they had raised $212 million in the first 3 months of 2020 https://t.co/rKMmnjtEUB,119
1249744872787054592,2020-04-13 17:02:51,"RT @nytopinion: Editorial board member @mcottle is discussing her essay on Trump’s coronavirus press conferences, life in lockdown and anyt…",75
1249744205917966342,2020-04-13 17:00:12,"In Opinion

Joe Biden writes, “An effective plan to beat the virus is the ultimate answer to how we get our economy back on track. So we should stop thinking of the health and economic responses as separate. They are not.” https://t.co/dFbOMFDSj7",273
1249742290282852352,2020-04-13 16:52:35,"Gov. Andrew Cuomo of New York said that he thought it was possible that “the worst is over” in the coronavirus crisis, but only if “we continue to be smart"" https://t.co/8spaVRrAWq https://t.co/Gm7RWq1zVP",78
1249739148564594690,2020-04-13 16:40:06,"In a Brooklyn hospital at the center of the coronavirus crisis, nearly 200 babies have arrived since March. Some pregnant women have fallen extremely ill, but doctors are winning battles for their lives and their children’s. https://t.co/gDAusuQ3g2",234
1249734859854974976,2020-04-13 16:23:04,"More than 10,000 people have died from the coronavirus in New York, Gov. Andrew Cuomo said on Monday. Though the number of deaths is rising, Cuomo also said ""the curve continues to flatten."" https://t.co/PhgWX2zhm8 https://t.co/gkRZGVySk5",187
1249733609482850306,2020-04-13 16:18:06,"We also translated our look at a UN inquiry into attacks on protected sites in Syria. It remained silent on Russia’s role. Our investigation, published in December, found that Russian pilots were bombing near a school and hospital when they were damaged. https://t.co/rZkafzzSZt",101
1249733608341979141,2020-04-13 16:18:05,"The New York Times has translated into Russian our October investigation that used cockpit recordings, flight logs and videos to show how Russian pilots repeatedly bombed hospitals in Syria in 2019. https://t.co/cW1jyhVM2A",185
1249733607192657920,2020-04-13 16:18:05,"В нашем материале мы расследовали несколько из самых кровавых атак в Сирии в 2019—авиаударов по городскому рынку и лагерю беженцев. Согласно этому расследованию, ответственность за атаки ложится на российских пилотов.
Видео доступно с русскими субтитрами. 
https://t.co/e97hjwDvTE",19
1249733605921783808,2020-04-13 16:18:05,"Результаты нашего расследования  этих же атак, которое мы впервые опубликовали в декабре, показало, что российские пилоты наносили авиаудары по территории школы и госпиталя.",8
1249733604881596423,2020-04-13 16:18:04,"Также на русском языке доступен наш материал о расследовании ООН авиаударов по гражданским объектам в Сирии, которые находились в списке подзащитных объектов. На прошлой неделе ООН опубликовала отчет, в котором Россия напрямую в этих атаках не обвиняется. https://t.co/BeJeGNIfJz",14
1249733603753410560,2020-04-13 16:18:04,"Проанализировав радиограммы российских ВКС, записи споттеров, а также видео очевидцев, наше расследование показало, как в течении двенадцати часов российские пилоты атаковали четыре госпиталя в Сирии. Этот материал октября 2019, теперь доступен на русском https://t.co/Ghr00Zqu5a",89
1249729108101169153,2020-04-13 16:00:12,"The monarchies of the Persian Gulf have long been accused of mistreating migrant workers. But the coronavirus has made things worse, as they are confined to cramped, dirty dorms, deprived of income and unable to return home because of travel restrictions. https://t.co/1kSKhRfdVd",77
1249724043047194627,2020-04-13 15:40:05,"F.N. Souza, who started a collective of renegade artists in 1947, embraced the sacred and profane in erotically charged images. Several of his paintings fetched record auction prices for Indian art. https://t.co/ApaTBqyor1",37
1249719025501962240,2020-04-13 15:20:08,The ABC anchor George Stephanopoulos revealed that he has tested positive for the coronavirus https://t.co/WDtYmmZ8wH,89
1249714013224816642,2020-04-13 15:00:13,"In Opinion

""We need to start paying closer attention to the stories of coronavirus survivors,"" writes Fiona Lowenstein. https://t.co/nLYEgkKYob",184
1249708934325325824,2020-04-13 14:40:03,"In Opinion

""We don’t know when we might be able to return to a new normal. We don’t know when any of this will end for good. There is, at present, no plan from the Trump White House on the way forward,"" writes @cwarzel. https://t.co/HrUc8khj1U",145
1249705134235451393,2020-04-13 14:24:57,"RT @tmagazine: The creative circles defining the culture, on the cover of T's 2020 Culture issue https://t.co/eYIVKCJc1p #TCultureIssue htt…",90
1249703918440939520,2020-04-13 14:20:07,"Apollo 13 — surviving disaster, in the astronauts’ own words and photographs https://t.co/JOL7MsxzF0",60
1249703484963815425,2020-04-13 14:18:23,"The sailor's death is the first among the Theodore Roosevelt's crew, which numbers more than 4,800. The ship's captain, Brett E. Crozier, was relieved earlier this month after requesting help from Navy officials for his virus-stricken crew. https://t.co/pmXpRX0Jm6 https://t.co/GAQNdLDHh8",622
1249703204901847041,2020-04-13 14:17:17,Breaking News: A sailor died amid hundreds of viral infections aboard the aircraft carrier the Theodore Roosevelt. The crisis encapsulates the hollowing out of Navy leadership under President Trump. https://t.co/u33YkZysTs,909
1249698952464740359,2020-04-13 14:00:23,"Are we — humanity — dreaming with more frequency, and more vividly, right now? The answer is likely yes — at least for many people. https://t.co/Fa61HPWV5y",230
1249694837181464577,2020-04-13 13:44:02,Here are 5 takeaways from our examination of the Trump administration’s slow response to the coronavirus pandemic https://t.co/S6V2tgT1kV,121
1249694834849349637,2020-04-13 13:44:01,"President Trump was slow to absorb the scale of the risk the coronavirus pandemic posed to the U.S. and to act accordingly, our examination of the administration’s response reveals https://t.co/tUufK4NxCa",199
1249694831674380291,2020-04-13 13:44:00,"The ""Red Dawn"" emails capture extraordinary conversations among infectious disease doctors and medical experts, showing their rising sense of frustration with the Trump administration’s slow response to the coronavirus.

See key exchanges from the emails.
https://t.co/ZpFEgHo5wR",510
1249693835241848842,2020-04-13 13:40:03,"“Shelter in place” is a dictate that assumes the existence of shelter — a safe, stable, controlled environment. “The pandemic is a reminder that privacy is at a premium among the poor — hard to find and extremely valuable."" https://t.co/8xa1XvBA8C",203
1249691333620621313,2020-04-13 13:30:06,"In Opinion

""We need everyone to treat domestic workers like human beings,"" writes Melissa St. Hilaire. ""We deserve respect and a seat at the table. Our work has value. Without us, you cannot do your jobs. Just as we need you to survive, you need us."" https://t.co/A9zqSHVqLS",197
1249688297787609090,2020-04-13 13:18:02,"Condé Nast sent a memo to its 6,000 employees outlining pay cuts for high earners and reduced hours for other employees. The memo said the magazine publisher also planned to seek government assistance in Britain and the European Union. https://t.co/1E0H8COUqo",87
1249685045452984320,2020-04-13 13:05:07,"At least 18 people were dead after tornadoes and severe thunderstorms swept across the southern U.S. on Sunday and early Monday, emergency officials said https://t.co/jXtOvrvymB",149
1249683779079282688,2020-04-13 13:00:05,"New research shows for the first time that Beijing’s engineers appear to have directly caused the record low levels of water in Thailand, Laos, Cambodia and Vietnam https://t.co/3gMy14tRn1",3508
1249678754248622081,2020-04-13 12:40:07,"“The Tiger King and I,” a new follow-up installment Netflix dropped on Sunday, was mostly a brief reunion with some of the series’s colorful characters. But there were a few revelations. https://t.co/krzRzQPPTp",34
1249673718730821634,2020-04-13 12:20:07,Foreign-born health workers have been lining up to take jobs at U.S. hospitals and help fight the coronavirus. But many are running into roadblocks.  https://t.co/yBsjeOshAG,105
1249669920838881285,2020-04-13 12:05:01,"Screaming children, worried employees, sick parents and anxious grocery shoppers: This is a peek inside our new world. Listen to today's episode of The Daily. https://t.co/Owpq6v50WU",119
1249668240147652608,2020-04-13 11:58:20,"As the coronavirus swept the globe, it was accompanied by a surge of false information. Analysts say that President Vladimir Putin of Russia has played a central role in the spread of disinformation as part of a wider effort to discredit the West. https://t.co/0WcjPOACsw",1187
1249663655756660737,2020-04-13 11:40:07,"Apollo 13 almost killed 3 NASA astronauts. How much safer will it be the next time that people head to the moon, more than 50 years later?
https://t.co/mfI15WL3tR",88
1249658600345255936,2020-04-13 11:20:02,"“We are being asked to do things that are tearing at our souls.”

Doctors are facing the heart-wrenching task of arranging conversations between critically ill coronavirus patients and their families – often so they can say goodbye. https://t.co/vyg3tnoQ5L",399
1249656555550760960,2020-04-13 11:11:54,"For today, April 13, here’s how to follow the latest on the coronavirus outbreak. We’ll update this every day. 

🌎 Live updates from around the world: https://t.co/Srck5vxZds
🗽 The latest in New York: https://t.co/zW9JuL2K8B
📊 Markets news: https://t.co/THvgNyhgAA https://t.co/uSX7DSJ37M",61
1249653583878008833,2020-04-13 11:00:06,"Alexandria Ocasio-Cortez said she intended to support Joe Biden, the presumptive Democratic nominee, but the “process of coming together should be uncomfortable for everyone involved — that’s how you know it’s working” https://t.co/HJRP2j0yim",640
1249648546728599557,2020-04-13 10:40:05,"Chinese customs officials, facing accusations from Europe that some medical supplies have been defective, say they will inspect every shipment https://t.co/zZEK0jYr0R",137
1249648278905421826,2020-04-13 10:39:01,Morning briefing: Here's what you need to know to start your day https://t.co/xwgWFDk1kZ,30
1249643636293283840,2020-04-13 10:20:34,"They come to say “good morning” and “good night.” They tell him that spring has arrived. They whisper that they miss him.

Dr. Li Wenliang tried to warn China about a strange, deadly virus, but was silenced. Now, traumatized people visit his spirit online. https://t.co/WDDDdhyXoV",270
1249638473117679619,2020-04-13 10:00:03,"After India’s health ministry repeatedly blamed an Islamic seminary for spreading the coronavirus, a spree of anti-Muslim attacks has broken out across the country https://t.co/kPAuWbDtnD",532
1249633452095344640,2020-04-13 09:40:06,"The Mossad, Israel's storied spy service, is not normally in the public health business. But it may turn out to have been Israel's most potent asset in the race to acquire enough equipment for the country to handle the coronavirus scourge. https://t.co/DNsUf8BT6u",226
1249628425142353920,2020-04-13 09:20:08,Washing with wet wipes and sharing forks: @ruthmaclean joined France's troops on the ground in West Africa in a different era — just before coronavirus hit. https://t.co/r87cFYyMks,56
1249623415155236864,2020-04-13 09:00:13,"In the 16th century, Malacca was positioned at the fulcrum of the world, linking the Pacific and Indian Oceans. Its decline speaks to the promise and perils of globalization. https://t.co/FGKIsBZb1E",83
1249618348188602374,2020-04-13 08:40:05,"About 140 million tulip stems were destroyed over the past month. Demand for tulips dropped precipitously as flower shops around the globe have shut, consumers have gone into lockdown and celebrations have been canceled. https://t.co/Eluo14rYZG",157
1249613316902785025,2020-04-13 08:20:06,Aileen Baviera was a formidable expert on China and one of the Philippines’ leading scholars. She has died at age 60 from complications of the coronavirus. https://t.co/Qh1Ai9CCMF,247
1249608292386648064,2020-04-13 08:00:08,"In Opinion

Ruchir Sharma writes, ""Though many rich economies have ground to a halt under strict lockdowns to contain the coronavirus, many low- and middle-income countries have decided they can’t afford an all-out fight""
https://t.co/BKqyVG36Gr",120
1249603231682043904,2020-04-13 07:40:01,"As the coronavirus lockdowns and travel bans stall tourism, some of Africa's endangered and threatened wildlife is paying a price https://t.co/CT43XsG965",367
1249598214162059265,2020-04-13 07:20:05,"Oil prices rose on Monday, one day after petroleum-producing nations agreed to the largest production cut ever negotiated https://t.co/bZvL5Ef04T",77
1249595687806926849,2020-04-13 07:10:02,RT @KeithBradsher: Irresponsible in terms of #coronavirus and traffic safety at the same time? 3 people in an Audi A8 maintained an average…,48
1249593174269595649,2020-04-13 07:00:03,Europe morning briefing: Here's what you need to know to start your day https://t.co/SZZTVUBj4p,28
1249588143537491968,2020-04-13 06:40:04,"As countries around the world compete ferociously for limited supplies during the pandemic, they are turning to any help available. Israel’s powerful spy service has been deeply involved in the country’s fight against the coronavirus. https://t.co/sWHHt8DTZU",63
1249583120585809920,2020-04-13 06:20:06,"The coronavirus has terrified airline crews, yet some are still flying. Already, hundreds of flight attendants and pilots have fallen ill and at least five have died from the virus. https://t.co/BRSWZGksBD",367
1249578068731101184,2020-04-13 06:00:02,RT @katie_thomas: A small study of chloroquine for coronavirus patients in Brazil was halted when patients who took higher doses developed…,476
1249573047364919296,2020-04-13 05:40:05,"9 new books recommended by critics and editors at The New York Times
https://t.co/dgNJq98Rmf",97
1249568020252577792,2020-04-13 05:20:06,"Sonoma County and Napa Valley vintners are offering remote tastings that combine virtual guidance with real-world wine consumption
https://t.co/WzJqX4KZis",81
1249563330802520064,2020-04-13 05:01:28,Read updates in Chinese: 新冠病毒疫情最新消息 https://t.co/ybgI6h5Jw7,17
1249562985271562246,2020-04-13 05:00:06,"President Recep Tayyip Erdogan declined to accept the resignation of Turkey’s interior minister, who offered it after taking responsibility for an abruptly announced curfew over the weekend that set off panic buying 

Latest updates: https://t.co/82tmKCtcX8",65
1249557944640954369,2020-04-13 04:40:04,A small study in Brazil was halted early for safety reasons after coronavirus patients taking a higher dose of chloroquine developed irregular heart rates that increased their risk of a potentially fatal heart arrhythmia https://t.co/FjToqbMXu6,4537
1249552910096220160,2020-04-13 04:20:03,"RT @ckrausss: The oil production deal engineered by Saudi Arabia, Russia and the United States is done, with President Trump taking a media…",63
1249547887354273792,2020-04-13 04:00:06,"Spring, normally a season of hope, instead has become a period of endless lost things. Still, people do their best to make accommodations and fixes, to carry on as much as possible.
https://t.co/eqI4qhDzZq",64
1249542840943869953,2020-04-13 03:40:03,"The video game Plague Inc. has been popular for years, but suddenly it's a disturbing variation of the world we are all living in. Some players are finding solace in it, too. https://t.co/mtWERhFbNw",235
1249537803156959233,2020-04-13 03:20:02,RT @johnismay: Inside the TR: Reactor Department was the first to go down. Dr's estimated 50-67 could die. Other senior officers wanted to…,3562
1249532787276816386,2020-04-13 03:00:06,How do you break up your kids' fight? A bouncer suggests stopping the fight before it starts; a therapist suggests finding common ground and a referee says let them duke it out. https://t.co/EgS3rxfhzx,67
1249527746616852480,2020-04-13 02:40:04,"Governors and mayors acknowledged the delicate balance between aggressively combating the virus and limiting the economic pain, but they said that public health concerns were their priority https://t.co/54KclT2QZv",196
1249522711438798849,2020-04-13 02:20:04,"RT @Kim_Barker: Unlike other Covid-19 clusters, this one happened at a meeting of top health care professionals whose job it was to fight d…",128
1249517698398261250,2020-04-13 02:00:08,How the coronavirus crisis aboard the aircraft carrier Theodore Roosevelt exposed a rift and brought down the acting Navy secretary https://t.co/yjIThPnA9e,102
1249512647780970497,2020-04-13 01:40:04,"3 pregnant women. All were critically ill from the coronavirus. Here’s how one hospital in Brooklyn managed to save them all, and their babies. https://t.co/wRxSLBDcL5",523
1249507610396708864,2020-04-13 01:20:03,"RT @jackhealyNYT: Lines for food banks. Lines for groceries. Lines for covid testing. 

@marclacey noticed these glaring signs of overwhelm…",398
1249502576049098754,2020-04-13 01:00:03,"The Biogen meeting was one of the earliest examples in the U.S. of what epidemiologists call “superspreading events” of Covid-19, where a small gathering of people leads to a huge number of infections https://t.co/JZch2nXhfI",172
1249497542028648449,2020-04-13 00:40:03,"""Like everyone, I have a large and aspirational pile on my nightstand,"" says Joseph E. Stiglitz. ""In fact, my wife recently bought me a bigger nightstand so we’d have more room for the books I want to read."" https://t.co/Bht5z5HL8P",190
1249492508540878860,2020-04-13 00:20:03,"RT @Nataliekitro: Weeks ago, Boeing said it didn’t want federal money or the government wanted a stake in the company.

Now the company is…",203
1249487497941450753,2020-04-13 00:00:08,"A storm made its way across East Texas and into northern Louisiana, where a tornado damaged houses and commercial buildings, and into Mississippi, where at least 3 people died https://t.co/w1Pgfv5JQt",72
1249482447877738501,2020-04-12 23:40:04,"The disagreement between NYC Mayor Bill de Blasio and New York Gov. Andrew Cuomo frustrated and confused parents, teachers and other school employees https://t.co/4k7rZGR3et",81
1249477411680530433,2020-04-12 23:20:03,RT @EricSchmittNYT: Coronavirus raced through a Navy warship in the Pacific. Doctors said dozens could die.  How a captain’s plea for help…,168
1249472428008509440,2020-04-12 23:00:15,"Walt Disney World in Florida plans to furlough about 43,000 workers after it closed last month because of the coronavirus pandemic, the company and a union coalition representing the workers said
https://t.co/pYuyCxkiGr",215
1249469895642877953,2020-04-12 22:50:11,"RT @cliffordlevy: Scoop: How did de Blasio tell Cuomo that he was shutting schools for the academic year?
By last-minute text.
A deep look…",81
1249467349989765120,2020-04-12 22:40:04,"""After 40 years, Yankovic is now no longer a novelty, but an institution."" For @NYTmag, our writer @shamblanderson wrote about Weird Al Yankovic and his enduring appeal. https://t.co/wZSkEpF82X",65
1249457328233025543,2020-04-12 22:00:15,"Gianni Zampino may have given his father a fatal case of the coronavirus. Watch our video following Gianni as he returns to the home they shared.
https://t.co/846FI72Yrg",89
1249452242610069504,2020-04-12 21:40:02,"Across Europe, leaders moved gingerly to calibrate lockdown measures, leery of setting off surges in new infections as they seek to mitigate the economic disaster created by the virus
https://t.co/GU23Yt84Vo",73
1249447219717079041,2020-04-12 21:20:05,RT @danielle_ivory: Nursing homes and long-term care facilities for the elderly have been ravaged by the coronavirus. The ⁦@nytimes⁩ wants…,49
1249442188360114177,2020-04-12 21:00:05,"Fresh spring onions make this effortless sausage and potato sheet-pan supper feel elegant, but you could just as easily use scallions or leeks
https://t.co/FYIp5qk7eG",73
1249437168390541317,2020-04-12 20:40:09,"In Opinion

""Americans are about to see how fragile our right to vote really is,"" writes David W. Blight, a professor of history at Yale.
https://t.co/Kqj1tKP4Dj",383
1249432121304920065,2020-04-12 20:20:05,"After 40 years, Weird Al Yankovic is now no longer a novelty, but an institution. In these absurd times, listen to @shamblanderson tell the story of an absurd artist.
https://t.co/Nieazg35PE",76
1249430808429035520,2020-04-12 20:14:52,"Read this story in English:
https://t.co/6apdziUoao",149
1249429592730984448,2020-04-12 20:10:02,"Pocas áreas del sistema de salud venezolano han sufrido tanto como las maternidades. Los médicos emigran. No hay insumos básicos. Para comprender la magnitud de la crisis, pasamos semanas con mujeres embarazadas que intentaban navegar un sistema destrozado.https://t.co/cxeO3tMiW7",212
1249427100517502986,2020-04-12 20:00:08,"RT @carolrosenberg: NEWS: A leading, pioneering defense lawyer who specializes in death penalty cases has been chosen to represent Ramzi bi…",62
1249422046930579456,2020-04-12 19:40:03,"Stirling Moss, the swashbuckling racecar driver whom many considered the best in the world, died on Sunday at age 90
https://t.co/cyN4vz639o",126
1249417031092502528,2020-04-12 19:20:07,"In interviews, Democrats and Republicans alike said President Trump appeared to be in over his head in dealing with the coronavirus, and that Dr. Fauci and Dr. Deborah Birx were the more reliable for accurate information.
https://t.co/q2JKmtEnkF",572
1249415447562391554,2020-04-12 19:13:50,"RT @yaffebellany: Farmers are dumping millions of gallons of milk. Burying thousands of onions. Plowing vegetables back into the soil. 

Th…",484
1249412039698788352,2020-04-12 19:00:17,"Read updates in Chinese: 新冠病毒疫情最新消息
https://t.co/SwzpO8D0XZ",16
1249410443816439808,2020-04-12 18:53:57,Oil-producing nations agreed to cut worldwide output by 9.7 million barrels a day — well short of how much demand has fallen because of the pandemic https://t.co/jaCz0gdBbW https://t.co/ioc1Vdt6He,58
1249409370716323842,2020-04-12 18:49:41,"Read more of @sherifink's reporting  — on the battles doctors, nurses, respiratory therapists and other medical staff are winning and those they’ve lost — from inside the Brooklyn Hospital Center:
https://t.co/szElIBZ21m",50
1249409152423772163,2020-04-12 18:48:49,"Basharrie McKenzie is another expectant mother who spent time in the Brooklyn Hospital Center ICU with Covid-19.

""You’re going to come back and deliver a healthy, beautiful baby,"" a nurse told her when she was allowed to leave the hospital. ""You made it!""
https://t.co/iV21f9Ss6A",91
1249406591788560385,2020-04-12 18:38:38,"After Precious woke up and her condition improved, Dr. Byer and a resident physician rolled a tablet computer into her room.

Smiling, crying, she watched her baby over a video stream. ""Hey,"" she called to him. He opened his eyes. ""There you go. Hi.""
https://t.co/kubCMHNHZl",135
