id,created_at,text,retweet_count
1244596743699914754,2020-03-30 12:06:01,"Breaking News: The Tokyo Olympics, postponed because of the coronavirus pandemic, will begin on July 23, 2021 https://t.co/9rpTFzCYXe",131
1244595240545275905,2020-03-30 12:00:03,Morning briefing: Here's what you need to know to start your day https://t.co/wrMd72ItXu,22
1244592971447762944,2020-03-30 11:51:02,Facebook announced that it would dole out $25 million in grants to local news outlets. It will also spend $75 million in a marketing drive aimed at news organizations internationally in response to the economic downturn prompted by the coronavirus. https://t.co/I9Slx20UAR,80
1244590129232084992,2020-03-30 11:39:44,"For today, March 30, here’s how to follow the latest on the coronavirus outbreak. We’ll update this every day. 

🌎 Live updates from around the world: https://t.co/4uLlotyZIp
🗽 The latest in New York: https://t.co/3TF2Ey9tjW
📊 Markets news: https://t.co/VxqdIvk6Rg https://t.co/22Nioo3XQt",43
1244585182574915585,2020-03-30 11:20:05,"“It’s a moment of deep crisis for the local news business, which could have been blown over by a light breeze and is now facing a hurricane. But it’s also a moment of great promise for a new generation of largely nonprofit local publications.” —@benyt https://t.co/a6ydNTG8FH",18
1244580170457067520,2020-03-30 11:00:10,RT @aimee_ortiz: A group of residents from an island town in Maine cut down a tree and dragged it into the middle of a road in an attempt t…,144
1244575108196454401,2020-03-30 10:40:03,"News Analysis: ""Had the president acted sooner, thousands of new ventilators would probably be coming off production lines next month, when they are likely to be desperately needed."" https://t.co/S8czeeVkgt",4140
1244570084527550465,2020-03-30 10:20:05,"Although Twitter, Facebook and Google are better equipped to deal with the types of election interference they faced in 2016, they are struggling to handle the new challenges of 2020. 

They are careening from crisis to crisis as their foes change tactics. https://t.co/ZAUmjXfjhQ",35
1244567565394993152,2020-03-30 10:10:05,"As countries around the world enact lockdowns, some world leaders have scoffed at containment efforts. The president of Belarus called the coronavirus “nothing else but a psychosis” and has joked that a shot or two of vodka a day will poison the virus. https://t.co/lMQQWijIOp",131
1244565087765114880,2020-03-30 10:00:14,"A commercial aircraft carrying 80 tons of gloves, masks, gowns and other medical supplies from Shanghai touched down in New York on Sunday, the first of 22 scheduled flights that White House officials say will funnel much-needed goods to the U.S. https://t.co/ePwrPmztSI",1872
1244560020467060744,2020-03-30 09:40:06,"Officials in Spain said testing kits it bought from a Chinese company had only a 30% accuracy rate, rather than the 80% rate they had expected https://t.co/v6xCEDewZy",428
1244557508666155008,2020-03-30 09:30:07,"Corporations are saving cash, cutting costs and refinancing debt to manage the economic fallout of the coronavirus. Restructuring and bankruptcy experts are already getting calls. https://t.co/HMEcz2alMS",45
1244554981233102848,2020-03-30 09:20:04,"The U.S. presidential campaign, which typically dominates news coverage for much of the year, could look more like one of Britain’s six-week general election sprints https://t.co/8S7ImxJVGx",77
1244549982897635328,2020-03-30 09:00:13,"Ahead of November’s election, American intelligence officials and others are on high alert for mischief from Russia’s Internet Research Agency https://t.co/9ElZm0qP3w",49
1244544915402567680,2020-03-30 08:40:05,"Across Europe, rich city dwellers have been fleeing epicenters of the coronavirus crisis to their second homes, potentially spreading the virus in regions with few hospitals to handle a surge in the sick https://t.co/s84G8AXq1q",156
1244539889112285184,2020-03-30 08:20:06,Oil prices have plummeted. The coronavirus has arrived. The government is out of money. A curfew has shut down commerce and thrown people out of work. Iraq is cratering on almost every front. https://t.co/01y6ZsZLrv,94
1244534890353307649,2020-03-30 08:00:14,"France's war in the Sahel region in West Africa resembles America's in Iraq and Afghanistan: A fight against a technically much weaker enemy in harsh terrain, with no end in sight. https://t.co/RrhFV3zgkw",63
1244529805305032704,2020-03-30 07:40:02,"The struggle for women’s equality is lagging badly in Egypt, where only 25% of women are in the labor force. But in one field, Egyptian women are dominant: lion taming. https://t.co/ISmxAYaABe",52
1244524770013650944,2020-03-30 07:20:01,"After SARS, Chinese health officials built a system to track contagions while evading political meddling. It broke down when the coronavirus appeared. https://t.co/ZOliIGN6hS",677
1244519767542763520,2020-03-30 07:00:09,Europe morning briefing: Here's what you need to know to start your day https://t.co/Brn3O2Dkui,23
1244514712064266241,2020-03-30 06:40:03,"A plane used as an air ambulance by the Philippine health department to fight the coronavirus outbreak burst into flames as it took off from Manila’s airport for Japan on Sunday night, killing all onboard https://t.co/iB3iPUjCig",198
1244509687669809153,2020-03-30 06:20:06,A Sri Lankan soldier convicted of killing 8 civilians — 3 of them children — has been pardoned. Rights groups accused President Gotabaya Rajapaksa of taking advantage of the global chaos to free the soldier. https://t.co/srRzU06PVL,75
1244504669302513664,2020-03-30 06:00:09,"Knockoffs of Chinese Clorox. Fake N95 respirators. As demand for virus protection soars and China ships to the world, faulty products are entering the supply chain. https://t.co/C1YOnIBU5x",375
1244502124341481472,2020-03-30 05:50:02,There is no firm proof that gargling prevents respiratory infections caused by the coronavirus — or any virus or bacteria. But there’s also little downside. https://t.co/1QzFGskK4S,104
1244494586845822979,2020-03-30 05:20:05,"Every soccer league in Europe has closed down because of the coronavirus except one: Belarus. The country's president has suggested the virus is a “psychosis,” and has named vodka, saunas and working on a farm as potential cures for it. https://t.co/GkSQqmGYQH",143
1244492054870269952,2020-03-30 05:10:02,RT @NYTHealth: Feeling crazy anxious over coronavirus? Who isn’t? We talked to some mental health experts about how to calm down. https://t…,193
1244489552452091905,2020-03-30 05:00:05,"The Seattle area, home of the first known coronavirus case in the United States, is now seeing evidence that strict containment strategies, imposed in the earliest days of the outbreak, are beginning to pay off — at least for now https://t.co/VfSqvpgdEu",370
1244484515617296385,2020-03-30 04:40:04,RT @Abihabib: India's lockdown has left hundreds of thousands of migrant workers without homes and jobs. India already had one of the world…,421
1244482009986215936,2020-03-30 04:30:07,"RT @ByMikeBaker: An update from Seattle area:
• Hospitals still seeing ""manageable"" caseloads
• Data models suggest transmission rate has d…",2091
1244479490400694273,2020-03-30 04:20:06,"Fearful of the coronavirus’s spread, some rural communities have issued bluntly worded orders for second homeowners to stay away https://t.co/JpOidszUk3",69
1244476970374770689,2020-03-30 04:10:05,"Markets in the Asia-Pacific region opened broadly lower on Monday, as investors remained nervous about global economic prospects despite stabilization efforts from governments around the world https://t.co/DPNfKPYSap",34
1244474457139433479,2020-03-30 04:00:06,"Sabrina Ionescu, who was once called ""the puppet master"" by Kobe Bryant, is projected to be the top draft pick this April in the WNBA. But first, she is facing tragedy and canceled games in what was supposed to be a dream college season. https://t.co/BaYTrTHFdw",26
1244470662665850882,2020-03-30 03:45:01,"RT @kevinroose: New by me, @sheeraf and @nicoleperlroth: a deep dive into how Facebook, Twitter, and Google are preparing for the 2020 elec…",91
1244467754331144192,2020-03-30 03:33:28,Read updates in Chinese: 新冠病毒疫情最新消息 https://t.co/aGf3iwMDlx,20
1244466907169935360,2020-03-30 03:30:06,"Two of the U.S.’s largest health insurers agreed to protect their customers from out-of-pocket costs if they need treatment for Covid-19, a decision that represents a rapid change in how companies are responding to the coronavirus pandemic https://t.co/8nhf1ZP0jd",114
1244464391556341766,2020-03-30 03:20:06,"Joe Diffie, a Grammy-Winning country singer whose hits included “Home” and “Pickup Man,"" died on Sunday in Nashville. He had announced on Friday that he had contracted the coronavirus. https://t.co/1J0mRWFW88",164
1244459364104183810,2020-03-30 03:00:07,"RT @RaR: It turns out measures put in place to curb the coronavirus can save lives during a tornado, too. ""Actually, that’s the blessing.""…",95
1244454321074450436,2020-03-30 02:40:05,"RT @SangerNYT: With the indefatigable @maggieNYT, a look at what happened when the White House confronted the modern Arsenal of Democracy p…",94
1244452254691835906,2020-03-30 02:31:52,"In interviews with 2 dozen executives and employees at Facebook, Google and Twitter over the past few months, many described a tense atmosphere of careening from crisis to crisis to handle the newest tactics being used to sow discord and influence votes https://t.co/KDcN4r8744",79
1244449292586188802,2020-03-30 02:20:06,"RT @davidwchen: ""It’s only day two but it feels like week five"": My story, with a big assist from a bedridden @elizashapiro, on how NYC tea…",62
1244444273900163073,2020-03-30 02:00:10,"President Trump said social distancing guidelines would remain in place until April 30, backing away from his original suggestion of ending them by Easter https://t.co/nLv39cOcUq",163
1244441734295236610,2020-03-30 01:50:04,"RT @jimdwyernyt: About New York: A potent message from 9/11, the morning of New York's last mortal catastrophe, has new meaning and power.…",132
1244439224213999619,2020-03-30 01:40:06,"—New York State exceeds 1,000 coronavirus deaths
—Gov. Cuomo warns that the pandemic’s toll could grow worse
—New York City has a 1-week supply of medical supplies to care for any New Yorker who is sick, Mayor de Blasio said

https://t.co/n2v5gL1Pvr",144
1244436693094105089,2020-03-30 01:30:02,RT @benyt: How to save local news https://t.co/GTLQKvyvK7,102
1244431675288948738,2020-03-30 01:10:06,"The stalled efforts to create a new class of cheap, easy-to-use ventilators highlight the perils of outsourcing projects with critical public-health implications to private companies https://t.co/2k4Q2byEjR",105
1244429173650788352,2020-03-30 01:00:10,RT @mccanner: ‘A group of residents from an island town in Maine cut down a tree and dragged it into the middle of a road in an attempt to…,113
1244426864833318912,2020-03-30 00:50:59,"RT @nytimesarts: “We’ve had some things taken away from us, but radio is not one of them,"" said Matthew Dunn of WOMR https://t.co/8x80QI3cv4",42
1244424117111132162,2020-03-30 00:40:04,"John Prine was hospitalized on March 26 after “a sudden onset of Covid-19 symptoms,” his family said in a statement https://t.co/JBX4C4UPBd https://t.co/U3v5rGhyfL",34
1244424110786183168,2020-03-30 00:40:02,"As the largest public school system in the U.S. adapts on the fly to a public health emergency without precedent, New York City's educators are facing a challenge unlike anything in their careers. https://t.co/lzOVXgIlem",44
1244420333509193728,2020-03-30 00:25:02,"Jonesboro, Arkansas, came through a devastating tornado without any deaths, partly because businesses were closed and people were sheltered at home from the coronavirus.
https://t.co/d6JiQIzrBn",213
1244414039305981954,2020-03-30 00:00:01,"Officials in Washington State worry that their gains are precarious, but they see evidence that containment strategies are beginning to pay off — at least for now https://t.co/hUCYSiEQS8",194
1244409018992517126,2020-03-29 23:40:04,While the goods that arrived in New York will be welcomed by hospitals and health care workers — some of whom have resorted to rationing protective gear or using homemade supplies — they represent just a tiny portion of what American hospitals need https://t.co/iQqldYbmJz,472
1244403996611280896,2020-03-29 23:20:07,RT @meslackman: The coronavirus crisis has revealed and exasperated weaknesses in each nation that it has hit. Iraq is cratering on almost…,153
1244398959042400256,2020-03-29 23:00:06,"In Opinion

Jesse Wegman writes: ""It may take more work to win elections by listening to what voters actually want than by simply rigging the maps, but it’s a critical step to save our representative democracy."" https://t.co/sedfgOSN7P",18
1244395677645406210,2020-03-29 22:47:03,"Breaking News: Federal guidelines for social distancing will remain in place until April 30, President Trump said, backing away from his plan to end them by Easter
https://t.co/JwFyHJ4VzE",742
1244388885049880576,2020-03-29 22:20:04,"RT @nytpolitics: “These stereotypes have been here for decades,” Representative Judy Chu, Democrat of California, said. “They’re always kin…",106
1244383883518521347,2020-03-29 22:00:12,"If you have bacon, eggs and a pack of ramen noodles in the pantry, this quick dinner (or breakfast or lunch) comes together in a snap
https://t.co/KpZfe0VeBU",80
1244378832519467014,2020-03-29 21:40:07,"After SARS, Chinese health officials built a system to track contagions while evading political meddling. It broke down when the coronavirus appeared. https://t.co/mB7aSdXTEv",207
1244373795739250690,2020-03-29 21:20:06,"RT @JohnBranchNYT: Darrell just called. He's on his way to Waco with no plans for home. Load prices are holding, he said, and diesel prices…",164
1244369308249186305,2020-03-29 21:02:17,"An earlier version of this article misstated the date of the U.S.’s first confirmed case of coronavirus through travel. It was Jan. 20, not Jan. 8. We've deleted a tweet that also included the error. https://t.co/GfJSPCNkrK",28
1244368949552300034,2020-03-29 21:00:51,"We interviewed more than 50 current and former public health officials, administration officials, senior scientists and company executives for this investigation. Read the full story here. https://t.co/Pt6a0WherI",100
1244368948600111104,2020-03-29 21:00:51,"March 1

New York City reports its first coronavirus case.",62
1244368947220295681,2020-03-29 21:00:50,"Feb. 29

The FDA relaxes its rules for some laboratories, allowing them to start testing before the agency has completed its approvals. At a White House news conference, President Trump concedes there will be more cases, but says, “There’s no reason to panic at all.”",51
1244368945639043072,2020-03-29 21:00:50,"Feb. 24

The chief executive of the Association of Public Health Laboratories writes to the FDA that “we are now many weeks into the response with still no diagnostic or surveillance test available outside of CDC for the vast majority of our member laboratories.” https://t.co/5UUrTWibAR",70
1244368944837939200,2020-03-29 21:00:50,"Feb. 14

The CDC announces that it will begin surveillance testing to track the virus. But a month later, it says it hopes to “begin rolling out” the program, which has yet to begin in a significant way.",64
1244368943994855429,2020-03-29 21:00:50,"Feb. 12

The CDC publicly discloses that its test kits aren’t working properly amid complaints from labs around the country that screening has been far too restricted.",64
1244368942732324870,2020-03-29 21:00:49,"Feb. 4

The FDA approves the CDC test, but the White House task force remains focused on the Diamond Princess cruise ship, which is placed under quarantine in Japan because 10 people on board are diagnosed with the coronavirus.",54
1244368941809651720,2020-03-29 21:00:49,"Early February

Stanford University develops its own test for the coronavirus but runs into regulatory roadblocks at the FDA.",100
1244368940882710528,2020-03-29 21:00:49,"Jan. 31

The Trump administration restricts travel from China, but exempts Americans and allows trade to continue. Alex Azar declares a public health emergency.",68
1244368939842486279,2020-03-29 21:00:49,"Jan. 29

The White House announces a coronavirus task force led by the health secretary, Alex Azar. President Trump attends the group’s first meeting and tweets that the experts “are on top of it.”",51
1244368938508652545,2020-03-29 21:00:48,"Jan. 24

The CDC says that it has developed a sophisticated diagnostic test and has sought FDA permission to send it to public labs around the country.",53
1244368937149698048,2020-03-29 21:00:48,"Jan. 20

The United States has its first confirmed case of coronavirus through travel: a man in Washington State.",123
1244363735579471873,2020-03-29 20:40:08,"Unused emergency gurneys, a defining image from 9/11, have much to tell us today, when there isn’t a bed to spare. A veteran ER nurse explains. https://t.co/fZJLBYQDCr",140
1244358682869215233,2020-03-29 20:20:03,RT @NYTLiz: JUST POSTED: “We need help to go home.” I visited Liberty U. as the consequences of Jerry Falwell's decision to reopen the camp…,1554
1244353697993326592,2020-03-29 20:00:15,"With France in lockdown, tensions have erupted in various rural areas where city dwellers have taken refuge. 

“We should have blocked the bridge,” said one local on an island off France’s Atlantic coast which has seen its population double overnight. https://t.co/ySDmVdUUjm",151
1244346127480127488,2020-03-29 19:30:10,"RT @celiadugger: Scientists are discovering more secrets from the 1st photo of a black hole, @overbye calls such monsters ""potholes in eter…",83
1244338564474843137,2020-03-29 19:00:07,"“Senators did do something consequential, but they were a long way from putting aside their differences,” @hillhulse writes in the On Washington column https://t.co/aY9kFpcfCG",38
1244336026929311749,2020-03-29 18:50:02,"“Public health depends a lot on public trust,” I. Glenn Cohen, an expert in bioethics, said. “If the public feels as though they are being misled or misinformed their willingness to make sacrifices — in this case social distancing — is reduced.” https://t.co/4jWrubfv0g",239
1244333518471168000,2020-03-29 18:40:04,RT @mirjordan: At least 4 migrant children in US have tested positive for Covid-19; even more shelter staff are infected  https://t.co/chKs…,132
1244326976493625348,2020-03-29 18:14:04,"Dec. 31

The World Health Organization says that Chinese health officials in Wuhan revealed a ""cluster of cases of pneumonia of unknown cause.""",116
1244326974778159104,2020-03-29 18:14:03,"An early lack of screening in the U.S. let the coronavirus pandemic spread largely undetected. Read our investigation of the institutional errors and regulatory hurdles that allowed that to happen. https://t.co/Pt6a0WherI

Here’s a timeline.👇",1197
1244319237612679170,2020-03-29 17:43:19,"U.S. health officials anticipated a national shortage of ventilators 13 years ago. A contract was given to a small company that got to work on building a fleet of portable devices.

Here’s how the project fell apart and produced zero new ventilators. 
https://t.co/2nvVNehsTP",234
1244318419090055169,2020-03-29 17:40:04,"RT @jbsgreenberg: NEW: Read about the cheaper, more durable ventilator that never was. It’s a tale about just what happens when critical pu…",1297
1244313412420669442,2020-03-29 17:20:10,"RT @nkulish: PROJECT AURA: The head of the CDC sees a prototype for a cheap, easy-to-use, portable ventilator …  that was 9 years ago. It n…",639
1244309265382326273,2020-03-29 17:03:41,"The stalled efforts to create cheap, easy-to-use ventilators highlight the perils of outsourcing public-health projects to private companies; their focus on maximizing profits is not always consistent with the government’s goal of preparing for a crisis. https://t.co/F1aObgURGc",738
1244309263897559040,2020-03-29 17:03:41,"Things veered off course when a multibillion-dollar maker of medical devices, Covidien, bought the small California company, Newport Medical Instruments, that had been hired to design the new machines. The project ultimately produced zero ventilators. https://t.co/F1aObgURGc https://t.co/AaVBZBDI1N",799
1244309262223978496,2020-03-29 17:03:40,"13 years ago, U.S. public health officials came up with a plan to address what they regarded as one of the medical system’s crucial vulnerabilities: a shortage of ventilators https://t.co/F1aObgURGc https://t.co/Knx5981REb",642
1244308373430063104,2020-03-29 17:00:09,"As the coronavirus ravages the U.S. health care system, the scarcity of ventilators has been forcing doctors to make life-or-death decisions about who gets to breathe and who does not. Our investigation helps explain the acute shortage of medical devices.
https://t.co/CFv90IO7PI",2759
1244303320375853061,2020-03-29 16:40:04,"A federal judge in Los Angeles has ordered the U.S. government to “make continuous efforts” to release thousands of migrant children from detention facilities, where at least 4 children have tested positive for the coronavirus https://t.co/tqW20LIppN",477
1244298296996302848,2020-03-29 16:20:06,RT @maggieNYT: Amid questions about whether the GOP convention will go ahead and whether it can solicit enough sponsorship $ from companies…,54
1244293305032204289,2020-03-29 16:00:16,"“My boy’s coughing began on a Thursday night, a phlegmy, body-shaking rattle that struck him every few minutes,” Kinsey Gidick writes for @NYTParenting
https://t.co/wNrETqBfhQ",65
1244288257124438016,2020-03-29 15:40:12,The torrent of falsehoods aimed at discrediting Dr. Anthony Fauci is another example of how some far-right supporters of President Trump regularly vilify those whom they see as opposing him https://t.co/L6NkMilI7b,1804
1244283442449338374,2020-03-29 15:21:05,"RT @davidenrich: Exclusive: The US government had a plan to build a huge fleet of easy-to-use, inexpensive ventilators. 

Then a big compan…",2762
1244282631627431937,2020-03-29 15:17:51,"Speaker Nancy Pelosi said on Sunday that President Trump’s delay in responding to the coronavirus pandemic would ultimately cost American lives.

The number of confirmed U.S. cases has continued to rise; 19 states have at least 1,000 cases each. https://t.co/LW3KYwMCnQ https://t.co/beZkrcjXug",72
1244278149237571584,2020-03-29 15:00:03,"Amid the uncertainty of the coronavirus pandemic, the people who make dystopian TV dramas like “The Handmaid’s Tale” and “Westworld” are looking at their work in a different light https://t.co/zD9FAf2ZGN",226
1244273124864151552,2020-03-29 14:40:05,RT @jakesilverstein: Many many people were touched by @jessicalustig’s powerful account of her husband’s battle with Covid this past week.…,77
1244268090482966528,2020-03-29 14:20:04,"As the coronavirus spreads across the U.S., medical experts are debating how much the public should know about local cases of the virus. It is a critical question that will shape the country’s approach to confronting this and future outbreaks. https://t.co/fwD0dpmIRU",135
1244263099957469185,2020-03-29 14:00:14,"The coronavirus has fundamentally transformed political life in America, affecting how candidates communicate with voters, raise money from donors and confront their opponents https://t.co/mlZ8LEInR5",85
1244258016670744582,2020-03-29 13:40:03,"In Opinion

Stephanie Land writes, “Those who work in our homes are human beings who, in the face of Covid-19, have no child care, no income and will probably face severe housing insecurity in the months to come.” https://t.co/SBxME6QV8N",138
1244254283752706049,2020-03-29 13:25:13,"Has the coronavirus created a new dilemma in your life? Please send us your quandaries, especially about the human side of dealing with the pandemic, at dilemmas@nytimes.com.",9
1244254192048443401,2020-03-29 13:24:51,"Next: Yes, it's OK to take a walk. @jodikantor checked for this 77-year-old who is terrified to leave her apartment.
https://t.co/qdCIiTlzZs",11
1244253528731922434,2020-03-29 13:22:13,"First up, @jodikantor explains if you should flee the city because of the coronavirus. ""Before relocating, consider whether farther truly equals safer,"" she writes. https://t.co/c7HRiH9Xqo https://t.co/S6lvDMFVPV",11
1244253000421564423,2020-03-29 13:20:07,"“There’s a saying in journalism: The solution is always more reporting. And that’s what we’ll do in coming weeks in this new column.” Welcome to Dilemmas, a new column from @JodiKantor that finds solutions to your toughest coronavirus quandaries. https://t.co/D9pgnaO9PJ",58
1244247988219846657,2020-03-29 13:00:12,"After India’s government announced a country-wide lockdown to contain the coronavirus, millions of the country’s migrants were suddenly without food and shelter. Shelters are trying to keep up, but aid workers warn the situation could lead to violence. https://t.co/NcEaB189mm",697
1244242925070024704,2020-03-29 12:40:04,"In New York, the long-ignored vertical slabs all over the city are having a moment https://t.co/A5BJBh6Qx5",36
1244242464212467718,2020-03-29 12:38:15,"For today, March 29, here’s how to follow the latest on the coronavirus outbreak. We’ll update this every day. 

🌎 Live updates from around the world: https://t.co/6atkLchvZc
🗽 The latest in New York: https://t.co/BI6xdcfADT https://t.co/vMij0SyICT",54
