id,created_at,text,retweet_count
1252567790713810944,2020-04-21 12:00:07,South Korean officials questioned the accuracy of news reports that Kim Jong-un was recovering from heart surgery. North Korea also tried to dispel the speculation. But rumors persist. https://t.co/vifc7srvvk,44
1252562739966480384,2020-04-21 11:40:03,Morning briefing: Here's what you need to know to start your day https://t.co/XrCwNBRAH5,52
1252559439976071169,2020-04-21 11:26:56,"For today, April 21, here’s how to follow the latest on the coronavirus outbreak. We’ll update this every day. 

🌎 Live updates from around the world: https://t.co/bMLiQ1DYjY
🗽 The latest in New York: https://t.co/PZbqcytHFX
📊 Markets news: https://t.co/u0wvxFq0C0 https://t.co/M0cm9nQUtl",26
1252557721741778946,2020-04-21 11:20:06,"Educators in the U.S. say they want to teach from home during the coronavirus pandemic, but are fighting to limit work hours and counter demands that they consider unreasonable https://t.co/N9zEagfkQA",100
1252552683954847745,2020-04-21 11:00:05,"At least 26,000 more people died during the coronavirus pandemic over the last month than official death counts report, a review of mortality data in 11 countries by The New York Times shows https://t.co/gsGlJIJ0D5",264
1252545136036392961,2020-04-21 10:30:06,President Trump portrayed suspending immigration as a bid to save Americans’ jobs amid the coronavirus pandemic. Immigration advocates have said that Trump and his advisers are using a pandemic to further hard-line immigration policies. https://t.co/HVkpBT8Fj3,54
1252541361368285186,2020-04-21 10:15:06,"In January, at a restaurant in Guangzhou, China, an infected diner who was not yet feeling sick appeared to have spread the coronavirus to nine other people. An air-conditioner apparently blew the virus particles around the dining room. https://t.co/IYlC4QJUdp",271
1252537607394910212,2020-04-21 10:00:11,"A letter to the editors of four British tabloids said that Harry and Meghan, who have relocated to Los Angeles and are embarking on new lives as private citizens, would no longer engage with them https://t.co/TO7Ua2Qtiu",50
1252532544840613889,2020-04-21 09:40:04,"In Opinion

 Siddharth Varadarajan writes: The coronavirus outbreak has allowed authoritarianism and anti-Muslim sentiment to flourish in India.
https://t.co/3YZeUaibo1",60
1252527515903631368,2020-04-21 09:20:05,"A hospital official in Israel asked why journalists could tour coronavirus wards in protective gear, but relatives were denied deathbed farewells. His bosses had no good answer, and changed their policy on the spot. https://t.co/d32aTTSNI6",521
1252522507908919296,2020-04-21 09:00:11,"Sometimes it feels like cognitive dissonance in Tokyo, where we're in a state of emergency but some people seem to behave as if they are magically immune, our bureau chief @motokorich writes https://t.co/zrD0vr0Fiq",84
1252517447586009091,2020-04-21 08:40:04,"Business travel worldwide has stopped because of the coronavirus pandemic. When it does restart, it will be changed. “Everyone will have to learn how to be comfortable around people,” said the founder of a travel analysis firm. https://t.co/BXPR2UPnOS",48
1252512402538717185,2020-04-21 08:20:01,"One oil price went negative on Monday, signaling that there is no place to store all the crude the world is producing but not using https://t.co/EFQGZkRiRk",333
1252507414177419264,2020-04-21 08:00:12,"Tears flowed down the cheeks of the muezzin as he made the call to prayer in an empty ancient mosque in Cairo. “It was hard on my heart,” he said. “When I call people, nobody can come. It feels like God is refusing us.” https://t.co/MpbaSdTped",92
1252504861079453696,2020-04-21 07:50:03,"Hong Kong on Tuesday extended a range of social distancing measures to May 7 as a precaution, a day after reporting no new coronavirus infections for the first time since early March https://t.co/PoHcqGapyy https://t.co/cu1bduRhkh",102
1252502350205501440,2020-04-21 07:40:05,"When restaurants reopen, it may take more than putting tables six feet apart to prevent the spread of the coronavirus from an infected diner. An incident in China offers a cautionary tale. https://t.co/IruluPgKKI",155
1252497311680401408,2020-04-21 07:20:04,"Singapore did almost everything right when it came to fighting the coronavirus. But now its caseload has spiked, a situation that shows how hard it will be for countries to return to the way they were anytime soon. https://t.co/17uWG8MtSF",476
1252494804799426560,2020-04-21 07:10:06,RT @nytimesworld: Nurses from the Philippines and other developing countries have long made up for shortages in Western nations. Now they a…,214
1252492288514830337,2020-04-21 07:00:06,Europe morning briefing: Here's what you need to know to start your day https://t.co/Nyg7DXA81k,27
1252487259993096192,2020-04-21 06:40:07,"In Opinion

""Calling this pandemic a war,"" says @adamwestbrook, is ""a useful cover for a power grab.""
https://t.co/fMcoxkaAAj",136
1252482215461752836,2020-04-21 06:20:04,Virgin Australia announced it had entered voluntary administration after the Australian government refused a bailout of 1.4 billion Australian dollars https://t.co/lGuzjvNmdr https://t.co/YtJMYznBI5,49
1252479692717907969,2020-04-21 06:10:03,"Demand for oil is collapsing, and despite a deal by Saudi Arabia, Russia and other nations to cut production, the world is running out of places to put all the oil the industry keeps pumping out — about 100 million barrels a day.

Market updates: https://t.co/LbS70XcbgP",53
1252477199560642561,2020-04-21 06:00:08,"In On Tech, @ShiraOvide talks with @KevinRoose about his new audio series “Rabbit Hole,” YouTube and the dangers of the video platform’s recommendation feature https://t.co/0teoHqi4r3",47
1252476301639892993,2020-04-21 05:56:34,"In Opinion

Richard Levitan writes, ""I realized that we are not detecting the deadly pneumonia the virus causes early enough and that we could be doing more to keep patients off ventilators — and alive."" https://t.co/8Z1shffhLe",220
1252467122682376192,2020-04-21 05:20:06,"RT @NYTNational: In Ohio, even as plans were being put in place to reopen, a state prison about an hour’s drive north of the capital became…",51
1252464587661873158,2020-04-21 05:10:02,RT @ShaneGoldmacher: NEW: It would take Joe Biden and the DNC raising almost $1 million every single day between now and November to catch…,463
1252462119599181825,2020-04-21 05:00:13,Data compiled by The New York Times from records of deaths in Istanbul indicate that Turkey is grappling with a far bigger calamity from the coronavirus than official figures and statements would suggest https://t.co/mPGDl8E3jU,264
1252458317928189952,2020-04-21 04:45:07,A pastor at a Louisiana megachurch who was previously cited for defying the state’s coronavirus stay-at-home orders is facing an assault charge after he backed up a bus toward a protester outside the church https://t.co/e93vcPVa1j,128
1252453481123844103,2020-04-21 04:25:54,"Read updates in Chinese: 新冠病毒疫情最新消息
https://t.co/RODpKuos87",19
1252453264035061760,2020-04-21 04:25:02,"—Istanbul deaths suggest a wider coronavirus outbreak than Turkey admits
—President Trump said he planned to close the United States to people trying to immigrate
—Iran and Iraq lifted some of their restrictions, but religious shrines remained closed

https://t.co/2kPDKuI4MW",140
1252449496660946944,2020-04-21 04:10:04,"Joe Biden and the Democrats are nearly $187 million behind President Trump and the Republicans, new fund-raising figures show https://t.co/We9sAktBjt",309
1252447136781930496,2020-04-21 04:00:41,"North Korea’s leader, Kim Jong-un, is receiving treatment after undergoing a cardiovascular procedure earlier this month, a South Korean media report said, amid speculation over Kim’s health following his absence from a key anniversary event https://t.co/B8Bdt1EKOp",240
1252441935391928320,2020-04-21 03:40:01,"An intense and chaotic scramble continues to unfold as hospitals, cities and states go out on their own to compete for masks and gowns https://t.co/pHsPPk89rK",110
1252436912788439040,2020-04-21 03:20:03,RT @jwpetersNYT: That didn’t take long.  https://t.co/V1IhlkKwcy,89
1252431891224883200,2020-04-21 03:00:06,"Illustrators and graphic designers, including artists like Shepard Fairey and Maira Kalman, are creating public service messages with striking visuals to promote health and thank emergency medical workers during the coronavirus pandemic https://t.co/FkyNdiypQu",89
1252429364785905665,2020-04-21 02:50:04,"RT @nytimesarts: Are we at a fork in the road in history? Of course we can't know now, but ""The Plot Against America"" and other alt-history…",104
1252426853005975553,2020-04-21 02:40:05,Something bizarre happened in the oil markets on Monday: Prices fell so much that some traders paid buyers to take oil off their hands https://t.co/Ujk54ZGaEP,734
1252424593400201217,2020-04-21 02:31:06,Breaking News: President Trump said he would sign an executive order to temporarily halt immigration to the U.S. as the coronavirus outbreak continues to spread https://t.co/Y5gtcV0lB6,267
1252421803936366592,2020-04-21 02:20:01,RT @kchangnyt: Why you may not want to rush back to eating out. https://t.co/zLgzwiSxS5,181
1252416800429453314,2020-04-21 02:00:08,"The U.S. Supreme Court ruled that the Constitution banned non-unanimous jury verdicts in cases involving serious crimes. The decision will affect cases in Louisiana and Oregon, the only 2 states that have recently allowed such verdicts. https://t.co/o3E9bNfGCO",120
1252411751687049222,2020-04-21 01:40:04,"Sirio Maccioni — a Manhattan restaurateur whose restaurants, like Le Cirque, drew an international following that included the rich and powerful — died on Monday. He was 88. https://t.co/y4LmEiDaXU",59
1252406733718224897,2020-04-21 01:20:08,"RT @SteveLohr: The story of how a hurry-up collaboration of scientists, engineers, entrepreneurs, physicians and regulatory experts made a…",103
1252401734875402240,2020-04-21 01:00:16,"As the coronavirus overwhelms the health care system, people with other illnesses struggle to find treatment
https://t.co/iL11yh8Hs4",74
1252396666126086146,2020-04-21 00:40:08,"Michelle Obama read one of her beloved children’s books aloud on Monday, live streaming to hundreds of thousands of people at home. The virtual story time was the first in a four-week series called “Mondays with Michelle Obama.” https://t.co/yZUgn5GjRw",841
1252394168103563264,2020-04-21 00:30:12,"RT @NYTSports: ""The Last Dance"" is as much about Michael Jordan reaffirming his legacy in the age of LeBron James as anything else. https:/…",105
1252391365503143936,2020-04-21 00:19:04,"@MichaelPaulson Broadway is now a sort of theatrical petrified forest, fossilized on March 12. See more photos of what Broadway looks like while closed here. https://t.co/MlfLRAI9BA",31
1252390661866676224,2020-04-21 00:16:16,"@MichaelPaulson “It’s hard to say what was the more unsettling sight,” writes @MichaelPaulson. “The marquees gone dark, acknowledging that there is no one to see them, or the ones still blazingly lit, illuminating only the garbage blowing past and the occasional masked passer-by.”",22
1252390401543028742,2020-04-21 00:15:14,"@MichaelPaulson Here’s something you don’t see very often: the ruby-red glass steps at the TKTS booth, totally unoccupied. They’re now cordoned off by barricades. https://t.co/CRjj0FWr8o",26
1252390020255633408,2020-04-21 00:13:43,"@MichaelPaulson There is beauty, of course; without the crowds, it is easier to see the architectural grandeur. https://t.co/a0YyDkW1Wb",29
1252389609301921795,2020-04-21 00:12:05,"@MichaelPaulson Each of these theaters has its own story to tell, its own interrupted journey.

Atop the Booth Theater is a headstone of sorts: a darkened marquee promoting a revival of “Who’s Afraid of Virginia Woolf?” that closed before opening and will not resume when Broadway returns. https://t.co/R4KhJNQtjI",18
1252389110808903680,2020-04-21 00:10:06,"Broadway was booming. Then the coronavirus turned New York’s theater district into a ghost town. 

Our reporter @MichaelPaulson took a walk with photographer David S. Allee one month after the shutdown. Here’s what they saw. https://t.co/kJCrzRHCTe",134
1252386590975905796,2020-04-21 00:00:06,Evening Briefing: Here's what you need to know at the end of the day https://t.co/hfgignb9Aw,28
1252376536944046088,2020-04-20 23:20:09,RT @zinoman: New column is on the business of live comedy under lockdown with a focus on those experimenting with new online models. https:…,12
1252371519700783104,2020-04-20 23:00:12,"Less than a month ago, the stock market was in free fall. Then it rebounded — even as millions of people lose their jobs every week and the U.S. is destined for a recession.

So, can the rally be trusted? https://t.co/HUod88U6ZH",64
1252368963419291656,2020-04-20 22:50:03,"RT @SominiSengupta: A climate change crash course for your quarantine.

The science is clear. 

There's a lot the world can do to avert the…",66
1252366461063946240,2020-04-20 22:40:06,"It took just a matter of days to shut down New York City, once the coronavirus took hold. Restarting it will take much longer. “I don’t know if we’ll ever get it back,” said a New York City official. https://t.co/Nz9BhnpBKo",126
1252361424753459200,2020-04-20 22:20:06,"This large, fluffy pancake is excellent for breakfast, brunch, lunch or dessert any time of year. And it comes together in about 5 minutes. https://t.co/u6Vn1PgWxt",286
1252356444998864897,2020-04-20 22:00:18,"The Australian government said on Monday that Google and Facebook would have to pay media outlets for news content in the country, in part to help local publishers by forcing tech giants to share their advertising revenue https://t.co/smGI0jRdGK",141
1252353868924502017,2020-04-20 21:50:04,"RT @brianmrosenthal: At one of the nation's largest nursing homes, conditions are so dire that many nurses have stopped coming to work. A t…",255
1252351361284313090,2020-04-20 21:40:06,"The Tesla Quartet, an acclaimed young ensemble, was making a fragile but sustainable living. Then came the coronavirus. https://t.co/Q4J5vxgFaR",47
1252348861424603136,2020-04-20 21:30:10,"RT @nytopinion: ""Calling this pandemic a war,"" says @adamwestbrook, is ""a useful cover for a power grab"" https://t.co/iKKe9tnbEn https://t.…",74
1252346547812982786,2020-04-20 21:20:59,The coronavirus pandemic has taken an incalculable death toll. We're putting names and faces to the numbers. Here are some of their stories. https://t.co/AIFvt1BQz8,142
1252346321186328577,2020-04-20 21:20:05,"Luis Sepúlveda, a Chilean writer whose stay among Indigenous people in the Amazon led to his most celebrated novel and who was jailed during the dictatorship of Augusto Pinochet, died from the novel coronavirus. He was 70. https://t.co/ORBl99d2jA",253
1252343799549816836,2020-04-20 21:10:03,"RT @cflav: Here's a central dilemma of climate adaptation: Should you help people in risky areas stay in their homes, even if it puts them…",36
1252341363280150528,2020-04-20 21:00:23,"If people with no symptoms are spreading the coronavirus, as some studies suggest, it may be time to give face masks the kind of advertising and promotion that support condoms as lifesavers https://t.co/PSkC9CJlxc",204
1252338795816652800,2020-04-20 20:50:10,"Échale un vistazo a los distintos tipos de mascarillas que puedes encontrar. Te decimos cómo funcionan, qué debes considerar al confeccionarlas y el nivel de protección que ofrecen. https://t.co/iMzVfxRRWn",87
1252336253284089858,2020-04-20 20:40:04,One in 3 jobs held by women in the U.S. has been designated as essential during the coronavirus outbreak. And nonwhite women are more likely to be doing essential jobs than anyone else. https://t.co/wpCw2uv2QJ https://t.co/vx3qJ3DJZX,370
1252333745216110592,2020-04-20 20:30:06,"Brands are aware that people are glued to their phones and they are desperate to engage. But they're trying to proceed carefully, with messages of optimism and self-care and varying levels of references to the coronavirus. https://t.co/STpPY4GB7i",35
1252331225970335746,2020-04-20 20:20:06,"If wearing a face mask makes your glasses fog up, health workers have a few tricks that might help https://t.co/aiKuaODtos",385
1252328710155485194,2020-04-20 20:10:06,"RT @jdavidgoodman: NEW: It only took a few days for the New York City we knew to vanish. 

Getting it back will take far longer. 

“I don’t…",90
1252326235973304321,2020-04-20 20:00:16,"Looking for a book about climate change? Here are 21 book recommendations, based on what you’re in the mood to read. https://t.co/kzGjGqXeQH",62
1252323674578989057,2020-04-20 19:50:05,"“None of us want to say bye to our family. But it’s really a gift,” said one family member about an Israeli hospital’s decision to start allowing relatives to say goodbye to loved ones dying of the coronavirus. https://t.co/Q5RDfvOfAf",189
1252321698629783554,2020-04-20 19:42:14,"An Ohio prison is now the largest reported source of coronavirus infections in the U.S., as the outbreak continues to worsen in some parts of the country. https://t.co/9bEYDxLrXk https://t.co/VA29upZXDL",102
1252321155014426624,2020-04-20 19:40:05,"RT @nytimesbooks: With millions of people told to stay at home, we'd love to know: What's been on your pandemic reading list? https://t.co/…",59
1252319449169960961,2020-04-20 19:33:18,The coronavirus pandemic has taken an incalculable death toll. We're putting names and faces to the numbers. Here are some of their stories. https://t.co/AIFvt1kfHA,101
1252318635055595523,2020-04-20 19:30:04,"“I really enjoy each one of my things when I’m doing it, and when I’m not doing it, I miss it.” Beryl Bernay was an actor, fashion designer, photographer, journalist, painter and amateur anthropologist. She died at 94 from coronavirus complications. https://t.co/C6LJMIAaOF",92
1252316130175221760,2020-04-20 19:20:06,"Hundreds of boaters stuck in the Caribbean have converged on the U.S. Virgin Islands, but there are fears that their safe haven comes at a cost for residents https://t.co/ih4qr0W0Bs",77
1252313599483224064,2020-04-20 19:10:03,RT @MichaelPaulson: New York's theater district is frozen in time -- stilled by the pandemic. Here's what it looks like. https://t.co/4B6Ou…,112
1252311160151474176,2020-04-20 19:00:22,"To understand how bad climate change is, we need to look at the Arctic, our reporter @henryfountain explains. “In large part, the Arctic is warming the way the rest of the world warms, only up north the process has run amok.” https://t.co/PcTmk3zmQP",68
1252308392472973312,2020-04-20 18:49:22,Breaking News: Something bizarre happened in the markets — the price of a barrel of oil went negative https://t.co/sQ7Bg8xQYK https://t.co/DHbrboV71S,1003
1252306042765160448,2020-04-20 18:40:01,"The coronavirus has cut a devastating path through the Detroit Police Department. The head of the homicide department died. Last week, 9 people from the department remained hospitalized, fighting to survive. https://t.co/7QaXgSBQB2",229
1252301016432812041,2020-04-20 18:20:03,"The NYC subway system rebounded from disrepair in the 1970s. It survived 9/11, Hurricane Sandy and turned a corner after a spate of meltdowns and accidents in 2017. But now, the subway faces its worst financial crisis yet — the impact of the coronavirus. https://t.co/UhB4lNxsQw",52
1252298499988881409,2020-04-20 18:10:03,RT @NYTObits: Sirio Maccioni made Le Cirque a headquarters for Manhattan’s rich and powerful in the 1980s and ’90s. He has died at 88. http…,41
1252296007918014464,2020-04-20 18:00:09,Ironing out a will and choosing a guardian for their 18-month-old son: A husband and wife who work in New York City's ERs share the unimaginable strain https://t.co/1GW0H0TzQU,110
1252293470359883777,2020-04-20 17:50:04,"Covid-19, the illness caused by the coronavirus, is arguably the leading cause of death in the U.S. right now. 

More than 20 experts in public health, medicine, epidemiology and history shared their thoughts on what to expect in the year ahead. https://t.co/ucKFydC203 https://t.co/0tG4sIcgL3",521
1252289442217328640,2020-04-20 17:34:04,RT @nytopinion: Join columnist @JenSeniorNY for a conversation about supporting small businesses during the coronavirus crisis and why it t…,53
1252288472553009154,2020-04-20 17:30:12,"Severe weather brought new deadly storms to Alabama and other Southern states on Sunday and Monday, the second consecutive weekend that dangerous storms swept through the region https://t.co/MNEXebRwYu",47
1252285934487441408,2020-04-20 17:20:07,"If your home isn’t that big, finding a place to exercise while you’re confined there may seem nearly impossible. Here’s what the experts suggest. https://t.co/Jrfv9o5vDE",46
1252283408690151426,2020-04-20 17:10:05,"RT @sapna: RewardStyle, a platform that connects influencers and fashion brands, shared guidelines last month on how to soft sell during th…",19
1252280898319515649,2020-04-20 17:00:07,Richard Branson has offered to put up his private Caribbean island as collateral as he publicly pleads with the British government for taxpayer support of his Virgin Airlines https://t.co/ueXQqLPNWw https://t.co/XcQyztJ5v5,180
1252278379421851649,2020-04-20 16:50:06,"Facing a shortage of coronavirus tests, Gov. Larry Hogan of Maryland and his wife, Yumi Hogan, negotiated with suppliers in South Korea to obtain 500,000 kits. “It should not have been this difficult,” he said. https://t.co/CIweuI4Eml",1246
1252275847677042700,2020-04-20 16:40:02,"In 1970, the U.S. celebrated its first Earth Day, a day of climate activism that preceded the passing of the Clean Air Act, the creation of the EPA and more.

50 years later, our reporter @jswatz spoke to Denis Hayes, the original organizer of Earth Day. https://t.co/rj6E4Zh57q",78
1252274577092337664,2020-04-20 16:34:59,"Breaking News: Benjamin Netanyahu and Benny Gantz agreed to a unity government in Israel, keeping Netanyahu in office as he faces trial on corruption charges https://t.co/YTNw0lhKzl",155
1252273367782166530,2020-04-20 16:30:11,"RT @VVFriedman: ""I just burst into tears"" - Anna Wintour, on fashion solidarity during the pandemic: https://t.co/gLVdXU7IRa",44
1252270826365255681,2020-04-20 16:20:05,"Former Dropbox engineers say Zoom’s security woes can be traced back two years or more, and they argue that the company’s failure to overhaul its security practices back then put its business clients at risk https://t.co/Pj0c6wE4fr",155
1252265856261898243,2020-04-20 16:00:20,"New York, New Jersey and Connecticut all reported their lowest number of coronavirus deaths in days on Sunday https://t.co/GWT66Nsfh7 https://t.co/3lg0AzfSA7",126
1252263269684916225,2020-04-20 15:50:04,"""The president who ran as an insurgent in 2016, is most comfortable raging against the machine of government, even when he is the one running the country,"" writes @maggieNYT of President Trump. https://t.co/C0eI8Q076a",178
1252259854695182337,2020-04-20 15:36:29,"For more New York Times climate coverage, be sure to follow @nytclimate https://t.co/mMoRUedWcy",6
1252259471864332288,2020-04-20 15:34:58,"Do personal choices matter for the climate? “Personal actions and international cooperation are inextricably linked,” explains @SominiSengupta. https://t.co/S69cY8MNTI",23
1252259220705206272,2020-04-20 15:33:58,"Can insurance protect us? “There’s another fight going on over a seemingly simple question: As climate change increases the risk to American homeowners, should governments allow the cost of insurance to keep pace with that risk?” explains @cflav. https://t.co/9VTBFY4w3W",9
1252258693162418177,2020-04-20 15:31:52,"Do environmental rules matter? “As a reporter in Washington for more than 20 years, I’ve had a front-row seat to the gridlock that has gripped Congress on climate change,” explains @LFFriedman. https://t.co/nmcoeiDMJa",16
1252258116906999810,2020-04-20 15:29:35,"How do we stop fossil fuel emissions? @bradplumer outlines a basic road map if we want to zero out emissions, which, scientists agree, is what is ultimately needed to keep the world from heating up endlessly. https://t.co/jJIQexsXm3",25
1252257754649178113,2020-04-20 15:28:09,"Who is influencing key climate decisions? “My job as a journalist looking at the intersection of climate and industry has been to follow the money trail to figure out who’s asking for what and getting what they want,” explains @HirokoTabuchi. https://t.co/RMH2Cf8JZ2",19
1252257483286028288,2020-04-20 15:27:04,"How do scientists know what they know? @KendraWrites explains the tools that scientists use to measure ocean temperatures, carbon dioxide in the air, annual temperature reports and more, all which show that the climate is warming and humans are causing it. https://t.co/6pboqPxJb5",22
1252256588762619905,2020-04-20 15:23:31,"How bad is climate change right now? To understand, we need to look at the Arctic, our reporter @henryfountain explains. “As climate researchers are fond of saying, what happens in the Arctic doesn’t stay in the Arctic.” https://t.co/z5eRpitJKd",35
1252255727453974535,2020-04-20 15:20:05,"How bad is climate change now? How do scientists know what they know? Do our personal choices matter for the climate? From @nytclimate, here’s a 7-day crash course on climate change. https://t.co/nZMofLkmVh",191
