id,created_at,text,retweet_count
1238441483683889153,2020-03-13 12:27:13,"While officeholders seeking reelection usually enjoy the advantages of incumbency, Kim Foxx has faced an unusual up… https://t.co/5yFvXP4iH5",0
1238438457124499456,2020-03-13 12:15:11,Coronavirus in Illinois updates: Here’s what’s happening with COVID-19 in the Chicago area https://t.co/d8PHfAyZdh,9
1238435550744494082,2020-03-13 12:03:38,"Sure, you washed your hands before you touched your face. But what about before you touched your phone?

Here's wha… https://t.co/SWmGRfJilb",6
1238430405726023682,2020-03-13 11:43:12,We're tracking the coronavirus as it spreads in Illinois. Take a look here. https://t.co/iTiKo9LZPA https://t.co/btUACCC2Xu,12
1238427755139784711,2020-03-13 11:32:40,"As the sports world goes dark, what will we do? There’s only so much Netflix a guy can take, writes columnist… https://t.co/3HCcjGpRsu",2
1238420033690390528,2020-03-13 11:01:59,"CPS currently has no plans to close more schools, but field trips, sports and other activities are off for at least… https://t.co/4kKuAV6HFC",8
1238328188889108480,2020-03-13 04:57:01,"""To me, my strength is my femininity. They don’t exist on either side of a divide.”

From The New York Times. https://t.co/VRX1ossuiK",4
1238324993991290880,2020-03-13 04:44:20,"As the coronavirus crisis mounts, cosmetics companies — whose very business relies upon the now-discouraged practic… https://t.co/pNpXK0m7r0",6
1238322212861554688,2020-03-13 04:33:17,Predictions for the most popular baby names for 2020: New entries in the top 10 for boys this year include Henry an… https://t.co/xIeDJ3iBBC,0
1238319077107605504,2020-03-13 04:20:49,"As the coronavirus spreads around the globe, right-wing pundits Sean Hannity and Rush Limbaugh have spread denial a… https://t.co/at8xldNfIg",47
1238316378077175809,2020-03-13 04:10:05,The James Beard Awards — recognizing excellence in the restaurant industry — have been postponed until summer 2020.… https://t.co/wF1oCESYcR,7
1238313239144005633,2020-03-13 03:57:37,"No Bulls player has experienced symptoms of the coronavirus, but the team is halting basketball operations temporar… https://t.co/T021bwerEE",2
1238310039082975232,2020-03-13 03:44:54,Want to become your own barista? @bestreviews talked to a coffee professional to learn how to transform your kitche… https://t.co/LelqtM2rHJ,1
1238306686751948800,2020-03-13 03:31:35,"Downtown Aurora’s Paramount Theatre has canceled or postponed upcoming performances, citing Gov. Pritzker's order t… https://t.co/tTHC1Cm1Xr",4
1238302463586942977,2020-03-13 03:14:48,The Goodman Theatre in Chicago announced that it has suspended all performances until further notice. https://t.co/elC8HgPyzA,8
1238297037822623744,2020-03-13 02:53:14,"Sophie Grégoire Trudeau, Canadian Prime Minister Justin Trudeau’s wife, has tested positive for the coronavirus, of… https://t.co/a5v0SFsZC0",7
1238295972272386048,2020-03-13 02:49:00,There is no reason to believe the U.S. can escape the full force of the coronavirus outbreak. Dragging our feet onl… https://t.co/PJz0sh32fc,10
1238292285705654273,2020-03-13 02:34:21,Chicago’s Lincoln Park Zoo will close through April 10 due to concerns about the spreading coronavirus. The zoo sai… https://t.co/a6nFhv0KrN,20
1238289588004757505,2020-03-13 02:23:38,"“The idea of anybody getting it easily the way people in other countries are doing it — we’re not set up for that.""… https://t.co/FgrmIPifeD",13
1238288815917355009,2020-03-13 02:20:34,"And across the world, cities and communities have been dealing with the cascading effects of the coronavirus on a l… https://t.co/nuDCn4ftv1",0
1238288814835142656,2020-03-13 02:20:34,"Meanwhile, the stock market continued to get pummeled. The outbreak hit Wall Street with its worst day since the Bl… https://t.co/lTCnwSPX9C",2
1238288813786574850,2020-03-13 02:20:34,"Also on Thursday, Disneyland in California shut its doors for only the fourth time in history. Walt Disney World an… https://t.co/GqsQfbrt87",2
1238288812398333965,2020-03-13 02:20:33,The NCAA shut down its March Madness basketball tournaments due to the pandemic — as did the Big Ten tournament and… https://t.co/C0A9bbb6No,0
1238288811123245056,2020-03-13 02:20:33,"On Thursday, the sports world continued to be hit by waves of cancellations. The NHL followed suit in suspending it… https://t.co/YlMcUtF6re",0
1238288809831391239,2020-03-13 02:20:33,And the NBA suspended its season after a Utah Jazz player also tested positive. https://t.co/RSYBCtHutn,0
1238288808572882945,2020-03-13 02:20:32,Within the same hour came two more shocking revelations: Hollywood power couple Tom Hanks and Rita Wilson announced… https://t.co/R42GSZEfzI,1
1238288807214055424,2020-03-13 02:20:32,"It started with President Trump’s address to the nation. After weeks of downplaying the virus, Trump announced he i… https://t.co/bKJcJ75OYk",0
1238288805980971008,2020-03-13 02:20:32,"Since 8 p.m. Wednesday, concerns over the spreading coronavirus have brought a dizzying number of cancellations, cl… https://t.co/KI7z06OM6E",5
1238286191918792709,2020-03-13 02:10:09,Princess and Viking cruise lines have halted operations amid the coronavirus pandemic. https://t.co/fq2gmYEitw,6
1238281140714209280,2020-03-13 01:50:04,"Here are today’s top stories in Chicago politics, from @byldonovan https://t.co/3xA633fxg7",2
1238279390020153346,2020-03-13 01:43:07,Advocate hospitals will not charge patients for coronavirus testing and treatment for now — but patients could stil… https://t.co/M1lX6jOcpa,21
1238276998268694528,2020-03-13 01:33:37,From sandhill cranes returning to Chicago to an investigation into a serious lack of oversight of area foster child… https://t.co/FgWmWMrDNo,2
1238274465949257729,2020-03-13 01:23:33,We're tracking the coronavirus as it spreads in Illinois. Take a look here. https://t.co/rQwLDBxXCe https://t.co/LwgPlbsCve,16
1238270386728570880,2020-03-13 01:07:20,Commentary: Coronavirus control measures aren’t pointless. Slowing down the pandemic could save millions of lives. https://t.co/0vsD5BQKBG,18
1238266544184049664,2020-03-13 00:52:04,The deadline for submitting an application online to vote by mail in Illinois' primary election was extended to 11:… https://t.co/gdhljRG8EO,29
1238264823634329600,2020-03-13 00:45:14,"The spread of COVID-19 has led Ohio, Maryland, Kentucky, Georgia and Washington state to close schools. Here's a lo… https://t.co/dW9S2NTegp",7
1238261717634777089,2020-03-13 00:32:53,"RT @rap30: Chicago Board of Elections looking to relocate 64 precinct polling places for Tuesday, extending online vote-by-mail application…",17
1238260967823355905,2020-03-13 00:29:55,"Hours after pledging to press ahead, the IHSA has pulled the plug on the boys state basketball tournament amid a ca… https://t.co/pQW7J2D0Ua",4
1238258513140383745,2020-03-13 00:20:09,"A Hinsdale South High School student's coronavirus test came back negative, the district said. School will resume a… https://t.co/Ai1N4o1B9F",1
1238256737628688385,2020-03-13 00:13:06,Disneyland and Disney California Adventure are shutting down for two weeks in response to the coronavirus pandemic https://t.co/dYjQlzSyiu,4
1238250957550616579,2020-03-12 23:50:08,Stevenson High School in suburban Lincolnshire will close its buildings and move to online classrooms beginning Fri… https://t.co/4wRWmuTXyH,5
1238248133328601099,2020-03-12 23:38:55,"A day after President Trump assured Americans that testing for the coronavirus is “expanding rapidly, day by day,”… https://t.co/a5F2ve0w4e",7
1238242690665512960,2020-03-12 23:17:17,Colleges and schools in Chicago's south suburbs are canceling planned activities and planning or preparing to offer… https://t.co/w1wkoRzfz4,4
1238239370009772032,2020-03-12 23:04:05,"Can the government impose a quarantine on anybody? Is it a crime to evade one? Your questions, answered.

From The… https://t.co/VVjTd3CBeN",6
1238235210388574208,2020-03-12 22:47:34,"In response to the spread of the coronavirus, New Trier High School and several other suburban elementary school di… https://t.co/6rrdLvucHu",9
1238232674189422592,2020-03-12 22:37:29,"Gov. J.B. Pritzker has ordered the cancellation of all public events with more than 1,000 people for 30 days and ur… https://t.co/KXuw93F2JJ",59
1238232604119371781,2020-03-12 22:37:12,"Living under coronavirus quarantine: Parents at Chicago's Vaughn Occupational High School, which serves students wi… https://t.co/oKxgpDsYAs",6
1238229376682070024,2020-03-12 22:24:23,"Coronavirus in Illinois: Gov. Pritzker ordered the shutdown of public events with more than 1,000 people as the num… https://t.co/ViWZ4yCf43",22
1238226788926410752,2020-03-12 22:14:06,"Caitlyn Smith has written songs for the likes of Garth Brooks, Dolly Parton and Kenny Rogers and headlined her own… https://t.co/LRFJt7E338",7
1238224115045224449,2020-03-12 22:03:28,Watch live: Health officials discuss the coronavirus pandemic in Illinois as cancellations rack up and markets cont… https://t.co/pSCJA1HHvD,1
1238223835519991809,2020-03-12 22:02:22,"Illinois weed dispensaries say they are concerned about medical patients, many of whom have compromised immune syst… https://t.co/JohsMOCXVx",9
1238221002678599684,2020-03-12 21:51:06,You be the critic: Vote for your favorite Chicago restaurants in our Readers’ Choice Dining Awards — with categorie… https://t.co/nuHgeO5ABX,0
1238216297768509441,2020-03-12 21:32:24,Those of us fortunate enough to be able to shelter in place and ride out the looming twin storms of medical and eco… https://t.co/QnNVPOPMDp,5
1238211070990352385,2020-03-12 21:11:38,Coronavirus burnout? Here’s some other news you might have missed this week in Chicago: https://t.co/AHBnMmRXaY,3
1238207082467336194,2020-03-12 20:55:47,We’re now in a bear market. Not sure what that means for you? Here are answers to 6 questions for investors. https://t.co/yXYlTzNKi8,5
1238206475715129349,2020-03-12 20:53:23,The coronavirus pandemic just hit Wall Street with its worst day since the Black Monday crash of 1987. https://t.co/Z37MpTDYs1,10
1238204464714170373,2020-03-12 20:45:23,A 23-year-old from Chicago is the youngest of 32 men competing for Clare Crawley’s heart on the upcoming season of… https://t.co/NAq2bPCAVz,2
1238200746342068224,2020-03-12 20:30:37,"The NCAA canceled its men's and women's basketball tournaments, citing concerns for public health because of the co… https://t.co/R15rIaiPK8",1
1238199795682029568,2020-03-12 20:26:50,The Art Institute of Chicago is canceling public events through April 10 amid the coronavirus pandemic but it plans… https://t.co/O3tKv88KZb,7
1238195228546338817,2020-03-12 20:08:41,Stores are limiting how much hand sanitizer people can buy amid a scramble to snap up supplies. But shelves are sti… https://t.co/OaHJwtqXvt,2
1238192553708654595,2020-03-12 19:58:03,Chicago voters have until 5 p.m. today (2 more hours) to request a mail-in ballot for Tuesday's primary election. Y… https://t.co/rITUdXUqj2,23
1238191000943824896,2020-03-12 19:51:53,Photos show some of the world's most popular spaces sitting empty amid the coronavirus pandemic https://t.co/Qa6cBkTxCk,6
1238187393792069639,2020-03-12 19:37:33,Columnist @RexHuppke espouses the virtues of social distancing in the time of coronavirus. It's a trend we can (and… https://t.co/RG7WjCNHCR,2
1238183941053583366,2020-03-12 19:23:50,"The new coronavirus can live in the air for several hours and on some surfaces for as long as two to three days, te… https://t.co/Ow5SZlCUA9",24
1238180557567254530,2020-03-12 19:10:23,Broadway theaters in New York are shutting down because of the coronavirus. Their main customers are older tourists… https://t.co/QirVYXOBqa,11
1238177946319433729,2020-03-12 19:00:01,"“The coronavirus does not have a political affiliation,"" Joe Biden said today, pushing back against President Trump… https://t.co/wFBZxB3f9h",8
1238175545478742019,2020-03-12 18:50:28,We asked readers to send us their questions and concerns about coronavirus — then we asked an infectious disease ex… https://t.co/X1fko4OQZ3,9
1238170663799730181,2020-03-12 18:31:05,"Baseball, hockey, soccer and college basketball are joining the NBA in shutting down as the coronavirus spreads https://t.co/0GTIifZjFd",12
1238170620145344514,2020-03-12 18:30:54,Former “Bachelorette” contestant Dustin Kendrick has replaced Chris Bukowski as the star of one of “The Bachelor Li… https://t.co/LXNDh5JwCY,0
1238167649646977024,2020-03-12 18:19:06,"U.S. defense leaders threatened a retaliatory strike against Iranian-backed Shia militia in Iraq today, saying they… https://t.co/bgsWRDfsLX",7
1238165976434249728,2020-03-12 18:12:27,This Gold Coast home offers panoramic views of Lake Michigan and the downtown skyline. It's listed for $1.85 millio… https://t.co/oAVO0MT6bK,3
1238162624434573315,2020-03-12 17:59:08,Defense rests without expected testimony from the man accused of killing Chicago police Cmdr. Paul Bauer https://t.co/rAqstbAkhE,2
1238162622576562176,2020-03-12 17:59:07,"President Trump announced a travel ban on 26 European countries Wednesday night, but there was some confusion about… https://t.co/9XSScemw0M",0
1238161464705368064,2020-03-12 17:54:31,"The lineup for Ravinia's 2020 season is here, and it includes some pretty big names https://t.co/E9qBMKpvqy",2
1238158896029630464,2020-03-12 17:44:19,"From March Madness to Tom Hanks: Twitter users vent about coronavirus
https://t.co/g5azE2He7Y",0
1238156346429771779,2020-03-12 17:34:11,"Tom Hanks and Rita Wilson tested positive for COVID-19 in Australia, where testing is free and widely available, th… https://t.co/sbnWkdhVmQ",14
1238156279811629057,2020-03-12 17:33:55,"RT @ElviaMalagon: Hello friends, There is a lot going on in the world but today marks the start of when households will start to get inform…",11
1238150961161437194,2020-03-12 17:12:47,Coronavirus in Illinois updates: Here’s what’s happening today with COVID-19 in the Chicago area https://t.co/JeckoBfml7,8
1238147887550337032,2020-03-12 17:00:34,Two more big conferences planned at McCormick Place in Chicago have been canceled in response to the coronavirus ou… https://t.co/NJw0BPmk4J,7
1238141733080379394,2020-03-12 16:36:07,A Brazilian official who was part of a delegation that met with President Trump at Mar-a-Lago five days ago has tes… https://t.co/i90Cm8IG1C,21
1238139586838179843,2020-03-12 16:27:35,"We asked readers to submit their concerns and inquiries about coronavirus, then got an infectious disease expert to… https://t.co/dA6ELBiUuO",1
1238136804865454086,2020-03-12 16:16:32,Canadian Prime Minister Justin Trudeau says he is self-isolating at home after his wife began exhibiting flu-like s… https://t.co/CpP4xn9fe2,20
1238134247694766083,2020-03-12 16:06:22,The Big Ten has canceled its men's basketball tournament amid concerns over coronavirus https://t.co/lVBYYkIkyJ,11
1238134092429959170,2020-03-12 16:05:45,President Donald Trump’s ban on most Europeans entering the United States is the latest calamity for a global trave… https://t.co/JXAM8zlNhl,0
1238133131837931520,2020-03-12 16:01:56,"RT @ChicagoSports: The Big Ten Tournament has been canceled minutes before today's 1st game.

https://t.co/dQvPYp0MV0",11
1238131047390420994,2020-03-12 15:53:39,The Chicago Fire’s return to Soldier Field has been postponed as MLS suspends league play for 30 days https://t.co/C4uxFNOq4G,2
1238130822009491458,2020-03-12 15:52:45,Applications to vote by mail in Illinois' primary election on Tuesday need to be postmarked by 5 p.m. today https://t.co/oVUvOwOiAu,186
1238129982741909507,2020-03-12 15:49:25,RT @ElyssaCherney: More colleges announce shifts to online learning and plans to close dorms. But not all schools have guaranteed lodging f…,4
1238129481874898952,2020-03-12 15:47:26,RT @sryantribune: It's official. Big Ten games cancelled.,71
1238127587068653575,2020-03-12 15:39:54,Confusion remains over what exactly the new coronavirus does to people’s bodies. Here is what medical experts and r… https://t.co/28j4HubDy9,14
1238125057496547335,2020-03-12 15:29:51,"Classes at University of Illinois, Northwestern and Illinois State will be moved online after spring break. The sch… https://t.co/yThCUqtIQH",12
1238122426640326656,2020-03-12 15:19:24,"The European Union slammed Trump's ""unilateral"" decision to close off travel to much of the continent, declaring th… https://t.co/Ut5ON4atD3",17
1238116011137732610,2020-03-12 14:53:54,"Congress is shutting the Capitol to the public until April in reaction to the spread of the coronavirus, a rare ste… https://t.co/twBaVdiaQF",13
1238109242470682628,2020-03-12 14:27:01,Only 60 fans per school will be allowed at the Illinois state basketball finals in Peoria because of the spreading… https://t.co/K326WKew0u,10
1238106714433609735,2020-03-12 14:16:58,"Tom Hanks had a cold, or so he thought: slight fever, body aches, chills, the usual.
In the U.S., those symptoms ma… https://t.co/QoOOGzsHPx",20
1238102560541757441,2020-03-12 14:00:27,"The University of Chicago announced today that it’s moving classes online to fight the spread of coronavirus, joini… https://t.co/r2Rqrysgpj",18
1238097313224101888,2020-03-12 13:39:36,Fact check: President Trump made incorrect statements about some of his administration's new coronavirus actions du… https://t.co/VA4FuMHau4,27
1238094157996068864,2020-03-12 13:27:04,"Watch the 12th and 17th hole, featuring the famous “Island Green,” from THE PLAYERS Championship live on our site t… https://t.co/2D0Hea4s7g",0
1238090079006048257,2020-03-12 13:10:52,"Since hand-washing has become the national pastime, we set out to find Chicago’s top soap shop. Meet Merz Apothecar… https://t.co/xw8qaj7kj0",8
1238085043056259072,2020-03-12 12:50:51,The Blackhawks won big last night at the United Center in front of fans who said they were unworried about the coro… https://t.co/AIdnD1nvpa,2
1238078186421981185,2020-03-12 12:23:36,"Hail to the belted kingfisher, writes the Tribune Editorial Board 🔸🔹🔸🔹🔸🔹 https://t.co/rDRSxCS7VC",3
1238075242473455616,2020-03-12 12:11:54,"Bernie Sanders might be losing the nomination to Joe Biden, in part because of a misconceived strategy to communica… https://t.co/wUWtJy81UW",2
1238072312030789637,2020-03-12 12:00:16,"Good morning, Chicago. Here are some top stories to start your day:

-Gov. Pritzker considers large public gatherin… https://t.co/4wSr8KRPoR",5
1238064169716461568,2020-03-12 11:27:54,Coronavirus in Illinois updates: Here’s what’s happening today with COVID-19 in the Chicago area https://t.co/XaDVcfT3Vp,27
1238062985609908225,2020-03-12 11:23:12,A major Israeli hospital said it plans to open a high-tech medical research facility at the former Michael Reese Ho… https://t.co/hr4KSnGlB0,6
1238060174549626880,2020-03-12 11:12:02,Wash your hands in style. Welcome to the Chicago shop with over 700 kinds of soap. https://t.co/mhVVuWK0R2,9
1238057337727877120,2020-03-12 11:00:45,"“What we’ve learned about the experience throughout the world is that the more we can stay one step ahead of this,… https://t.co/lacttqGa7z",3
1238051934927556608,2020-03-12 10:39:17,"We posed your coronavirus questions to Dr. Robert Citronberg, director of infectious diseases at Advocate Lutheran… https://t.co/e3joS3Mp6R",8
1238049008725172225,2020-03-12 10:27:40,"Here’s how to properly disinfect your phone, with tips from the CDC and Apple https://t.co/O0FWdGz1gd",10
1238046065703768066,2020-03-12 10:15:58,Nebraska coach Fred Hoiberg left the bench early during the Cornhuskers’ 89-64 loss to Indiana in the Big Ten Tourn… https://t.co/eCdJBdV6KP,1
1237954422724005888,2020-03-12 04:11:49,Nebraska coach Fred Hoiberg left the bench early during the Cornhuskers’ 89-64 loss to Indiana in the Big Ten Tourn… https://t.co/UG0wbmsEVr,10
1237951473964781568,2020-03-12 04:00:06,Harvey Weinstein told a courtroom he’s “worried about this country.” He needn’t be. It’s safer with him behind bars… https://t.co/ikbxwg6e9P,4
1237948959764680704,2020-03-12 03:50:06,A school district in suburban Hinsdale is waiting to hear the results of a coronavirus test done on a student. If t… https://t.co/PuaL5gT5NG,18
1237946872091770881,2020-03-12 03:41:48,"Nebraska coach Fred Hoiberg left the bench during the Big Ten Tournament after feeling ill, and reports say he was… https://t.co/bFSLRXCiLI",15
1237945631211237377,2020-03-12 03:36:53,Prosecutors rested their case at the trial of the man charged in Chicago police Cmdr. Paul Bauer's slaying. The sta… https://t.co/Aod13BueJl,2
1237943052335013889,2020-03-12 03:26:38,Coronavirus fears didn't keep die-hard fans from the Big Ten Tournament on Wednesday. But it's the last live basket… https://t.co/MZqfA8IsA1,5
1237940526428622849,2020-03-12 03:16:35,The Russian parliament approved a sweeping constitutional reform Wednesday that would allow President Vladimir Puti… https://t.co/dZLrJx8yre,21
1237937234118160389,2020-03-12 03:03:31,Events were canceled. Workers were sent home. The NBA season was suspended. Here's how the coronavirus pandemic imp… https://t.co/Ldlf1KiIQL,6
1237934676599283712,2020-03-12 02:53:21,"Tax Day might be delayed because of the coronavirus. Here's what we know so far.

From The New York Times: https://t.co/RqviwOF2ys",0
1237931561963659265,2020-03-12 02:40:58,"Taking drastic action, President Trump said the U.S. is cutting off travel from Europe and moving to ease the econo… https://t.co/TI3Ipw3S4q",2
1237927865343258625,2020-03-12 02:26:17,Blood drives are being canceled across the Chicago area as the new coronavirus spreads — sparking concerns about th… https://t.co/VxCVoG2q46,16
1237924354710736898,2020-03-12 02:12:20,Naperville has canceled its St. Patrick’s Day parade and 5K run due to concerns over the spread of the coronavirus.… https://t.co/R4pBxKU5gR,7
1237921268026028033,2020-03-12 02:00:04,"Foster children endure violence, mistreatment after being sent to out-of-state facilities: “I felt like I was never… https://t.co/Cfbt59ABYz",3
1237918503677681665,2020-03-12 01:49:05,The NBA is suspending its season after tonight's games after a Utah Jazz player preliminarily tested positive for t… https://t.co/plKOD3LuyT,11
1237916216188174336,2020-03-12 01:39:59,"Tom Hanks and Rita Wilson announced that they have tested positive for the coronavirus, the first celebrities to go… https://t.co/ijWBAJSfIm",24
1237914206151880705,2020-03-12 01:32:00,$97 to Miami. $137 to Vegas. $197 to Alaska. The coronavirus is hammering the travel industry — and creating deep d… https://t.co/qSGvJwqCyF,6
1237911202451329027,2020-03-12 01:20:04,President Trump said the U.S. will suspend all travel from Europe for 30 days due to the coronavirus. The restricti… https://t.co/Hg0siVoRF9,7
1237906826395635714,2020-03-12 01:02:41,Watch live: President Trump is discussing the federal response to the coronavirus pandemic in an address from the O… https://t.co/TNEGEMOKZ0,1
1237904108171993088,2020-03-12 00:51:53,Northwestern’s disappointing season ended with an 8-23 record after a 74-57 loss to Minnesota in the first round of… https://t.co/cXOaiKQwkp,0
1237901355240624128,2020-03-12 00:40:56,New York's top late-night talk shows are dropping their live studio audiences amid coronavirus concerns https://t.co/dptRJzuoQF,4
1237897173519360002,2020-03-12 00:24:19,"Travel deals have proliferated as airlines scramble to fill empty seats, and cruise lines and hotels roll out disco… https://t.co/gmiix1j4NT",4
1237891744282206208,2020-03-12 00:02:45,"Classes at University of Illinois, Northwestern and Illinois State will be moved online after spring break. The sch… https://t.co/wSRRaqXbVw",77
1237887448190816259,2020-03-11 23:45:41,"The spread of coronavirus is affecting the upcoming primary election in Illinois, which has seen a surge in vote-by… https://t.co/pXEGBjgWes",16
1237883476558241795,2020-03-11 23:29:54,The Big Ten says its men's basketball tournament in Indianapolis will be played without fans starting Thursday beca… https://t.co/Fhy9CDso2T,1
1237880753595260928,2020-03-11 23:19:05,"6 new cases of the coronavirus have been confirmed in Illinois, bringing the total to 25. Officials are examining n… https://t.co/Dp6MGbOd2a",26
1237877266882822145,2020-03-11 23:05:13,We asked readers to send us their questions and concerns about coronavirus — then we asked an infectious disease ex… https://t.co/K1hQi6QrB5,14
1237875101132976144,2020-03-11 22:56:37,RT @HeidiStevens13: Harvey Weinstein is still trying to paint himself as the poster boy for political correctness run amok. Life as he knew…,4
1237874658558369794,2020-03-11 22:54:51,"As problems with Illinois' automatic voter registration continue to pile up, Republican lawmakers again called for… https://t.co/CMDISLkdGV",4
1237871268239511552,2020-03-11 22:41:23,Gatherings of more than 250 people are banned in the hard-hit Seattle area and San Francisco amid a drive to encour… https://t.co/Dlwhxil5be,8
1237868421355728904,2020-03-11 22:30:04,"A rocket attack on a military base in Iraq killed three service members, including two Americans, and injured a doz… https://t.co/OjPbC8syHl",9
1237868156665753600,2020-03-11 22:29:01,RT @dhinkel: I know there are a few things going on but if you'd like to hear me discussing my story on the race for Cook County state's at…,9
1237866041075585031,2020-03-11 22:20:37,Joe Biden and Bernie Sanders both canceled campaign rallies planned for Illinois this week https://t.co/lPaT2AcEHs,14
