id,created_at,text,retweet_count
1235323517455011843,2020-03-04 21:57:32,Authorities have released the identities of three people who died Tuesday when a small plane crashed and burst into… https://t.co/9vKmeQ2Gm9,2
1235318242362744832,2020-03-04 21:36:34,"FitzGerald’s nightclub, one of the most colorful music venues in the Chicago area, has been bought by an industry v… https://t.co/nmc4MZyw6F",4
1235315118721953792,2020-03-04 21:24:10,Events all around the Chicago area are being canceled due to the fears over the coronavirus. Here's a running list… https://t.co/VuKgG1PrhZ,16
1235311939737341952,2020-03-04 21:11:32,Two police officers involved in the shooting of an unarmed 33-year-old man at a busy CTA Red Line station last week… https://t.co/jIpFHsYraU,26
1235307674381815809,2020-03-04 20:54:35,United Airlines is making big cuts in its international and domestic flights as the coronavirus outbreak hits the g… https://t.co/6CTj5fes9C,9
1235302181953208331,2020-03-04 20:32:45,"What's Chicago's best steakhouse? Best tavern-style pizza? Best fried chicken sandwich? Best craft beer?

Vote now… https://t.co/iOG3AgCICe",2
1235298138921066499,2020-03-04 20:16:41,A person in California has died from the coronavirus. It's the first death in the U.S. outside of Washington state… https://t.co/45qqwGFSpD,9
1235295071165132806,2020-03-04 20:04:30,"RT @crepeau: //breaking// the defendant in the Richard's Bar stabbing is expected in court tomorrow on first-degree murder charges, I'm tol…",20
1235294906882588674,2020-03-04 20:03:51,"Chicago's Steppenwolf Theatre is sharing details of its 2020-21 season, starting with “Good Night, and Good Luck,”… https://t.co/YY6FceoOoX",6
1235291121917534214,2020-03-04 19:48:48,"Coronavirus testing is now available to anyone with a doctor’s approval, the CDC says. The previous policy required… https://t.co/ECs9Dx0C5t",9
1235286290293313540,2020-03-04 19:29:36,"This Ravenswood home listed for $2.5 million has 6 bedrooms, 5 fireplaces, 4.5 bathrooms and a 3-car garage. Take a… https://t.co/cdlX1MZqbT",1
1235282414299230209,2020-03-04 19:14:12,Italian American groups and others are threatening legal action against the Chicago Board of Education over its dec… https://t.co/tQ3QjCjIxq,67
1235280080760377345,2020-03-04 19:04:56,"Many airlines are waiving flight change fees, and Chicago's airports are stepping up cleaning amid uncertainty over… https://t.co/oflt4LjM1l",8
1235277355096080391,2020-03-04 18:54:06,Capitol Hill negotiators have reached agreement on an $8.3 billion measure to battle the coronavirus outbreak that’… https://t.co/mevwXMCjSl,4
1235275230714748928,2020-03-04 18:45:39,A woman faces animal cruelty charges in connection with a pit bull found in a garbage bag on the side of a road in… https://t.co/m00R5wgqCz,1
1235272448817475584,2020-03-04 18:34:36,A suspect is in police custody in last month’s fatal stabbing at Richard’s Bar in West Town https://t.co/Y1xVRFFzEM,2
1235270745229582337,2020-03-04 18:27:50,Investors lost more than $100 million in The Income Store’s alleged website development scheme that promised endles… https://t.co/B2lY3Hrg80,3
1235267386334416897,2020-03-04 18:14:29,The coronavirus is spreading across America. We're rounding up all the Illinois updates in one place — here's what… https://t.co/0hU7e4ZKa7,2
1235263502509658115,2020-03-04 17:59:03,The dilapidated two-story home in Crystal Lake where authorities say 5-year-old AJ Freund was killed by his parents… https://t.co/irFzjdW44j,0
1235258572155604992,2020-03-04 17:39:28,Chicago’s investigative police watchdog says two officers involved in the shooting of an unarmed man at a CTA Red L… https://t.co/X43sw2KlFR,6
1235258226461069316,2020-03-04 17:38:05,The brother of Chicago Bears legend Brian Urlacher pleaded not guilty this morning to federal charges alleging he a… https://t.co/5KoD3CZ3Gc,9
1235255320353570816,2020-03-04 17:26:32,"The new James Bond movie, ""No Time to Die,"" has been delayed until November because of the coronavirus https://t.co/lyrWNPa1VF",6
1235255155286839299,2020-03-04 17:25:53,The grieving mother of Kenneth Paterimos tried to enter Richard’s Bar in West Town — the site where her son was fat… https://t.co/eEN8mNZsxW,1
1235252206502318082,2020-03-04 17:14:10,Dispensary33 wants to open a West Town marijuana shop that’s twice as big as its first store. It’s got plenty of co… https://t.co/VVTIQFQIPQ,2
1235249085311062018,2020-03-04 17:01:46,Oracle is canceling its upcoming conference in Chicago due to health concerns associated with the coronavirus. It i… https://t.co/2evIhgr8qk,8
1235246199659278338,2020-03-04 16:50:18,Northwestern University is canceling all international spring break trips over coronavirus concerns https://t.co/qB7PNA1RYv,14
1235245080832860162,2020-03-04 16:45:51,"RT @theaterloop: Patricia Barretto, the popular and highly respected president and CEO of @HarrisTheater died Tuesday night. Barretto, 45,…",6
1235244551817883650,2020-03-04 16:43:45,"@philvettel And now it’s your turn to be the critic: Vote here in our Readers’ Choice Dining Awards, with categorie… https://t.co/XgP7e4kKBv",0
1235243639581872128,2020-03-04 16:40:08,"It's time again for our Critic's Choice Dining Awards: These are Chicago’s best chefs of 2019, according to… https://t.co/RSQn1Zsjot",4
1235240231659593730,2020-03-04 16:26:35,Here's how to clean your space on an airplane if you're freaked out about the coronavirus. From the New York Times. https://t.co/M8xfJPydC3,10
1235237229225742337,2020-03-04 16:14:39,"A man hospitalized in Arlington Heights who tested positive for coronavirus did not get it from traveling abroad, h… https://t.co/z1awBm8oos",12
1235232324905840645,2020-03-04 15:55:10,"Happy birthday, Chicago? Nah. 

Calling today Chicago's birthday is like celebrating the date you took your first s… https://t.co/tvP9wUqwEc",34
1235223255751028736,2020-03-04 15:19:08,Mike Bloomberg has dropped out of the Democratic race for president. He spent half a billion dollars of his own mon… https://t.co/9yLWyX6OxW,9
1235218132098256896,2020-03-04 14:58:46,Some school districts are ‘super cleaning.’ Others are on their own. Here’s how Chicago-area schools are — or aren’… https://t.co/6KdlnFUWT4,9
1235211058282930176,2020-03-04 14:30:40,"Just hours after his big Super Tuesday success, Joe Biden picked up endorsements from three Illinois politicians to… https://t.co/laFfAzfgd9",3
1235208310493712384,2020-03-04 14:19:44,"The Chicago State University men's basketball team says it won't travel for two games this week, and its women's te… https://t.co/i9EsygQZGR",16
1235205688445538308,2020-03-04 14:09:19,These Illinois eagles have captured nationwide attention as they raise eaglets in rare three-way-committed relation… https://t.co/lbWKf034Xv,90
1235201172983754752,2020-03-04 13:51:23,"Joe Biden is back, but Bernie Sanders is right behind him. Suddenly, the Democratic Party’s presidential field, whi… https://t.co/F43jEmdcbS",6
1235198086387060737,2020-03-04 13:39:07,RT @AmandaMarrazzo: Tearing down AJ Freund’s home in Crystal Lake where authorities say his parents killed him last April https://t.co/f2nL…,2
1235196785427189760,2020-03-04 13:33:57,Columnist @John_Kass wonders whether Cook County State's Attorney Kim Foxx will hold the two Chicago cops involved… https://t.co/RenpMuvdnB,28
1235191478701502467,2020-03-04 13:12:51,"When it rains, it pours — and all of that water has to go somewhere. 

The Des Plaines River Trail faces another mu… https://t.co/kjs64TtNYC",3
1235188282457313280,2020-03-04 13:00:09,"Good morning, Chicago. Here are some top stories to start your day:
-Super Tuesday election results
-What to do if… https://t.co/W4FKT71tDs",2
1235183577781936129,2020-03-04 12:41:28,How many delegates does each candidate have in the Democratic primary? Here’s where things stand. https://t.co/v8Sh53n2gY,3
1235178085185703937,2020-03-04 12:19:38,Think you might have coronavirus? Don't go straight to the doctor! Here's what to do. https://t.co/pB9HgzvcmG,5
1235174907794919424,2020-03-04 12:07:01,A contractor who appeared on “Windy City Rehab” is facing a new fraud allegation over a Lakeview project https://t.co/e9pjHiTjzO,2
1235170777193951232,2020-03-04 11:50:36,"Super Tuesday: A resurgent Joe Biden won nine states while Bernie Sanders picked up four, including delegate-rich C… https://t.co/ai02shRLPJ",6
1235167954897076224,2020-03-04 11:39:23,A 1-year-old girl was killed and at least 8 others were injured in a house fire in Chicago's West Lawn neighborhood… https://t.co/PWk7WrJqgX,1
1235166596882141184,2020-03-04 11:33:59,"Marijuana users aren’t always taken seriously in rehab, despite evidence that cannabis can be addictive. “Half of t… https://t.co/2i8FdCK4Gz",11
1235099228885544961,2020-03-04 07:06:17,"Joe Biden has won the Democratic presidential primary in Texas, the second biggest prize on Super Tuesday, accordin… https://t.co/0QxZ5II0to",3
1235079495519834113,2020-03-04 05:47:53,Illinois’ public health chief is heading to Washington to push for additional federal resources to prevent the coro… https://t.co/sacnZZIdND,8
1235076165032751104,2020-03-04 05:34:39,"Want to improve your chance of staying healthy? Stop touching your face!

From The New York Times. https://t.co/G20vTMDPiq",10
1235072836034682882,2020-03-04 05:21:25,Super Tuesday updates: Joe Biden surged to big victories in the the upper Midwest and the South. Bernie Sanders sei… https://t.co/W1PyOOc7iM,3
1235070780498685952,2020-03-04 05:13:15,A Chicago lawyer was sentenced to two years in prison for tax evasion stemming from a scheme with former Ald. Edwar… https://t.co/VILNJOLh5N,3
1235067520685498371,2020-03-04 05:00:18,Mike Bloomberg spent more than $500 million on his presidential campaign. But after disappointing results in Super… https://t.co/U50Y48Y7dF,3
1235063083866808321,2020-03-04 04:42:40,"It’s possible to garden nearly anywhere, no matter how little space you have or how extreme the temperatures get.… https://t.co/30uk7NhcL3",5
1235060264929841152,2020-03-04 04:31:28,Delegate Tracker: Here’s where the candidates currently stand — and how far they have to go — as Super Tuesday resu… https://t.co/iLLKQRvb90,2
1235057375532314624,2020-03-04 04:19:59,Joe Biden celebrated a strong Super Tuesday performance in a speech promising to defeat President Trump and “heal t… https://t.co/YHcB7PV0kn,1
1235055215830634496,2020-03-04 04:11:24,"“It’s going to circulate a lot faster in the poorer communities than the wealthiest ones.""

From The New York Times. https://t.co/ySfg5tHGqY",13
1235054691467194370,2020-03-04 04:09:19,"Bernie Sanders has won the Democratic presidential primary in California, claiming the biggest prize on Super Tuesd… https://t.co/ypK9o3hUyP",1
1235052503026135040,2020-03-04 04:00:37,The lesson in Chris Matthews’ break with MSNBC may be to urge us all to speak up when we see our friends digging th… https://t.co/oxtVlHdiZf,2
1235051837721464832,2020-03-04 03:57:58,"More Democratic primary Super Tuesday results from the Associated Press:

🗳️ Bernie Sanders has won Utah

🗳️ Joe Bi… https://t.co/fEV8je2NB3",0
1235049010223648768,2020-03-04 03:46:44,Super Tuesday so far: Joe Biden has won 7 states while Bernie Sanders has picked up 3. Results from delegate-rich C… https://t.co/TUAs5hAS2M,1
1235045563810242562,2020-03-04 03:33:03,An arbitrator has ruled the Cubs did nothing “nefarious” in delaying Kris Bryant’s MLB debut https://t.co/MtabIKX9Js,1
1235044822626398208,2020-03-04 03:30:06,"An Amazon employee at one of the company's Seattle offices tested positive for the coronavirus Tuesday, the company… https://t.co/rDtIs7ED3r",5
1235042888901222401,2020-03-04 03:22:25,"From Slurpees to iPods, here are the iconic products released from the year you were born. https://t.co/IMEP3pSyZ2",3
1235040280723640320,2020-03-04 03:12:03,Photos: Here's how people are responding and preparing for coronavirus in Chicago https://t.co/ILw3wBxhfb,10
1235036090446286848,2020-03-04 02:55:24,"Joe Biden has picked up three more wins in the Democratic presidential primaries — Tennessee, Minnesota and Arkansa… https://t.co/bPo37W4Dvb",39
1235035156961992705,2020-03-04 02:51:41,"A patient at University of Chicago Medical Center tested negative for coronavirus, leaving 4 reported cases so far… https://t.co/PNHQjvFRHj",23
1235032284329381891,2020-03-04 02:40:17,"Illinois' Election Day is two weeks after Super Tuesday, on March 17, but early voting is open now. Here’s what you… https://t.co/VR4CYgUjZJ",9
1235029754153066496,2020-03-04 02:30:13,A county-by-county look at Super Tuesday results so far https://t.co/pgTwisMp8B,3
1235027637136834561,2020-03-04 02:21:49,"Two more Democratic primary results from the Associated Press:

🗳️ Bernie Sanders has won Colorado

🗳️ Joe Biden ha… https://t.co/R6b5IDugT5",2
1235027114786582528,2020-03-04 02:19:44,"“We know that if we don’t have the data about our communities, it’s hard to build political power."" https://t.co/6N1Obeluh0",2
1235024278568878081,2020-03-04 02:08:28,Kris Bryant says he enjoyed playing with a mic on during ESPN’s all-access Cubs game Monday. Could we see more of t… https://t.co/uC7HDl8bLf,0
1235021476941549570,2020-03-04 01:57:20,A federal jury has awarded $5.2 million to a man who spent more than 3 decades in prison for a 1982 gang rape he sa… https://t.co/JsJFwnjoYg,17
1235017891977850881,2020-03-04 01:43:05,"The dilapidated home in Crystal Lake where, authorities say, 5-year-old AJ Freund was killed by his parents is sche… https://t.co/9punyHy2xn",3
1235015208931921922,2020-03-04 01:32:25,Think you might have coronavirus? Don't go straight to the doctor. Here's what to do. https://t.co/sg5uunsguj,5
1235012490796425216,2020-03-04 01:21:37,A contractor who appeared on “Windy City Rehab” is facing a new fraud allegation https://t.co/CcLSFujnOA,5
1235009749118312449,2020-03-04 01:10:44,The spread of coronavirus has put a dent in the revenue of two Chicago-area charities that stood to benefit from a… https://t.co/MpqbVEDWjR,2
1235008984077217792,2020-03-04 01:07:41,"Joe Biden has won Alabama’s Democratic primary, the Associated Press reports. https://t.co/J9CKWruRuP",3
1235006936061530112,2020-03-04 00:59:33,Chance the Rapper is in talks to join the new “Sesame Street” movie https://t.co/er04J6xmhT,3
1235004778587049984,2020-03-04 00:50:59,"Joe Biden has won the Democratic primary in North Carolina, the Associated Press reports. https://t.co/aSzOIr4bRB",2
1235001515380789250,2020-03-04 00:38:01,"Here's which Chicago theater performance you should see based on your preferred presidential candidate, according t… https://t.co/96W14YBNX6",3
1234998642479525890,2020-03-04 00:26:36,Our Super Tuesday results page will continue to update with county-by-county voting totals as they become available: https://t.co/vX4wc6Kgrz,2
1234998281366720512,2020-03-04 00:25:10,"Super Tuesday results are starting to come in, with the Associated Press calling Virginia for former Vice President… https://t.co/uvHW13l76e",6
1234996118880055296,2020-03-04 00:16:34,"What’s driving the appetite for high-rise duplexes? Many Chicagoans are settling down, having kids and seeking more… https://t.co/qYwkuh6arc",0
1234993480159547393,2020-03-04 00:06:05,"The Spin: Another setback for Rod Blagojevich, Kim Foxx’s latest campaign haul, and Lori Lightfoot and J.B. Pritzke… https://t.co/Sc2sjR6tJ2",0
1234990833704681472,2020-03-03 23:55:34,A federal jury on Tuesday found that a Chicago police sergeant was unjustified in fatally shooting a 19-year-old ma… https://t.co/tfj8Nbe0IF,11
1234988299795611648,2020-03-03 23:45:30,Four kids from a Naperville gym will compete on season 2 of “American Ninja Warrior Junior.” https://t.co/BjLrbKAyN0,3
1234984750772670465,2020-03-03 23:31:24,"The internet needed a mom. Rebecca Makkai delivered, @HeidiStevens13 writes. https://t.co/iQpe6PIKPh",4
1234982010948448257,2020-03-03 23:20:30,"“It hit so fast, a lot of folks didn’t have time to take shelter. Many of these folks were sleeping.”

Tornadoes in… https://t.co/vBKB09s8TK",12
1234979281211494400,2020-03-03 23:09:40,"As the coronavirus spreads, schools in the Chicago area are proactively scrubbing down desks, doorknobs and other h… https://t.co/pTkqB9WXTd",9
1234976576397201408,2020-03-03 22:58:55,"Think you might have coronavirus? If your symptoms are mild, it's best to call a professional first before going st… https://t.co/TAwZALRV7V",4
1234974009801891840,2020-03-03 22:48:43,Surreal photos show major public spaces sitting empty as communities take precautions against the spread of coronav… https://t.co/fkuftA0oIO,2
1234970713875873792,2020-03-03 22:35:37,A biotech company based in Skokie is the first to lease space in a Lincoln Park research facility owned by Sterling… https://t.co/zmRhZX3vuf,3
1234967558245224449,2020-03-03 22:23:05,"From hand sanitizer stations to video calls to hands-off yoga, here's how companies in Chicago are taking steps to… https://t.co/WbarLnRAIr",2
1234964430376570880,2020-03-03 22:10:39,Chicago-area retailers are running low on face masks as consumers worried about contracting coronavirus stock up. O… https://t.co/TZmpyi48bB,6
1234961288125702144,2020-03-03 21:58:10,"Still haven't found a summer camp in the Chicago area for your child? 

Whether it's to harness physics, practice a… https://t.co/52fGhEqVzY",0
1234957425352028160,2020-03-03 21:42:49,A Chicago lawyer was sentenced to 2 years in federal prison for tax evasion stemming from a scheme with former Ald.… https://t.co/5Hav1qwOpd,3
1234954564354400256,2020-03-03 21:31:27,State panel recommends former Gov. Rod Blagojevich be disbarred for his corruption convictions https://t.co/1CIsCYR9Wo,17
1234952277548503040,2020-03-03 21:22:21,"RT @jmetr22b: ///BREAKING/// In a swift decision, a state panel on Tuesday recommended former Gov. Rod Blagojevich should be disbarred for…",53
1234951111401971722,2020-03-03 21:17:43,"Duplexes were not initially part of the plans for Renelle on the River.

Now, they feature one of many high-rise du… https://t.co/u7mHcB0JVg",0
1234947873747406851,2020-03-03 21:04:51,These Illinois eagles have captured nationwide attention as they raise eaglets in rare three-way-committed relation… https://t.co/KTXGDsmjoU,139
1234944894042550273,2020-03-03 20:53:01,"“The Bachelor” contestants receive huge amounts of abuse online. Last night, the show took time to share some of it… https://t.co/hz9aMDSC4C",3
1234944663943028737,2020-03-03 20:52:06,Chicago-area Catholic churches are changing Mass practices to reduce risk of spreading coronavirus. Parishioners ar… https://t.co/JNfMPzZFmE,5
1234941650264346625,2020-03-03 20:40:08,Nine people have now died of the coronavirus in the U.S. — all in Washington state. Most were residents of one nurs… https://t.co/vUOC5GXztU,8
1234939136617992194,2020-03-03 20:30:08,Tensions over how to contain the coronavirus in the U.S. escalated Tuesday as lawmakers expressed doubts about the… https://t.co/ZsdViRh3mi,1
1234936911992672256,2020-03-03 20:21:18,"President Donald Trump said today that he ""had a very good talk"" with a Taliban leader, days after reaching an agre… https://t.co/b4qIN6Skr8",1
1234934057013796864,2020-03-03 20:09:57,"Are we in the clear? Now that meteorological winter is over, here’s what forecasters say we can look forward to ove… https://t.co/QHZzkHyZ45",2
1234930842578845696,2020-03-03 19:57:11,The coronavirus is hitting airlines hard https://t.co/viAvNEMCKg,4
1234927671831912450,2020-03-03 19:44:35,I think I have the coronavirus. What should I do? https://t.co/UUw8icUq7t,3
1234924786440114181,2020-03-03 19:33:07,Three months after a tiny Chicago-area brewery bought craft beer giant Ballast Point in a move that shocked the bee… https://t.co/N4WyLz0n0h,1
1234921217611771904,2020-03-03 19:18:56,You’ve probably heard of people abstaining from alcohol for Lent. But what about giving up food and living off beer… https://t.co/uZO0DD0FbM,9
1234917796041121792,2020-03-03 19:05:20,Coronavirus concerns have prompted Green Day and BTS to join the list of music acts postponing or axing shows aroun… https://t.co/v8omcOBtos,5
1234916524764418049,2020-03-03 19:00:17,"RT @Nina_Metz: These are the TV pilots shooting in Chicago this month: One starring James ""Not great, Bob!"" Wolk of ""Mad Men"" fame &amp; the ot…",6
1234913946777399305,2020-03-03 18:50:03,"RT @Nina_Metz: ""It’s a testament to the generosity of the Chicago theater audience that apparently no one asked for a refund. I think part…",4
1234913350280261633,2020-03-03 18:47:40,Watch live: The trial has now begun for the man accused of killing Chicago police Supt. Paul Bauer https://t.co/cPLOvTHe7c,2
1234912721533100032,2020-03-03 18:45:11,"There's nothing racist about the actual ""stop and frisk"" policy itself, argues DePaul law professor Monu Bedi — and… https://t.co/j3h9KdKzoy",24
1234910459448496128,2020-03-03 18:36:11,More than 22 people have now been reported dead from tornadoes that ripped through Tennessee and the heart of Nashv… https://t.co/b5tpDmise7,13
1234909587381334016,2020-03-03 18:32:43,"If Richard Lewis looks like he’s in pain during new episodes of “Curb Your Enthusiasm,” on HBO, there’s a reason fo… https://t.co/rQJov2pvo4",7
1234906197238702081,2020-03-03 18:19:15,"A plane crash on I-55 in in downstate Lincoln, Illinois killed three people this morning. The plane was destroyed o… https://t.co/7v6ZLGDrlx",82
1234903710393917440,2020-03-03 18:09:22,"RT @HeidiStevens13: With coronavirus fears swirling and presidential politics raging and stock markets reeling, author Rebecca Makkai hoppe…",7
1234902648920444929,2020-03-03 18:05:09,"RT @LAURA_N_ROD: Jesus Alberto Lopez, a DACA-eligible man that was detained for 9 months, thanks his brother &amp; the community for their supp…",5
1234902542443786240,2020-03-03 18:04:44,One of the premier announcers in soccer — who also happens to call play-by-play for soccer's Premier League — will… https://t.co/1ipTdWuuDi,1
1234902534826995712,2020-03-03 18:04:42,RT @ToddLighty: Two @chicagotribune reporters tried to find out who's profiting off Illinois' newly legal marijuana business. But Gov. J.B.…,12
1234899387073122306,2020-03-03 17:52:11,"So all’s well that ends well for the fired Cubs managers?

We’ll soon find out, though Rick Renteria and Joe Maddon… https://t.co/dQWA433nor",1
1234896856964042753,2020-03-03 17:42:08,"""We are in uncharted territory,"" the World Health Organization says, as the coronavirus shifts west toward U.S. and… https://t.co/eS1Prq8H0A",8
1234894290138124289,2020-03-03 17:31:56,"Tennessee is supposed to vote today, even though tornadoes devastated the state overnight. So is neighboring Alabam… https://t.co/eKHXgdCqTN",3
1234891661173493760,2020-03-03 17:21:29,"A woman was sexually assaulted by a ride-sharing driver who picked her up from a bar in Lakeview, Chicago police say https://t.co/wqoREOAYMf",2
1234889027502985219,2020-03-03 17:11:01,How long does the coronavirus last on surfaces? Does it matter what brand of soap you use? Your questions on the ou… https://t.co/KVzw9kkmyF,4
1234885896698286080,2020-03-03 16:58:35,The trial of the man accused of killing Chicago police Cmdr. Paul Bauer — a broad-daylight downtown shooting that s… https://t.co/wYjPwcr0Cn,4
1234884177595641857,2020-03-03 16:51:45,RT @ElyssaCherney: Crowdsourcing for @chicagotribune article: Do you know any college students studying abroad who must return home due to…,12
1234883026590556161,2020-03-03 16:47:11,We tried the new Wendy’s Breakfast Baconator. It's hardly a rival to the Egg McMuffin. https://t.co/erfLVt1uy5,1
1234880185419403266,2020-03-03 16:35:53,Days after an unarmed man was shot and seriously wounded by Chicago police during a struggle at a busy CTA Red Line… https://t.co/OAcsrudsze,2
1234877350497701888,2020-03-03 16:24:37,"For reluctant cord-cutters, AT&amp;T is launching on Monday a new streaming service that offers a cable-like experience… https://t.co/49QNYDoPEE",4
1234871019279724545,2020-03-03 15:59:28,At least 19 people have now been reported dead in Nashville and Tennessee after tornadoes ripped through the state… https://t.co/FPLGc53V8f,5
1234867005813067777,2020-03-03 15:43:31,"A candidate for Indiana state representative is under a restraining order for alleged harassment. He says, ""Frictio… https://t.co/cbouIviX5B",0
1234864150008025094,2020-03-03 15:32:10,The Federal Reserve is cutting interest rates by a half-percentage point in its first emergency rate cut since the… https://t.co/BsoHJV3n2O,4
1234859078150692864,2020-03-03 15:12:01,A teacher who was fired for bringing a loaded gun to school in south suburban Markham was hired at another school i… https://t.co/i5HPI18GMh,8
1234855545661685764,2020-03-03 14:57:59,"A fifth person in Illinois is thought to have coronavirus, though the case is suspected, not confirmed. https://t.co/AfZL7IHR6x",13
1234851147841785856,2020-03-03 14:40:30,"Making a 38-year-old woman the star of ""The Bachelorette"" flies in the face of societal expectations for straight w… https://t.co/6oMIY1DCzP",3
1234847780377632768,2020-03-03 14:27:07,"Target reported strong profits at the end of 2019, but its sales were weighed down by weak toy and electronics sale… https://t.co/d6RyHRwydy",3
1234842468853612545,2020-03-03 14:06:01,The NBA has told players to avoid high-fiving fans and strangers and avoid taking any item for autographs in respon… https://t.co/uCBx6pG4UI,5
