id,created_at,text,retweet_count
1241168930623959040,2020-03-21 01:05:07,Congress and the White House are in high-stakes negotiations on a $1 trillion-plus economic rescue package that wou… https://t.co/FEDHKFQw7s,8
1241167150871646209,2020-03-21 00:58:03,Illinois will be under a stay-at-home order starting tomorrow evening. Here's what that means for you. https://t.co/qdRd9zbAxE,22
1241166430902640641,2020-03-21 00:55:11,"RT @byalisonbowen: A nurse told me today she bought her own protective equipment at a hardware store. 

https://t.co/a07XmUHd9R",28
1241164560821817344,2020-03-21 00:47:45,Want to help out-of-work restaurant and bar professionals? Here are more than 150 ways. https://t.co/3o03QnJXXf,4
1241160141254393856,2020-03-21 00:30:11,A third resident has tested positive for COVID-19 at a senior living facility in Evanston. 21 cases have been confi… https://t.co/eDSp3xccgK,8
1241157573090381832,2020-03-21 00:19:59,$10 toilet paper? Coronavirus price gouging complaints surge in the U.S. https://t.co/Ic8UBwMmQn,9
1241154825263423491,2020-03-21 00:09:04,"ICE anunció que limitaría arrestos, pero que detendrán deportaciones. Se enfocarán en individuos que sean ""un riesg… https://t.co/wMFeZZSZh9",4
1241152316104941569,2020-03-20 23:59:06,"“It still doesn’t even feel real. I still feel like we’re getting ready to play.”

Northwestern’s lost opportunity… https://t.co/kiu553yVAv",3
1241147665565523969,2020-03-20 23:40:37,"Just days after ramping up drive-thru coronavirus testing, the Advocate Aurora Health hospital system suspended its… https://t.co/avSAYyQdUR",36
1241145766728675328,2020-03-20 23:33:04,"A member of Vice President Mike Pence’s staff has tested positive for the coronavirus, the White House said. https://t.co/pHrAJtBcxL",7
1241144312743821312,2020-03-20 23:27:18,Some popular recent movies are now available to stream. Here's where to watch — plus our reviews. https://t.co/CCehQSGRF5,7
1241141313816481794,2020-03-20 23:15:23,After taking fire from the Cook County court clerks’ union for her handling of their work during the coronavirus pa… https://t.co/fFL8so8bpI,4
1241138643198189568,2020-03-20 23:04:46,"Gov. Pritzker's ""stay at home"" order will close all libraries in Chicago, to the relief of librarians who worried a… https://t.co/trWEXB5Byu",36
1241135914996416512,2020-03-20 22:53:55,"Mark Hinojosa, a University of Missouri journalism professor and former Tribune multimedia editor, has died. He was… https://t.co/hHrPBqSQtt",5
1241132449566019590,2020-03-20 22:40:09,"Illinois State University alum Colton Underwood, the former star of “The Bachelor,” has tested positive for the cor… https://t.co/xb90ARPilx",10
1241130949460537351,2020-03-20 22:34:12,"A partir del sábado a las 5 de la tarde, sólo podrán salir para ir a tiendas de comestibles, a poner gasolina o par… https://t.co/LL0NTchXhH",3
1241128514608345088,2020-03-20 22:24:31,"Here are today’s top stories in Chicago politics, from @byldonovan https://t.co/8OKzrtcgNp",2
1241126145493532672,2020-03-20 22:15:06,Gov. Pritzker issued a “stay at home” order Friday in an effort to prevent further spread of the coronavirus. Read… https://t.co/daLkBYxfGM,31
1241125224755736576,2020-03-20 22:11:27,Illinois' statewide school shutdown will be extended through at least April 7 in the continued effort to impede the… https://t.co/DGW6iD11ek,8
1241121910982877185,2020-03-20 21:58:17,Why not foster a pet while you're stuck at home anyway? Volunteers are in dire need as the coronavirus pandemic kee… https://t.co/PuVnRUCclv,28
1241118697768525833,2020-03-20 21:45:31,There’s only one way out of this crisis: slow the spread of COVID-19. It won’t be easy for any of us. But we can do… https://t.co/6UmtTffoNF,21
1241115373694603267,2020-03-20 21:32:18,Trapped inside? Grocery store out of chicken? Buy a couple steaks and try this reverse sear method to get a perfect… https://t.co/thGTAG7vfn,6
1241111488372396034,2020-03-20 21:16:52,The acts of kindness we’re seeing these days are flickers of light in a tough time: a customer offering to pay for… https://t.co/X3AJUqD1ca,15
1241108502929715201,2020-03-20 21:05:00,"No, you don't need to run out to the grocery store or the gas station. Here's what to know about Illinois' new stay… https://t.co/fmDV5ltpyT",42
1241103489931018241,2020-03-20 20:45:05,"“There is absolutely no need to rush out to a grocery store or a gas station,” Illinois Gov. J.B. Pritzker said as… https://t.co/MRgS1WzSJA",121
1241099427361800193,2020-03-20 20:28:56,"in addition to the stay-at-home order, Illinois announced 163 new cases of COVID-19, bringing the statewide total t… https://t.co/4xnM645SOV",43
1241099252249624576,2020-03-20 20:28:14,Still have questions about social distancing? Or know someone who needs some extra guidance? Here's what to know: https://t.co/4hMyzSbllu,6
1241096709251444736,2020-03-20 20:18:08,"Gov. J.B. Pritzker announces ""stay-at-home order"" for Illinois starting at 5 p.m. Saturday to slow coronavirus spre… https://t.co/zP0HINpyyA",542
1241094778785337345,2020-03-20 20:10:28,Watch live as Gov. J. B. Pritzker is expected to announce a statewide stay-in-place order as he and health official… https://t.co/KqxANlMkMd,18
1241094717468815361,2020-03-20 20:10:13,A number of Cook County Jail detainees have been released this week to help relieve jail crowding during the corona… https://t.co/Bu4dqnRCie,3
1241092226953945088,2020-03-20 20:00:19,Correction: Southwest Airlines has updated most — but not all — flights out of Midway Airport https://t.co/Vru9RZDMnO,18
1241091140973191169,2020-03-20 19:56:01,Drive-thru testing for the coronavirus is starting up at some Chicago-area hospitals — but it’s by appointment only. https://t.co/vPX6BaJp35,14
1241087579895869444,2020-03-20 19:41:51,"Eating a diet that’s high in fruits, vegetables and whole grains is important to staying healthy, especially when i… https://t.co/o7wj8Y74lI",10
1241084980115263493,2020-03-20 19:31:32,Experts weigh in on which cleaners and disinfectants to use to prevent COVID-19 transmission at home https://t.co/qg0zneDHgd,4
1241081640031522819,2020-03-20 19:18:15,"At a news briefing yesterday, President Trump overstated the potential upside of a decades-old malaria drug in help… https://t.co/JCp4U4VYq1",8
1241078906419019776,2020-03-20 19:07:24,"Patricia Frieson, a retired nurse who lived on the South Side, was the first Illinois resident to die from the coro… https://t.co/g3Ykmbmfj1",12
1241075252085522432,2020-03-20 18:52:52,Esencialmente ordenando a los residentes que permanezcan en sus hogares mientras los funcionarios toman medidas drá… https://t.co/vfCkT61Uc0,3
1241072948632567808,2020-03-20 18:43:43,Southwest Airlines cancels all fights in and out of Midway https://t.co/isHDMVJG5D,106
1241069734579372033,2020-03-20 18:30:57,San Francisco shows what life is like during a shelter-in-place lockdown order https://t.co/BtbydOStRc,3
1241066489907679232,2020-03-20 18:18:03,"New York state is joining California by confining nearly all residents to their homes, taking sweeping efforts to c… https://t.co/Ayp6Pfu4ka",13
1241064423483150337,2020-03-20 18:09:51,Illinois Gov. J.B. Pritzker is expected to announce a statewide shelter-in-place order at 3 p.m. Friday during a ne… https://t.co/oZ7HNeh3jh,386
1241063036577693696,2020-03-20 18:04:20,"Here's your guide to what's on TV today, including a close look at the 2018 PBS documentary about the 1918 flu epid… https://t.co/D2AAVicfoL",13
1241058387841990656,2020-03-20 17:45:52,"Chicago has launched a coronavirus relief fund for our hardest-hit residents. In one day, it raised $8 million. https://t.co/5gjcgZufyT",31
1241055679785426946,2020-03-20 17:35:06,"Illinois Gov. J.B. Pritzker plans to issue a “shelter-in-place” order for the entire state starting Saturday, sourc… https://t.co/lFt72r2Pkr",1211
1241052257929637888,2020-03-20 17:21:30,You can now order your craft beer for delivery in Illinois https://t.co/BVru9WEmQm,14
1241050782075584520,2020-03-20 17:15:38,A Chicago Tribune editor underwent a drive-thru test for COVID-19 yesterday at a downtown medical facility. Here's… https://t.co/V9hZyDaJ7D,12
1241047728135815169,2020-03-20 17:03:30,The adventures of Wellington and his Shedd Aquarium penguin pals are just the coronavirus distraction we need: https://t.co/2ruOKydCk9,8
1241044710099165185,2020-03-20 16:51:31,You’ve already watched “Frozen 2” a bazillion times. We understand the struggle. Here are 10 movies for the little… https://t.co/0rbocQvRGA,4
1241041318350028800,2020-03-20 16:38:02,"Disney and Pixar’s new movie “Onward,” starring Chris Pratt and Tom Holland, is hitting the internet early: It'll b… https://t.co/LbLq5a7T4b",12
1241040438708113410,2020-03-20 16:34:32,Coronavirus in Illinois updates: Here’s what’s happening Friday with COVID-19 in the Chicago area https://t.co/6sEjs6JhPQ,6
1241035396072554499,2020-03-20 16:14:30,A major Chicago-area hospital system announced Friday that it has suspended all coronavirus testing sites because o… https://t.co/JCf7BnUxuU,80
1241032508055183360,2020-03-20 16:03:01,"RT @StevenKJohnson: I reviewed ""Influenza 1918,"" the PBS doc from last year, and, um, gulp. 

https://t.co/EcZOjC4iWE",20
1241032487758966784,2020-03-20 16:02:57,Illinois nursing homes have been among the worst for following infection-control rules. That leaves longtime critic… https://t.co/Cysn8aUlXV,10
1241029767643705344,2020-03-20 15:52:08,Watch live: President Trump and the coronavirus task force give the latest updates in the U.S. battle against the p… https://t.co/iLCzxOfBd2,1
1241028438972141568,2020-03-20 15:46:51,Many renters will not be eligible for eviction protections under President Trump's coronavirus proposal https://t.co/18vITOCFF1,10
1241025388274503683,2020-03-20 15:34:44,"A longtime NBC News employee has died after testing positive for the coronavirus, one of the first casualties of th… https://t.co/xVSzkHdevn",19
1241022549636644871,2020-03-20 15:23:27,"A body was found in Lake Michigan in an area of Holland State Park, where a teenage girl from Flint vanished in Jan… https://t.co/cT4p1g0qrR",3
1241019613175066632,2020-03-20 15:11:47,"As a public service to our readers and community, we have lowered the paywall on some of our most critical stories… https://t.co/cVErUgbh3J",11
1241013481983311872,2020-03-20 14:47:25,The IRS is pushing back the deadline to file tax returns to July 15 — a three-month delay — as the coronavirus rava… https://t.co/66g2Egs8bj,19
1241011646711115776,2020-03-20 14:40:08,Grocery stores and delivery services are rushing to hire thousands of workers to handle a crush of business related… https://t.co/MOiKepGm6a,25
1241006904060645378,2020-03-20 14:21:17,"Some of Chicago’s swankiest hotels have gone dark, temporarily closing their doors to overnight guests. And the alr… https://t.co/xznsFWQrV2",9
1240997182611824640,2020-03-20 13:42:39,Trapped inside? Grocery store out of chicken? Buy a couple steaks and try this reverse sear method to get a perfect… https://t.co/soNrYpR5pj,8
1240989618939535361,2020-03-20 13:12:36,After Naperville voters said they want to allow recreational marijuana sales in the suburban city in a referendum T… https://t.co/oJLcEpU1bD,2
1240986924262789125,2020-03-20 13:01:53,"People broke into three different stores in the Lakeview neighborhood and stole three ATM machines, cigarettes and… https://t.co/9QlCy0pLm2",6
1240984043912650754,2020-03-20 12:50:27,Chicago’s first responders have even been spat on. Covered in blood. Exposed to dangerous substances used to mix na… https://t.co/PGt90kbLOU,20
1240981249583349760,2020-03-20 12:39:20,A preschooler in suburban Bartlett has tested positive for the coronavirus https://t.co/VDZp6WxksJ,14
1240977435702833152,2020-03-20 12:24:11,"Coronavirus in Illinois updates: Here’s what’s happening Friday with COVID-19 in the Chicago area, paywall-free https://t.co/DNfIUiBbgW",10
1240974763079733248,2020-03-20 12:13:34,At least two senators sold stock shortly before markets tanked: One then warned a group that coronavirus could be l… https://t.co/2ZrwY11Q3W,36
1240971383737384960,2020-03-20 12:00:08,"Good morning, Chicago. Here are some top stories to start your day:

- Lightfoot extends CPS closure
- State nursin… https://t.co/xmSeAjCiR7",2
1240963417189560321,2020-03-20 11:28:29,"Coronavirus news, both good and bad: Global deaths from COVID-19 surpass 10,000, but Japan plans to reopen schools… https://t.co/RJ5sMX8ZcR",8
1240958858060800000,2020-03-20 11:10:22,"""We did try. But nobody showed up."" https://t.co/nG1497nYVW",12
1240951131746041856,2020-03-20 10:39:40,"Before the coronavirus outbreak, a cascade of warnings went unheeded: A pandemic exercise named “Crimson Contagion""… https://t.co/0r2EQGm2wc",52
1240945816459710464,2020-03-20 10:18:32,At least two senators sold big chunks of stock right before the market tanked in February amid COVD-19's spread. So… https://t.co/m9PaUjvOQt,37
1240943167916122113,2020-03-20 10:08:01,A woman pulled her 6-month-old daughter out of an SUV that a gunman tried to carjack Thursday afternoon in River No… https://t.co/a29OyFLvKK,3
1240864906381058054,2020-03-20 04:57:02,"Eating a diet that’s high in fruits, vegetables and whole grains is important to staying healthy, especially when i… https://t.co/YGTNXt5wkp",19
1240855608536023045,2020-03-20 04:20:05,Senate Intelligence Committee Chairman Richard Burr sold as much as $1.7 million in stocks just before the market d… https://t.co/Dnt0XuL5Uy,42
1240854252123275266,2020-03-20 04:14:42,Sophia Bush sold her West Loop penthouse for $1.97 million. Take a look inside. https://t.co/TBP7eg7rkY,3
1240851568175591424,2020-03-20 04:04:02,"Illinois hospitals say they are facing a “critical shortage” of personal protective equipment, sending an urgent pl… https://t.co/h6CLOKxFPz",51
1240850597647171585,2020-03-20 04:00:11,"Community policing officers are reaching out to hundreds seniors in Chicago to make sure they have food, medicine a… https://t.co/RSEUuz5Fc9",2
1240850596607004672,2020-03-20 04:00:10,"Gov. Pritzker stopped short of ordering Illinois residents to ""shelter in place"" as the state's death toll rose to… https://t.co/uCny5qGoNl",15
1240850595608539138,2020-03-20 04:00:10,"In a climate of global uncertainty, Illinois Democrats overwhelmingly sided with Joe Biden to win the party’s presi… https://t.co/9TCkCDPG57",2
1240846554828812288,2020-03-20 03:44:07,What does Marie Newman's victory over U.S. Rep. Dan Lipinski mean? Illinois' 3rd District will likely soon have a r… https://t.co/wgg6BLHmFV,14
1240843033454796801,2020-03-20 03:30:07,"More than 64,000 Illinoisans submitted unemployment claims since Monday. That's more than 10 times as many as the s… https://t.co/6iLuISsr9R",22
1240842584802701312,2020-03-20 03:28:20,"While many Americans are fleeing their offices to avoid any contact with the coronavirus, low-wage janitors are som… https://t.co/rECxAt2oJK",29
1240842274378059784,2020-03-20 03:27:06,"RT @RexHuppke: Trump's #coronavirus stimulus checks should come with a non-disclosure agreement 

""In this time of great national unity, ma…",9
1240839183176011777,2020-03-20 03:14:49,Photos show public spaces in Chicago and across the world sitting nearly empty during the coronavirus pandemic https://t.co/0IQDr4bLs3,14
1240836636746883072,2020-03-20 03:04:42,"This eerie moment has presented us with new questions, one of them being: Can I go out for a walk?

@MarySchmich sh… https://t.co/Foivcgnhhm",4
1240832709947252737,2020-03-20 02:49:06,We're taking a look at how Chicagoans' day-to-day lives are changing during a pandemic that's forcing millions of p… https://t.co/l5cL02HjDl,2
1240830939405705225,2020-03-20 02:42:04,Mayor Lori Lightfoot ordered the closure of City Hall to the public in an effort to prevent the further spread of t… https://t.co/KcOUjRwr2z,11
1240828933802799104,2020-03-20 02:34:05,How should you tell a family member to postpone a planned gathering like a first birthday party or a confirmation d… https://t.co/DC9pVFDnUu,3
1240827805941858305,2020-03-20 02:29:37,"For taxi drivers, closed businesses and social distancing mean no rides. One driver said he recently waited half a… https://t.co/rYQqQRmxSJ",7
1240824517435555840,2020-03-20 02:16:33,California Gov. Gavin Newsom has ordered the state's 40 million residents to stay at home as the coronavirus threat… https://t.co/swYNqPvpS4,20
1240822905119952897,2020-03-20 02:10:08,Nursing homes are on the front lines of the battle to contain the coronavirus. But records show Illinois’ facilitie… https://t.co/m9l6RmUmGB,2
1240822900556431361,2020-03-20 02:10:07,"RT @tracyswartz: Tonight was the ""Very Cavallari"" Season 3 finale.

Besides trying to make us believe that she considers Chicago to be her…",1
1240820385471496192,2020-03-20 02:00:07,"The shutdown of Chicago Public Schools will be extended through April 20, Mayor Lori Lightfoot announced. https://t.co/wCynJff8yT",14
1240820123402936326,2020-03-20 01:59:05,Tribune photojournalist @mandophotos asked 12 people in neighborhoods across Chicago how they felt about the corona… https://t.co/4IKx41Wxkj,1
1240817064383778818,2020-03-20 01:46:56,"The owner of a suburban strip club vowed to keep his establishment open, coronavirus or not. There was only one pro… https://t.co/QaR4x7cH92",20
1240813535292198913,2020-03-20 01:32:54,Nikki Haley has resigned from the board of Boeing because of her opposition to a bailout of the airplane manufactur… https://t.co/7srWqUqJRg,16
1240810535454748672,2020-03-20 01:20:59,"We asked a handful of people across the Chicago area to keep diaries of their thoughts, hopes, fears and observatio… https://t.co/452tO6RL6w",4
1240810090346708995,2020-03-20 01:19:13,RT @chitribopinions: Op-ed by Rod Blagojevich: I urge Gov. J.B. Pritzker to immediately call the General Assembly back to work in order to…,15
1240805273683492866,2020-03-20 01:00:04,Two Chicago police officers were fired for shooting at moving car in a 2016 videotaped incident that ended with dea… https://t.co/AdonpcgbEZ,0
1240802164810924032,2020-03-20 00:47:43,You’ve already watched “Frozen 2” a bazillion times. We understand the struggle. Here are 10 movies for the little… https://t.co/taq1FQMurd,6
1240799626304860161,2020-03-20 00:37:38,Oak Park’s shelter-in-place order takes effect tonight. San Francisco shows what life is like during a lockdown. https://t.co/RGFteOklaK,9
1240793952267177986,2020-03-20 00:15:05,"Hundreds of outreach workers operate in Chicago, mediating gang conflicts and connecting people with social service… https://t.co/G8F3PcuLXC",7
1240792186809126912,2020-03-20 00:08:04,"Illinois hospitals sent an urgent plea Thursday for more face masks, asking construction companies and other indust… https://t.co/khCDBWROWk",42
1240791676144226309,2020-03-20 00:06:03,"“Italy wanted to order 4,000, but there’s not a chance. We sent them something like 400.”

Without an adequate supp… https://t.co/3BD25hsXq4",18
1240789932660215809,2020-03-19 23:59:07,"With Chicago Public Schools now staying closed until April 21, there’s a “very real possibility” that Illinois' sta… https://t.co/jh6fkkL4np",12
1240787339284267009,2020-03-19 23:48:49,"We now have more than 800 restaurants in this searchable dining guide.

Here's our running list of Chicago-area res… https://t.co/mh1NFAbd4D",24
1240782644901748737,2020-03-19 23:30:09,"“Before it was, 'Oh my God, that’s so unprofessional to have your kids screaming in the background,'” Bond said. “N… https://t.co/5k6jw4ZJhs",12
1240781350099132416,2020-03-19 23:25:01,President Trump said the government should take partial ownership of companies bailed out in the coronavirus pandem… https://t.co/2hL869sKvO,10
1240778862818140160,2020-03-19 23:15:08,"Drive-up coronavirus tests will soon be available at some big-box stores, including a Walmart in suburban Northlake. https://t.co/X8je7gbhO6",8
1240777572742561792,2020-03-19 23:10:00,"The coronavirus outbreak at a nursing home is just the latest in a string of ""nightmares"" in Willowbrook. 46 people… https://t.co/USWU4thbRV",8
1240775077022572547,2020-03-19 23:00:05,A Chicago Tribune editor underwent a drive-thru test for COVID-19 this afternoon at a downtown medical facility. He… https://t.co/zaJAaTXIvH,1
1240766204664516618,2020-03-19 22:24:50,"""They are considering their necessities, and to some that’s ammo.”

Many businesses have shut down in response to t… https://t.co/uWOUrNeyyG",4
1240762924014219265,2020-03-19 22:11:48,Mayor Lori Lightfoot will keep Chicago Public Schools closed through April 20 and has created a $100 million fund t… https://t.co/1bUzxeKeqI,315
1240761445454929924,2020-03-19 22:05:55,Watch live: Chicago Mayor Lori Lightfoot is providing an update on the city’s response to the coronavirus pandemic https://t.co/ftPVybDhK2,3
1240759998612987909,2020-03-19 22:00:10,"Since he moved to Chicago over 30 years ago, Chris Jones comforted himself by knowing if anything were to happen to… https://t.co/FAv5AWo1cy",4
1240755202409598977,2020-03-19 21:41:07,The Spin: What to expect at Mayor Lori Lightfoot's 5 p.m. address on Chicago's response to the coronavirus pandemic: https://t.co/WaPIKZzF9Q,4
1240754444666572806,2020-03-19 21:38:06,"Senate Majority Leader Mitch McConnell is proposing direct payments of $1,200 per person and $2,400 for couples ami… https://t.co/o0RAJU7yct",15
1240754058153132033,2020-03-19 21:36:34,"Florida investor Mason Slaine has acquired a 7% stake in Tribune Publishing, the company that owns the Chicago Trib… https://t.co/tbvwwiMg1e",2
1240751665852174336,2020-03-19 21:27:03,Fake coronavirus test kits were seized this week by U.S. Customs and Border Protection agents at O’Hare airport. https://t.co/PZU3b2LCIu,39
1240748136685080578,2020-03-19 21:13:02,"The Archdiocese of Chicago announced that Palm Sunday and Holy Week services — including the Chrism Mass, one of th… https://t.co/iS5U3bcVsI",9
1240748136601210881,2020-03-19 21:13:02,A medical examiner confirmed a Chicago woman died yesterday from pneumonia due to the new coronavirus https://t.co/QDWwG3vkDs,4
1240745553761382400,2020-03-19 21:02:46,The Archdiocese of Chicago said Palm Sunday and Holy Week services will not be celebrated publicly because of coron… https://t.co/iH8IUjCm7x,10
1240745201993429021,2020-03-19 21:01:22,"RT @phillipstribune: Streaming on @PrimeVideo tomorrow: BLOW THE MAN DOWN, a pungently acted Maine crime story. Alternate title: ""East of F…",5
1240743379186724867,2020-03-19 20:54:08,"In the recent presidential primary, Illinois Democrats voted moderate and smartly rejected Sanders’ unaffordable pr… https://t.co/fajjfEOLhx",4
1240740659474108417,2020-03-19 20:43:19,Illinois nursing homes have been among the worst for following infection-control rules. That leaves longtime critic… https://t.co/JGQeO9NFwL,7
1240737058253090819,2020-03-19 20:29:01,You’re probably trapped at home and wondering which music streaming service sounds the best. So were we. https://t.co/UMi8Gxf2gw,5
1240732697619808263,2020-03-19 20:11:41,The White House issued an urgent new warning telling Americans not to travel abroad under any circumstances amid th… https://t.co/xSL2bvbkAX,9
1240731548917411845,2020-03-19 20:07:07,Experts weigh in on which cleaners and disinfectants to use to prevent COVID-19 transmission at home https://t.co/2G7PGYDxLH,10
1240730900968726535,2020-03-19 20:04:33,"State officials also announced  134 new coronavirus cases, bringing the statewide total 422 cases in 22 counties, T… https://t.co/M21EUsGpJo",8
1240728520797675520,2020-03-19 19:55:05,Gov. J.B. Pritzker announced 3 more coronavirus deaths in Illinois https://t.co/SbjEBJuE8m,7
1240726955886096384,2020-03-19 19:48:52,Watch live: Gov. J.B. Pritzker and health officials are about to provide an update on the coronavirus pandemic in I… https://t.co/YJeMuQH50F,5
1240725982404915200,2020-03-19 19:45:00,"General Motors, Ford and Fiat Chrysler have agreed to “extensive plans” to avoid union members coming in contact wi… https://t.co/RebrPh1MP1",2
1240721717443596288,2020-03-19 19:28:03,"Less than a month ago, the idea of Alinea, one of the most expensive and acclaimed restaurants on earth, offering a… https://t.co/QOWLsBWjjg",23
1240719284273401862,2020-03-19 19:18:23,"Rather than go cold turkey on sports, you’re probably looking for programming to stream.

We’re here to help.
https://t.co/U09iBrv0sI",1
1240713861814030337,2020-03-19 18:56:50,"First it was the NBA. Then the NCAA Tournament, MLB, NHL, MLS, Kentucky Derby and more. Here’s how sports are affec… https://t.co/xuoE6OVEfl",4
1240710778522501120,2020-03-19 18:44:35,RT @borrelli: I asked four people around the Chicago area to keep diaries for 24 hours about how their lives were changing right now. Here'…,12
1240710648243224581,2020-03-19 18:44:04,$10 toilet paper? Coronavirus price gouging complaints surge in the U.S. https://t.co/x6zyUp0Ogt,13
1240707099304161280,2020-03-19 18:29:58,"When the clock strikes midnight, Oak Park residents will placed on lockdown, the subjects of a dramatic shelter in… https://t.co/P1ls5380Ab",8
1240702979704901632,2020-03-19 18:13:36,The coronavirus pandemic has closed thousands of stores nationwide. Here are some still open in the Chicago area. https://t.co/JYLlqxdr2Q,9
1240699266592411648,2020-03-19 17:58:50,"Students and staff at a Winnetka school are being told to self-quarantine for 14 days, after a 7th-grader was diagn… https://t.co/MSAwgvcHVq",10
