id,created_at,text,retweet_count
1122899578951491584,2019-04-29 16:24:56,"Tonight, we are holding a hearing to ask the VA and other federal agencies how we can work together to combat this… https://t.co/1aj6f0e0GI",21
1122899577982656516,2019-04-29 16:24:56,Veteran suicide is a public health crisis in America. We lose 20 veterans to suicide every single day. We all have… https://t.co/OhaXxalKo7,74
1122891870445686786,2019-04-29 15:54:18,Last night I spoke at the Lowcountry Salutes! celebration to honor Lowcountry students who are entering the armed f… https://t.co/OtUosE01oY,0
1122858478391918593,2019-04-29 13:41:37,"""So it will be important for Rep. Joe Cunningham, D-S.C., to keep tooting his horn and other members of South Carol… https://t.co/B3kqTIQ0R6",84
1122849780462309376,2019-04-29 13:07:03,"RT @ChasCityPaper: Winner of best local legislator, best news story, and progressive, @RepCunningham, will cross the aisle to help the Lowc…",12
1122291740160012289,2019-04-28 00:09:36,"Today, I mourn alongside the entire community of Poway. This is yet another painful reminder - six months after the… https://t.co/Kd9IShIvXM",67
1122289218351509505,2019-04-27 23:59:35,"RT @GabbyGiffords: On the final day of Passover, the shooting at the synagogue in San Diego breaks my heart.

Hate has no place in our coun…",302
1121857880842543105,2019-04-26 19:25:36,Pretty cool! You won’t want to miss it! https://t.co/TznsalYhgK,1
1121857576344403968,2019-04-26 19:24:23,Well I can check that off my bucket list! It was so great to meet the @BlueAngels and check out a preview of the Be… https://t.co/YSUmA6LLtk,7
1121822136207847425,2019-04-26 17:03:34,"It was an honor to meet Lance Cpl. Caleb Eudy at his graduation this morning. His story, commitment, and sacrifice… https://t.co/SdoiLZynRG",3
1121789172681969664,2019-04-26 14:52:35,"Thank you to @StaceyPlaskett, co-chair of the @NewDemCoalition infrastructure task force, for joining me yesterday… https://t.co/HvDRd9t0Hj",12
1121495366229200903,2019-04-25 19:25:06,Every single person who played a role in the fight against offshore drilling deserves a round of applause. But this… https://t.co/figUOBuJcx,54
1121495365587492872,2019-04-25 19:25:06,"And NOW, Interior Secretary Bernhardt announced that - in part because of the ongoing litigation and clear oppositi… https://t.co/LhLt1Q1n5Z",80
1121495364937318410,2019-04-25 19:25:06,"Last month, the courts got involved as well. A federal judge ruled that Trump did not have the authority to overtur… https://t.co/nEMVxVnDOb",21
1121495364262072320,2019-04-25 19:25:05,We made it clear that opposition to offshore drilling was NOT a partisan issue. We all know that our coastlines are… https://t.co/3vBFlR6Ls5,19
1121495363540652032,2019-04-25 19:25:05,"On my 4th day in office, I introduced a bill that would place a ten-year ban on oil and gas leasing. Last month, I… https://t.co/NPmCHRPt6m",15
1121495362739609602,2019-04-25 19:25:05,The reaction from the Lowcountry and coastal communities across the country was immediate. While running for office… https://t.co/OCSPGLNQqG,14
1121495361955274758,2019-04-25 19:25:05,I just heard reports that the Trump Adminstration was halting its plans to expand offshore drilling in the Atlantic… https://t.co/6A4XljzTgo,69
1121478347215781893,2019-04-25 18:17:28,This is great news but the fight is not over - we need permanent legislation that takes offshore oil and gas drilli… https://t.co/MzzODEp8K3,63
1121472840430125056,2019-04-25 17:55:35,Is there a Lowcountry small business that you absolutely love? Show your appreciation by nominating them for the… https://t.co/2a9sH5HnZQ,0
1121447657703124993,2019-04-25 16:15:31,A selfie from the top of the Port of Charleston! Touring @SCPorts with @StaceyPlaskett while we discuss trade and C… https://t.co/M9llfeBxLk,8
1121414111974313984,2019-04-25 14:02:13,"So proud of our community in Beaufort who stepped up to honor the lives, service, and sacrifice of 3 Lowcountry vet… https://t.co/djyMf3Ux3O",4
1121224950952669184,2019-04-25 01:30:34,"“This is not my seat in Congress, it is your seat.  The doors of my offices are always open to you and we want to h… https://t.co/TbiN1xxGza",134
1120821396878372864,2019-04-23 22:46:59,"HAPPENING NOW: If you couldn't make it in person, you can tune into my town hall on Facebook here! 
https://t.co/4HPtA5wtWw",1
1120801377469353984,2019-04-23 21:27:26,Amanda and I had a great time touring @blackbaud today! They do such important work supplying software and services… https://t.co/kmvE719zkC,4
1120724944323862528,2019-04-23 16:23:43,"Hope to see you there! And for those of you who can’t make it, we’ll be live-streaming the event from our Facebook… https://t.co/SG8hb7qSK2",18
1120420230256312321,2019-04-22 20:12:53,I'm hosting a town hall TOMORROW in West Ashley! I hope you can make it! https://t.co/ANQmeJ8uU8,7
1120400720845516802,2019-04-22 18:55:22,I am so proud of Amanda - she's the light of my life and the rock of our family. I'm happy she shared a bit of that… https://t.co/44YbJsHzzI,12
1120388002327478278,2019-04-22 18:04:50,The significance of the Reconstruction era has often been overlooked or misunderstood. I'm proud to have helped pas… https://t.co/s0zVrQViTa,18
1120357581430632450,2019-04-22 16:03:57,Happy Earth Day! Part of what makes living in the Lowcountry so great is our vibrant natural resources. It's up to… https://t.co/JRxfAwJ9VN,62
1119970868078231552,2019-04-21 14:27:17,Heartbreaking news. We live in a world where this happens far too often. My thoughts and prayers are with the victi… https://t.co/xlNQlRB8Sm,72
1119632694110040064,2019-04-20 16:03:30,The Lowcountry is blessed to be home to the Gullah Geechee community. Glad to see @nytimes cover their unique cultu… https://t.co/rCn21fBfOk,73
1119297883830927360,2019-04-19 17:53:05,My statement on the release of the redacted Mueller report: https://t.co/N10VsouhJF,93
1119267203449331713,2019-04-19 15:51:10,Congratulations to Charleston native Kathryn Murphy! She received the Female Executive of the Year award for her wo… https://t.co/EzE8DiwQFW,6
1119017893411401728,2019-04-18 23:20:30,Thanks for having me at your first ever ‘Pints &amp; Politics’ @postandcourier! I really enjoyed answering everyone’s q… https://t.co/Bwnv9BWlTG,10
1118992782021079040,2019-04-18 21:40:43,This is great news! I introduced the Safe Housing for Families Act last month to require carbon monoxide detectors… https://t.co/TJO9x7RFy3,65
1118963567875756034,2019-04-18 19:44:38,"From there, I met with Gotcha Group, which operates
Charleston's bike-share system. It's a great way to get around… https://t.co/IQORAmRKAG",6
1118963558610554880,2019-04-18 19:44:36,This morning I joined Charleston's Department of Traffic and Transportation for a ride-a-long to discuss their tran… https://t.co/tKjpMmYN51,12
1118901460371234817,2019-04-18 15:37:50,I’m hosting a town hall in West Ashley this Tuesday! Looking forward to having conversations with our community abo… https://t.co/Eucenw7736,10
1118593269334728709,2019-04-17 19:13:12,"This morning I toured Marine Corps Air Station Beaufort, which plays an invaluable role in the safety and security… https://t.co/0XICRJQTdZ",5
1118580767351869440,2019-04-17 18:23:31,Thank you to everyone who joined me at my constituent event at Bricks on Boundary in Beaufort this afternoon! It wa… https://t.co/zdQybwn8pO,3
1118557931379806210,2019-04-17 16:52:47,"Earlier this week I met with @JDRF to talk about insulin prices, diabetes research, and protections for people with… https://t.co/OcQl33exRk",9
1118496160489062401,2019-04-17 12:47:19,On Monday I hosted a listening session with student veterans at @CofC. I’m committed to making sure the transition… https://t.co/xhGlIoy2vF,3
1118264185740300291,2019-04-16 21:25:32,"Today we laid a true public servant to rest. Simply put, Fritz Hollings was my hero. May his life and legacy be a g… https://t.co/ofmiMiSOfq",4
1117906278414573568,2019-04-15 21:43:21,I’ll be grabbing a quick lunch 'Where the Locals Eat' at Bricks on Boundary in Beaufort on Wednesday from 12:30pm-1… https://t.co/vPIZq71hW9,2
1117809951886458881,2019-04-15 15:20:35,We've accomplished a lot during my first 100 days serving the Lowcountry and I'm looking forward to all the progres… https://t.co/PozpKHkfmc,55
1117435406717468672,2019-04-14 14:32:16,"“In short, there is no compelling benefit to outweigh the obvious downsides of drilling off of South Carolina’s coa… https://t.co/UkbqN9rfDY",156
1117196453292716032,2019-04-13 22:42:45,Thank you to everyone who joined me during my day in Berkeley County! It was amazing to see all the hard work put i… https://t.co/LA6krcHSBb,34
1116806904263663617,2019-04-12 20:54:49,Enjoyed today’s listening session with veterans at the Citadel! We had a productive conversation about how to make… https://t.co/mfYROIJfXZ,45
1116762994665332736,2019-04-12 18:00:21,There is a lot happening in the news these days! An easy way to keep updated with what I'm working on in Washington… https://t.co/QFTpl7u9PL,6
1116458228722884608,2019-04-11 21:49:19,Join me next Thursday! Excited to hear from you all! https://t.co/agFdyxoc5k,6
1116431168805711875,2019-04-11 20:01:47,My statement on the Senate’s confirmation of David Bernhardt as Interior secretary ⬇️ https://t.co/VlutARktiO,116
1116410197038256134,2019-04-11 18:38:27,Seconded. https://t.co/SksTpyNQTI,8
1116388356374528000,2019-04-11 17:11:40,"A remarkable story of an honor that was long overdue. 

Thank you to the hardworking folks at @USCG who are trackin… https://t.co/VoFZ6wKcTJ",16
1116382763400216576,2019-04-11 16:49:26,Honored to be a speaker at this year's Charleston Forum! https://t.co/m2gZwIuw7a,5
1116360892571160581,2019-04-11 15:22:32,"I am proud to stand with black women as a member of the Black Maternal Health Caucus. 

Black women are four times… https://t.co/CTYbygLy3A",61
1116338620712062977,2019-04-11 13:54:02,🚨🚨My staff will be hosting office hours today at the Moncks Corner Library from 12:30PM-1:30PM. If you need help wi… https://t.co/UdMms2LjX1,9
1116059657133600775,2019-04-10 19:25:32,I’ll be grabbing my afternoon coffee at the Bald Monkey Beanery in Goose Creek this Saturday from 12:30pm - 1:30pm.… https://t.co/YRzBNBApVj,5
1116053740321112064,2019-04-10 19:02:01,I am proud to cosponsor the Keeping Our Promises Act introduced by @RepWesterman. Vietnam vets are suffering debili… https://t.co/XBFQ9K0Uzp,57
1116031866459557888,2019-04-10 17:35:06,Hey @CofC students! You still have today and tomorrow to vote for Student Body President and Vice President ⬇️ https://t.co/3GEz8zDuNE,11
1116025202356432896,2019-04-10 17:08:37,"I am proud the House voted today to #SaveTheInternet and restore #NetNeutrality, ensuring the internet is open to a… https://t.co/kM5CbwGTJg",119
1115671842881265664,2019-04-09 17:44:30,I support a Balanced Budget Amendment because we need to get serious about how we tackle our growing debt - which j… https://t.co/XJi9AKRhcR,35
1115642652354068480,2019-04-09 15:48:30,Thank you to ⁦@MilitaryOfficer⁩ for stopping by my office in DC! We had a great conversation about ensuring veteran… https://t.co/M2R5I9IPFf,27
1115409625027948554,2019-04-09 00:22:32,It was honor to stand with my delegation tonight and pay tribute to the life and legacy of Senator Fritz Hollings -… https://t.co/VZddDxPR6i,59
1115267465427206145,2019-04-08 14:57:39,Qualified South Carolina teachers are leaving the field because they have to work 2 or 3 jobs just to make it by.… https://t.co/cjWCFiEG1s,112
1115264238761783296,2019-04-08 14:44:49,I had a great time at this weekend’s “Joe in the Neighborhood!” Excited to find out ⁦@RepSusieLee⁩’s sister is a co… https://t.co/4tzKNU80Sz,8
1115253899970121728,2019-04-08 14:03:44,"A fitting tribute by some of the people who knew him the best 
https://t.co/wp78UhG0zI",10
1114943660938940417,2019-04-07 17:30:58,Thank you to everyone who joined me at Low Tide Brewing yesterday! We had a great conversation about flooding conce… https://t.co/FDHFmJ991P,37
1114527788193787906,2019-04-06 13:58:26,My statement on the passing of Fritz Hollings - a lion of South Carolina: https://t.co/Yg3Du6d19q,76
1114277205629177857,2019-04-05 21:22:42,It was such a privilege to be #behindthebar this afternoon at @Starbucks and learn more about their initiatives to… https://t.co/vD57z7GRpn,51
1114273876756836352,2019-04-05 21:09:29,Today I visited a dialysis center in Summerville and learned about the challenges dialysis patients face. Creating… https://t.co/uszfeQ9kLv,65
1114173904619278337,2019-04-05 14:32:13,Today and everyday we honor all the Lowcountry servicemen and women who made the ultimate sacrifice to our nation -… https://t.co/Cae35Gxyu1,11
1113951810262376450,2019-04-04 23:49:42,Want to chat? Come join me at Low Tide Brewing on Johns Island this Saturday from 12:30-2 PM for a casual conversat… https://t.co/LTX3O0pmPL,14
1113864336500580353,2019-04-04 18:02:07,I am honored to join colleagues on both sides of the aisle to pass the vital reauthorization of the Violence Agains… https://t.co/aQgFL3KKB4,81
1113574857072095232,2019-04-03 22:51:49,I am cosponsoring the bipartisan resolution led by @RepSchneider and @RepJerryNadler to make it clear that Congress… https://t.co/clShdEsF6P,21
1113553748440309760,2019-04-03 21:27:57,"I am proud that the Lowcountry is home to over 10,000 active duty servicemembers who are vital to our national secu… https://t.co/Tu0Q2D4N7y",58
1113548749903671298,2019-04-03 21:08:05,🚨🚨 My staff will be hosting office hours tomorrow at the Daniel Island Library from 12PM-1PM.  If you need help wit… https://t.co/7CdDmFWElg,12
1113517660925513729,2019-04-03 19:04:33,"Today, I voted to protect health care coverage for the 300,000 people in the Lowcountry living with a pre-existing… https://t.co/EFQG7EKWCM",38
1113466139579908096,2019-04-03 15:39:49,My staff is hosting office hours today at Hilton Head City Hall from 12PM-1PM. If you need help with a Social Secur… https://t.co/jTcUM0umsg,4
1113166212006072326,2019-04-02 19:48:01,"ICYMI: Congratulations to this historic graduating class!

https://t.co/xpXFKHOmXy",7
1113153505655754753,2019-04-02 18:57:31,Thank you @JimmyCarroll01 for coming up to DC today to testify on the importance of protecting coastal communities… https://t.co/n8e1i9GMSA,50
1113144049232416769,2019-04-02 18:19:57,"Women shouldn’t need to work 15 months to be paid what men receive in 12. It is time for #EqualPay. 

I’m proud tha… https://t.co/kRoTPpPab5",210
1113104750969589763,2019-04-02 15:43:47,"Opposition to offshore drilling is not a partisan issue in the Lowcountry. We've made it very clear that we do not,… https://t.co/szNjNkW4XX",128
1113097226195173376,2019-04-02 15:13:53,There is no such thing as a small oil spill. And when you drill - you spill. #ProtectOurCoast https://t.co/zOSbM53TKS,213
1113095538801627136,2019-04-02 15:07:11,Tourism is a 22.6 BILLION dollar industry in South Carolina and supports 1 out of every 10 jobs in our state. You s… https://t.co/mE25dOTIaL,264
1113081663062409219,2019-04-02 14:12:03,Coastal communities across the Lowcountry rely on clean water and healthy beaches for tourism and fishing. Needless… https://t.co/AMST6rTNUX,100
1113081444769857536,2019-04-02 14:11:11,RT @LCVoters: HAPPENING NOW: @NRDems are holding a hearing on protecting coastal communities from offshore drilling and consider @RepCunnin…,22
1113066821463273472,2019-04-02 13:13:04,Tune in at 10 AM: @IOPCity Mayor Jimmy Carroll is in Washington TODAY talking about the importance of protecting co… https://t.co/116kxRov0r,5
1111720666443730944,2019-03-29 20:03:56,I really enjoyed talking about my NEW bipartisan offshore drilling bill with our Lowcountry mayors and conservation… https://t.co/H93KsDqxsV,76
1111628252504838144,2019-03-29 13:56:43,"As the son of a Vietnam Vet, #VietnamWarVeteransDay has always been extra special to me. My dad taught me what it m… https://t.co/IDGy4dWdaG",107
1111354569399898114,2019-03-28 19:49:11,"RT @postandcourier: “The ban was always the end goal. No one wants offshore drilling off the coast of South Carolina, ever.”

U.S. @RepCunn…",48
1111265773329231872,2019-03-28 13:56:21,READ MORE HERE: https://t.co/ZmAW8rUP8O,21
1111265639619014657,2019-03-28 13:55:49,I just introduced the bipartisan Coastal and Marine Economies Protection Act to permanently ban offshore drilling o… https://t.co/jIAyXK5Yi4,245
1111044244280692736,2019-03-27 23:16:04,Proud that the House passed the Paycheck Fairness Act today.  South Carolina women earn just $0.79 for every dollar… https://t.co/wOG48zF2vo,59
1111019163794001921,2019-03-27 21:36:25,"The Special Olympics is an incredible, enriching experience for the millions of athletes that participate, like Rac… https://t.co/81DovfJXpi",99
1110977196351504389,2019-03-27 18:49:39,🚨🚨My staff will be hosting office hours tomorrow at Edisto Beach Town Hall from 12PM-1PM and Sangaree Library from… https://t.co/AVQdLbEUix,7
1110969990226808832,2019-03-27 18:21:01,Almost everyone I talk to in the Lowcountry has a loved one with a pre-existing condition - or one themselves! Thei… https://t.co/ZzUMOuJjnH,180
1110640409947131904,2019-03-26 20:31:23,"👀In case you missed it last week, the U.S. posted its largest ever monthly deficit in February. Last month's spendi… https://t.co/0WdvjfwCyx",117
1110635374093713408,2019-03-26 20:11:22,🚨🚨My staff will be hosting office hours tomorrow at the Bluffton Community Library from 12PM-1PM.  If you need help… https://t.co/i30BoOXpTp,6
1110599983122837504,2019-03-26 17:50:44,It was great meeting with AIPAC leaders from the Lowcountry to discuss the bipartisan support for Israel and the im… https://t.co/IrPGO5wjS5,7
1110591352113414145,2019-03-26 17:16:26,Protecting people with pre-existing conditions is not a partisan issue. Let’s stop sabotaging our health care syste… https://t.co/IhSyQZ63dt,24
1110325966902124544,2019-03-25 23:41:54,I am proud that the House just unanimously passed two important humanitarian bills for the people of Venezuela – en… https://t.co/EyliSw0xwk,84
1110205655107989505,2019-03-25 15:43:49,More than 80% of Americans – Democrats and Republicans – support restoring #NetNeutrality! I am cosponsoring the… https://t.co/926lXCTZTe,58
1109987824194019328,2019-03-25 01:18:14,My statement on AG Barr’s summary of the Mueller Report: https://t.co/SzqfXsumvI,12
1109862659913121794,2019-03-24 17:00:53,I look forward to seeing everyone at Riverfront Park in North Charleston at 3:30 for the second annual Charleston M… https://t.co/9u0mRI2h3R,16
1109861527753027584,2019-03-24 16:56:23,RT @AmericaNewsroom: WATCH: @SandraSmithFox spoke with @RepCunningham about bipartisan calls for the Mueller report to be made public #noon…,8
1109848974402482176,2019-03-24 16:06:30,I’ll be joining @SandraSmithFox at 12:15 PM ET - tune in!,2
1109194463904186368,2019-03-22 20:45:42,"As I’ve said countless times, closing the Charleston Loophole isn’t a partisan issue - it’s just common sense. https://t.co/texRKgzRj9",87
1109191226358747137,2019-03-22 20:32:50,Every day is #NationalPuppyDay in my house. Here’s a picture of Teddy being a very good boy! https://t.co/RQhcMYdLfC,10
1108108437458731009,2019-03-19 20:50:13,I want to thank the U.S. Chamber of Commerce and the Charleston Metro Chamber for gathering so many of the Lowcount… https://t.co/ZHjYXCTByN,7
1106657136564756481,2019-03-15 20:43:16,"A huge congratulations to Whitesides Elementary's Stephanie Haecherl, one of South Carolina's five finalists for Te… https://t.co/2zhUYraQTv",4
1106641332280442881,2019-03-15 19:40:28,My office helped Emily get her passport just in time for spring break! Reach out to my staff for problems big and s… https://t.co/Q27PvCUBSD,3
1106559126245654533,2019-03-15 14:13:49,"Horrified by the attacks in Christchurch. My heart is broken for the people of New Zealand, the victims and their f… https://t.co/HTW8OAQPMY",48
1106336496175509504,2019-03-14 23:29:10,"""It's discouraging to see that facts have kind of taken a backseat to political rhetoric,"" Rep. Cunningham told Sal… https://t.co/O90aJdIZAr",35
1106297658367447041,2019-03-14 20:54:50,RT @WBUR: Congressman Joe Cunningham (@RepCunningham) talks to @ljmullinsworld about his recent attention-grabbing move to bring awareness…,17
1106262945967890433,2019-03-14 18:36:54,"Awesome meeting the 2018-19 @policySC fellows, all working to improve public education throughout #southcarolina. T… https://t.co/OBrlq47p9z",15
1106187756781400065,2019-03-14 13:38:07,Happy Pi Day! @RepHoulahan and I broke down the numbers behind 3.14 and why our STEM backgrounds are so important. https://t.co/hwEit1DqP7,72
1106012047433781248,2019-03-14 01:59:55,I’ll be on @hereandnow tomorrow talking about all things seismic testing! Tune in to your local NPR station to hear! https://t.co/BhKasDmK2l,91
1105870099322421248,2019-03-13 16:35:52,"The bipartisan #EqualityAct has the backing from:

🇺🇸 70% of Americans 
📈💼160+ leading business
💪🌈 250+ organizatio… https://t.co/f8hCVXPU7G",86
1105867957396221953,2019-03-13 16:27:21,"South Carolina is one of 30 where LGBTQ people are at risk of being fired, evicted or denied services just because… https://t.co/hOis0o2I9b",264
1105550642343493633,2019-03-12 19:26:27,Two men died in a public housing complex in Columbia because of carbon monoxide poisoning - lives that could have b… https://t.co/CYfN4PpP05,316
1105546671826657280,2019-03-12 19:10:41,"RT @DoleFoundation: Live from Capitol Hill - 
@RepCunningham asks: What can we do to not only support our veterans, but also their caregive…",13
1105466483600179201,2019-03-12 13:52:02,"Thanks for the shoutout @jimmyfallon!! But if @CongressmanJVD came rushing in, it’s only because he too cares an aw… https://t.co/dk2Xdbegxd",40
1104464776367882240,2019-03-09 19:31:37,I had a great time at the @blackexposouth Economic Empowerment Summit. The Summit provides a opportunity for Minori… https://t.co/5VUstkyj0c,16
1104119665993940992,2019-03-08 20:40:16,"Thankful to count @RepSherrill, @RepSlotkin, @RepHoulahan, and @RepSpanberger as colleagues AND friends this… https://t.co/9bjTPb83uM",47
1104073323745550336,2019-03-08 17:36:07,"On #IWD2019 we honor the women who have changed our lives - our leaders, teachers, artists, politicians, family mem… https://t.co/ABK2fcts6y",39
1104065552455221249,2019-03-08 17:05:14,We all know our political system is broken. Politicians have created a system that works for themselves and no one… https://t.co/KSizzH51js,207
1104029891752804352,2019-03-08 14:43:32,"📰🗞️ Flash: When special interests and big corporations can buy influence, the government no longer serves you. Toda… https://t.co/LT3IpgmFCf",49
1103866926197948417,2019-03-08 03:55:58,👀ICYMI https://t.co/mHq1NgLCbV,122
1103749480149667840,2019-03-07 20:09:17,"Through legislation and everyday interactions, I hope we can always meet violence and fear with overpowering kindne… https://t.co/qC855QqbpJ",30
1103712549919444994,2019-03-07 17:42:32,"RT @RepDonBeyer: In this hearing on North Atlantic right whales, @RepCunningham just tried to get an Administration official to admit seism…",151
1103710516160221184,2019-03-07 17:34:27,"Today, I used an airhorn to demonstrate how disruptive seismic airgun blasting is to marine life. It was LOUD. Now… https://t.co/2WnMjJKQOC",5005
1103667465765179392,2019-03-07 14:43:23,It's not 🚀science  - public servants should actually serve the public. #HR1 prohibits Members of Congress from serv… https://t.co/jXYYJB7Wn7,316
1103438417843630080,2019-03-06 23:33:14,I will continue to ask these tough questions and hold BOEM accountable. South Carolina’s coastline is too important to risk.,28
1103438414689517568,2019-03-06 23:33:13,"The Taylor oil spill after Hurricane Ivan, which continues to leak to this day, is another example. BOEM tried to j… https://t.co/UIEOLQSQIg",66
1103438409639608321,2019-03-06 23:33:12,"The acting director of BOEM claimed that they have not seen a Hurricane cause a major oil spill, ignoring the 8 mil… https://t.co/bNdZwBFZXW",35
1103438407240433666,2019-03-06 23:33:11,I had a few questions for @BOEM about their plans for drilling off South Carolina’s coast. There's no existing onsh… https://t.co/cPhSdmbFeb,88
1103417989272080384,2019-03-06 22:12:03,My staff will be hosting office hours this Friday at the Goose Creek Library from 1:30PM-2:30PM. If you need help w… https://t.co/zSa7lrHUoA,9
1103401395049426949,2019-03-06 21:06:07,There are only two VA OBGYNs for female veterans in the entire state of South Carolina - a real barrier preventing… https://t.co/3FWj8YvEhw,123
1103323606061338624,2019-03-06 15:57:01,"Analysis shows that because of the Charleston Loophole, 276,000 firearms were sold in 2018 without a completed back… https://t.co/sN1tvmgbXP",140
1103301541233152004,2019-03-06 14:29:20,🗣️🗣️ Our democracy is under attack by politicians who are making it harder for people to vote while simultaneously… https://t.co/PQ9Fxw8O5J,245
1103059743990562823,2019-03-05 22:28:31,Iraq and Afghanistan vets are developing rare and fatal diseases likely due to their exposure to toxic burn pits. T… https://t.co/IkQjlC7TNW,159
1102974772844130304,2019-03-05 16:50:52,"We're voting on #HR1 this week, the most sweeping anti-corruption
 legislation in my lifetime. Elected officials sh… https://t.co/GdVAFCzBNy",243
