id,created_at,text,retweet_count
1251364543973986304,2020-04-18 04:18:51,Early signs in Midwestern states like Michigan and Wisconsin point to Trump losing an edge in November. Here's a lo… https://t.co/xMdDKkC38N,9
1251361455720595456,2020-04-18 04:06:34,"On odd-numbered days, men can leave the house to seek out essentials. On even-numbered days, it’s the women’s turn.… https://t.co/1pdAI2EFh3",5
1251358232800526336,2020-04-18 03:53:46,"Columnist @MarySchmich talks with Chicago booksellers about enduring the coronavirus shutdown, and how you can help. https://t.co/95v4RMgQjJ",6
1251353169373904898,2020-04-18 03:33:39,"They were mothers and fathers, daughters and sons. Two were sisters from a tight-knit family. All were loved, relat… https://t.co/syw7iWZZrv",12
1251349749824917505,2020-04-18 03:20:03,NBA players will receive 25% less in paychecks starting May 15 as commissioner Adam Silver said it remains impossib… https://t.co/Q0c9LUq6zF,7
1251346312911622146,2020-04-18 03:06:24,This Chicago movement is helping bring hundreds of meals to those struggling through the coronavirus outbreak in En… https://t.co/A4R7T3R5lC,8
1251342064958259200,2020-04-18 02:49:31,"""It’s too little too late here"": Six Tyson poultry workers in Georgia and Iowa die; Smithfield plant in South Dakot… https://t.co/IuG9frLPP8",23
1251336985823907843,2020-04-18 02:29:20,How Illinois responded to coronavirus compared with other states https://t.co/B58iHhM8e4,3
1251333585904287744,2020-04-18 02:15:50,Here's what to stream if you’re in the mood for something uplifting https://t.co/2o8HFbYPGT,4
1251330293337853953,2020-04-18 02:02:45,"As the use of facial recognition rises, so do privacy concerns. These Chicago-made glasses are designed to block th… https://t.co/O1oeD2jZRy",13
1251326468736593923,2020-04-18 01:47:33,"Sky center Stefanie Dolson reveals she tested positive for the coronavirus, making her the first known Chicago prof… https://t.co/znpsPWVZli",4
1251325334039015425,2020-04-18 01:43:02,Gov. Pritzker ordered schools to remain closed through the end of the academic year as officials said the coronavir… https://t.co/5nFcWKy7tD,19
1251323079403372545,2020-04-18 01:34:05,"An avid Cubs fan, royal prankster and loving father: Al Spinner, whose daughter founded the city’s Bon Jovi singalo… https://t.co/cImWYLDhpU",10
1251318951633698816,2020-04-18 01:17:41,"Restaurants can still offer takeout, and shops are conducting online sales. But for the first time in its 42 years,… https://t.co/5w6Fm7hWB6",2
1251316374628184065,2020-04-18 01:07:26,"With patients lining up at drugstore counters, pharmacists are pressing big chains to provide protective equipment… https://t.co/fJKO6amxvY",4
1251313254359535627,2020-04-18 00:55:02,Mayor Lightfoot will ask aldermen next week to retroactively bless her executive order that gives her additional po… https://t.co/NtTi236Ibc,2
1251312007288164354,2020-04-18 00:50:05,A federal judge ripped Cook County Clerk Karen Yarbrough for what he said were “clear violations” of anti-patronage… https://t.co/czWGPG9yRG,6
1251310520579297286,2020-04-18 00:44:10,"Busy, yet struggling: Illinois hospitals are losing $1.4 billion a month, trade association says, as coronavirus ca… https://t.co/MHyQazrtLJ",13
1251307377372078080,2020-04-18 00:31:41,"Our obituary for Brian Dennehy, a giant of Chicago's stage and America's screens — yes, including in ""Tommy Boy"" https://t.co/AVEvuwmep3",12
1251304332752027657,2020-04-18 00:19:35,Two prisoners who escaped from a maximum-security prison in Wisconsin have been recaptured in northern Illinois. https://t.co/jvcAjaNQbB,10
1251300166637936642,2020-04-18 00:03:02,"""They’re so bought in to the importance of those grades."" https://t.co/WKfg9Sc3tZ",2
1251297541100122112,2020-04-17 23:52:36,"The Native American woman who has appeared on the packaging of Land O’Lakes butter, cheese and other products since… https://t.co/bjNp7XfCoT",20
1251294414170923009,2020-04-17 23:40:10,"No prom, no graduation, more remote learning: Dashed hopes that Illinois schools would reopen this year are a parti… https://t.co/T9FHVmVvLS",5
1251292474020151296,2020-04-17 23:32:28,"Remember Michael Cohen, the president’s personal lawyer who went to prison? He’s getting out early because of COVID… https://t.co/pIorQtZjIN",9
1251289183198609410,2020-04-17 23:19:23,"As large gatherings continue to be placed on hold, this Chicago photographer is suggesting that couples keep their… https://t.co/WngvMlZDuT",1
1251285594094866436,2020-04-17 23:05:08,Joliet's mayor has called for a full investigation into the COVID-19-related deaths of 22 patients and one worker a… https://t.co/fy5DjIhC1O,9
1251283563951140870,2020-04-17 22:57:04,"Here are today’s top stories in Chicago politics, from @byldonovan https://t.co/s23rGPfspb",4
1251277631158390785,2020-04-17 22:33:29,Watch live: President Trump and the coronavirus task force are sharing the latest updates in the U.S. battle agains… https://t.co/66Cm6Z9vKb,0
1251276493130432513,2020-04-17 22:28:58,"The $100 million Chicago Small Business Resiliency Fund has received more than 8,000 applications — but so far only… https://t.co/TilWuScw61",6
1251273812450119685,2020-04-17 22:18:19,"""LIBERATE MICHIGAN!""

Right-wing coalitions — Trump voters, gun-rights groups, anti-vaxxers, libertarian activists… https://t.co/VjNYKJNsJQ",11
1251271123217666048,2020-04-17 22:07:37,"The Bears have cut tight end Trey Burton, despite owing him $4 million guaranteed this season. Burton missed much o… https://t.co/Y1sUlFiLJs",0
1251269383084703746,2020-04-17 22:00:43,Morgan Park’s Adam Miller and Maine West’s Angela Dugalic are Illinois' Mr. and Ms. Basketball for 2020 🏀 https://t.co/ZWds1sM0ED,2
1251265598698504195,2020-04-17 21:45:40,A 26-year-old man was critically wounded in a shooting Friday while he sat in a parked vehicle on the Northwest Sid… https://t.co/gssvZrpPbT,1
1251262086556069888,2020-04-17 21:31:43,"The NBA is selling face masks with team logos, with proceeds going to Feeding America in the U.S. and Second Harves… https://t.co/ADFqiktU3P",19
1251259020398268417,2020-04-17 21:19:32,The hastily built medical center at McCormick Place has started treating patients. https://t.co/zNyrdrDNXP,8
1251255928160124928,2020-04-17 21:07:15,"The Cubs were 1 of 3 MLB teams that declined to participate in a coronavirus study, report says https://t.co/SAm8V0eftf",10
1251252257720500227,2020-04-17 20:52:40,"The city of Chicago has fined a developer up to $68,000 for a demolition at a former coal plant that sent massive d… https://t.co/lILqVQoBfA",6
1251249869983027202,2020-04-17 20:43:10,Not everyone is on board with the government-mandated limits on public assembly and economic activity. Here’s some… https://t.co/LTeXJpf8CS,6
1251246030651379714,2020-04-17 20:27:55,A Wall Street credits ratings agency has downgraded Illinois’ debt to one notch above junk status. https://t.co/W1u9BztKdj,34
1251243200351797248,2020-04-17 20:16:40,"Despite a coronavirus outbreak in the Chicago jail that houses R. Kelly, federal prosecutors insist he not be relea… https://t.co/2luzqmk8x3",2
1251240284903682058,2020-04-17 20:05:05,From tennis tournaments to competitive rock-paper-scissors: Illinois high school athletes keep hope alive even as C… https://t.co/eTpa79PN1q,5
1251237500217155584,2020-04-17 19:54:01,A third Chicago police officer has died from complications stemming from COVID-19. https://t.co/f9HiZh38f8,4
1251237105390493698,2020-04-17 19:52:27,"Gov. Pritzker announced schools will stay closed for the rest of the academic year, as officials confirmed the bigg… https://t.co/WtWfeAYoQO",315
1251231910703005698,2020-04-17 19:31:48,Watch live: Gov. Pritzker and health officials share updates on the coronavirus pandemic in Illinois https://t.co/iPtYrijdBX,3
1251231428794290178,2020-04-17 19:29:54,City workers deemed essential during a catastrophe should get benefits like police and firefighters who die in the… https://t.co/kzz5SDYj1B,4
1251228731491995654,2020-04-17 19:19:10,"Former first lady Michelle Obama will host weekly story time on Facebook, Youtube starting Monday and running throu… https://t.co/FewYeo9dre",19
1251225690206339074,2020-04-17 19:07:05,"“I know the city has all the data, but it doesn’t feel like anything is flattening for us.”

In Roseland, health ca… https://t.co/XluiWG5Tu7",7
1251224532247023616,2020-04-17 19:02:29,Bail denied for second suspect charged in Red Line attack that killed former Marine https://t.co/ialv6vEAqk,2
1251221159284269057,2020-04-17 18:49:05,"RT @StacyStClair: ‘Outgunned, outmanned and underfunded’: Inside Roseland hospital’s battle against the coronavirus in one of the city's ha…",23
1251218645574918149,2020-04-17 18:39:06,They came home. Their parents went to the ICU with COVID-19. https://t.co/fF7QdjCzqd,4
1251216705696776200,2020-04-17 18:31:23,"RT @phillipstribune: Along with much of the @chicagotribune staff, I'm privileged to write about some of the COVID-19 victims as we experie…",16
1251215876726099975,2020-04-17 18:28:06,A look at where 18 players from Illinois high schools and colleges and Notre Dame will be picked in the NFL draft https://t.co/JZmWsB0U4s,0
1251213189850726401,2020-04-17 18:17:25,The coronavirus shutdown has led to tortilla shortages in Chicago https://t.co/cz0DZJexcc,17
1251210209848102913,2020-04-17 18:05:35,Watch live as Mayor Lori Lightfoot shares updates on the demolition of a Little Village coal plant that caused anxi… https://t.co/cHuPoJRX1F,2
1251209006200258560,2020-04-17 18:00:48,“Frida Kahlo 2020” is now scheduled for 2021. The new title? “Frida Kahlo: Timeless.” https://t.co/vlbm4U1ckz,8
1251205952449232906,2020-04-17 17:48:40,https://t.co/HdVjd6tKEl https://t.co/8YriZL83nF,51
1251202043886305280,2020-04-17 17:33:08,"Trump supporters, small-government groups, anti-vaccine advocates, gun rights backers and other right-wing causes a… https://t.co/mbuhJpGpNJ",8
1251199736843063301,2020-04-17 17:23:58,Should the Bears pick a quarterback in the coming draft? Here are some options for them... https://t.co/fJAtz5lMN3,1
1251196933319929856,2020-04-17 17:12:49,Libraries are preparing major changes before they eventually reopen: Here's what might be different https://t.co/TTaTozQyL6,7
1251196589051383814,2020-04-17 17:11:27,Follow more of today’s coronavirus updates here: https://t.co/Z2mZxOMKZF,8
1251194389776535553,2020-04-17 17:02:43,"Gov. J.B. Pritzker is expected to order Illinois schools to remain closed for the rest of the school year, sources… https://t.co/NOjbCkafxp",103
1251194200068153347,2020-04-17 17:01:58,"Problems with your $1,200 government check? You're not alone. 

Here’s what might’ve gone wrong. https://t.co/waoL2uD0pO",9
1251188840724934656,2020-04-17 16:40:40,"tfw they want to film ""the amityville horror"" at your house https://t.co/7PmkOrQOG7",2
1251185209015439361,2020-04-17 16:26:14,President Donald Trump’s former lawyer and longtime fixer Michael Cohen is getting out of federal prison early beca… https://t.co/Ydv7YmW1JJ,4
1251183154586624000,2020-04-17 16:18:04,A man faces felony charges for allegedly punching a nurse on a CTA bus after complaining that she coughed on him https://t.co/jAfz6bm7j1,8
1251180859157348353,2020-04-17 16:08:57,"A third Chicago police officer has died from complications stemming from COVID-19, officials say https://t.co/CTiTSLsxsR",8
1251180068623261701,2020-04-17 16:05:48,"Here are five ways to connect with loved ones in nursing homes and senior centers, as COVID-19 keeps families separ… https://t.co/jZM10tNvdX",4
1251176982718689282,2020-04-17 15:53:33,We asked another four people in Chicago and the 'burbs to keep diaries for a day and observe their coronavirus-tran… https://t.co/0si7zD0XHQ,5
1251173917055647744,2020-04-17 15:41:22,College student talks about working at Naperville assisted living facility where 12 residents and 9 staff members h… https://t.co/3lXeCBBrpV,2
1251170818501095424,2020-04-17 15:29:03,The first truckloads of General Motors-made medical ventilators from a central Indiana factory began arriving at Ch… https://t.co/eA3GdaojUg,17
1251168029028823042,2020-04-17 15:17:58,"The coronavirus death toll is seriously incomplete: China raises its Wuhan mortality figure by 50% on Friday, Brita… https://t.co/x8dywDgqLC",13
1251167955976630273,2020-04-17 15:17:40,"RT @RexHuppke: By letting noted not-an-epidemiologist Dr. Phil come on and blab incorrectly about how may people die each year in pools, Fo…",90
1251165165753679872,2020-04-17 15:06:35,"COVID-19 outbreak at Lincoln Park nursing home leaves 4 dead, 10 others sickened as workers run low on protective g… https://t.co/ylKgR6Ms47",7
1251162508477464576,2020-04-17 14:56:02,"Is it fair to give grades during the coronavirus school shutdown? 

With CPS report cards due, some teachers say no… https://t.co/CfdTVjncWE",5
1251160393168252929,2020-04-17 14:47:37,"Nearly 300 Illinois nursing home patients and staff have died from COVID-19, but the state won't say which faciliti… https://t.co/V1OXlRQAzX",77
1251156790043017216,2020-04-17 14:33:18,Morgan Park’s Adam Miller and Maine West’s Angela Dugalic are Illinois' Mr. and Ms. Basketball for 2020 🏀 https://t.co/4RLWNjfo2V,35
1251155148958691329,2020-04-17 14:26:47,"RT @jmetr22b: Feds in NY today filed a motion saying #RKelly ""still has the financial means to flea and commit obstruction"" and should not…",19
1251154109912121351,2020-04-17 14:22:39,"23 moments to watch for from ESPN’s ""Last Dance"" documentary on the 1997-98 Chicago Bulls

No. 13 is ""The Sniff Bro… https://t.co/YcKMyfc9Go",2
1251152082834305028,2020-04-17 14:14:36,"RT @HeidiStevens13: Congratulations @ChiPubSchools families and educators! You made it through the first official week of e-learning! 

We…",11
1251151355219070983,2020-04-17 14:11:43,"April showers bring May blah blah blah

April snowstorm: How much did it snow near you? https://t.co/9Nw3O54USQ",6
1251148404551368705,2020-04-17 13:59:59,"COVID-19 outbreak at Lincoln Park nursing home leaves four dead, at least 10 others sickened as workers run low on… https://t.co/pXtg3P14vm",5
1251145944390725633,2020-04-17 13:50:12,"Problems with your $1,200 government check? You're not alone. 

Here’s what might’ve gone wrong. https://t.co/3ACqQNhzer",8
1251142296101367808,2020-04-17 13:35:43,"As with almost all things coronavirus, uncertainty reigns. But early signs in Midwestern states like Michigan and W… https://t.co/2ov74hvJ07",7
1251136798882959361,2020-04-17 13:13:52,"Quarantine date night ideas for couples, no matter what stage your relationship is in — including an in-home strip… https://t.co/NobSSxldkS",8
1251135265558736897,2020-04-17 13:07:46,"RT @John_Kass: A little comfort amid the #coronavirus despair: Aunt Helen's Broken Glass Torte. It's a Jell-O thing. @cnaha 
https://t.co/o…",4
1251133693030252545,2020-04-17 13:01:32,"At 108 years old, Luther Coleman was ""always trying to help somebody."" 

He is the oldest person in Cook County to… https://t.co/D40saqGgLy",13
1251127395987476480,2020-04-17 12:36:30,A 46-year-old man died Thursday after being trapped underwater in an overturned Bobcat construction vehicle in Fox… https://t.co/KpdPE1vABh,6
1251125102525243394,2020-04-17 12:27:23,"Our obituary for Brian Dennehy, a giant of Chicago's stage and America's screens — yes, including in ""Tommy Boy"" https://t.co/9METJmBQM2",9
1251122246380290048,2020-04-17 12:16:02,"Spring snowstorm dumps 2-6 inches on the Chicago area, but a sunny warm-up is expected this weekend...

Don't get a… https://t.co/AeZNgRVhrJ",2
1251120150344019968,2020-04-17 12:07:43,"If you’re not already signed up, we hope you will consider subscribing.

Here's some more free stuff: https://t.co/VwRY8QVywj",2
1251119732910182400,2020-04-17 12:06:03,"Coronavirus in Illinois updates: Here’s what’s happening Friday with COVID-19 in the Chicago area, paywall free https://t.co/b4WMXLI6JB",13
1251118741796139009,2020-04-17 12:02:07,"Busy, yet struggling: Illinois hospitals are losing $1.4 billion a month, trade association says, as coronavirus ca… https://t.co/nyG1K8fq81",14
1251118252920582146,2020-04-17 12:00:10,"Good morning, Chicago. Here are some top stories to start your day:

-Illinois expands virus testing
-State hospita… https://t.co/miG4shfrl6",1
1251113497141936130,2020-04-17 11:41:16,"For a front-lines pharmacist at Rush, for a Homewood librarian, it’s all an anxious Monday: Another Chicago day in… https://t.co/SDfpoKLNvc",2
1251110767514071042,2020-04-17 11:30:26,"The coronavirus death toll is seriously incomplete: China raises its Wuhan mortality figure by 50% on Friday, Brita… https://t.co/fIYoSmcSn7",8
1251108803145277440,2020-04-17 11:22:37,They came home after their campuses closed. Then their parents went to the ICU with COVID-19. https://t.co/8Dz4Q7HvO6,5
1251105964738125825,2020-04-17 11:11:21,"High school students will be able to take an at-home, online SAT test if the coronavirus keeps schools closed into… https://t.co/5AF1LmUAvC",5
1251103203661414402,2020-04-17 11:00:22,"“It’s just going to sit there and rot.”

Illinois sexual assault victims report crimes only to hear long wait times… https://t.co/wCsMdIAV6n",4
1251100075641765888,2020-04-17 10:47:57,Classes canceled. Bars shut down. Gatherings banned. A look back through the Tribune's archives show some striking… https://t.co/0le9kWIYfM,13
1251096113819660289,2020-04-17 10:32:12,Ald. Edward Burke has spent more than $1.1 million from his campaign fund on legal fees to defend himself on federa… https://t.co/3ai6IQIOgk,10
1251095646989410306,2020-04-17 10:30:21,When will Illinois lift the shelter-in-place order? These Chicago ecologists are working on it. https://t.co/xdZsK4pzwJ,3
1251007260748283904,2020-04-17 04:39:08,"The pandemic crippling the U.S. economy portends a sharp increase in poverty, to a level that may even reach a half… https://t.co/GWWE32eY1i",8
1251004013052678151,2020-04-17 04:26:13,"Across the country, students are rethinking their choices in a world altered by the pandemic. And universities are… https://t.co/n8ecOG9hHm",10
1251000815847907333,2020-04-17 04:13:31,The first truckloads of General Motors-made medical ventilators rolling off an Indiana factory floor will leave for… https://t.co/y6QqCAI2A2,37
1250997644434038785,2020-04-17 04:00:55,Butter. Beer. Miso. Dr Pepper? There are all sorts of flavorful ingredients you can use to enhance cheaper cuts of… https://t.co/UAyFCWr3IS,0
1250994920674021377,2020-04-17 03:50:06,"Chicago State women’s basketball coach Misty Opat has resigned, a spokeswoman said. Opat coached only two seasons f… https://t.co/aSpYPJim0a",3
1250993158151909379,2020-04-17 03:43:05,Bulls guard Zach LaVine made it to the final of ESPN’s HORSE tournament but was defeated by Jazz guard Mike Conley. https://t.co/7XODSFG8rE,0
1250991811025408003,2020-04-17 03:37:44,It wouldn't be a 21st-century pandemic without memes https://t.co/EtjyRUBDLY,11
1250989175899291648,2020-04-17 03:27:16,"""I talk to her like we’re in prison.”

Nursing home residents and their relatives face unique challenges as get-tog… https://t.co/QqgHO3WfFk",7
1250986202150457344,2020-04-17 03:15:27,A suburban teacher who sued after she was denied paid maternity leave has lost her case after the Illinois Supreme… https://t.co/p4ckRRgZ9Q,8
1250984745435049984,2020-04-17 03:09:40,"Chicago officials say the city is “bending the curve” on the coronavirus pandemic, but the peak may still lie ahead. https://t.co/SCnnsUCAUY",14
1250981063066816514,2020-04-17 02:55:02,A veteran bus mechanic has become the third CTA staffer to die after contracting COVID-19. https://t.co/7vDnCA7eR9,3
1250979434523504640,2020-04-17 02:48:33,"Wisconsin's stay-at-home order will continue for another month, keeping nonessential businesses closed until after… https://t.co/zyOP7XBXTf",27
1250974505268400130,2020-04-17 02:28:58,"Michael Jordan did a rare interview on ""Good Morning America"" today. Here’s what His Airness had to say about ""The… https://t.co/Hwc5OM2k7Q",4
1250971874345058305,2020-04-17 02:18:31,"Nearly 300 Illinois nursing home patients and staff have died from COVID-19, but exactly where still remains largel… https://t.co/dGfoQgSq19",20
1250969776563916800,2020-04-17 02:10:11,"Illinois saw its deadliest day of the coronavirus pandemic yet on Thursday, with officials reporting 125 more fatal… https://t.co/BXYM3Iv5BP",14
1250968076583084035,2020-04-17 02:03:25,A Wicker Park couple is suing the “Windy City Rehab” team and the parent company of HGTV for fraud over work done t… https://t.co/l38ROQ76oE,2
1250963483115601921,2020-04-17 01:45:10,A second suspect is in custody for an attack in which a former Marine was shoved between Red Line train cars and dr… https://t.co/BZIGpj4z7K,6
1250961804550967299,2020-04-17 01:38:30,A look back through the Tribune's archives show some striking similarities between life during the 1918 Spanish Inf… https://t.co/BjfyXFDbQV,19
1250956660857806848,2020-04-17 01:18:04,Retired Bears linebacker Brian Urlacher is trying out a new tactic for renting out his 7-bedroom Mettawa estate — i… https://t.co/p6YvXSRZo2,6
1250952899536072704,2020-04-17 01:03:07,"The twofold mission at Off Their Plate aims not only to deliver meals to health care professionals, but it’s helpin… https://t.co/nawGDOWM1O",5
1250948790145748992,2020-04-17 00:46:47,"No, you will not have to repay coronavirus relief checks next year https://t.co/nSiV6V7FIO",6
1250945492445532161,2020-04-17 00:33:41,"Navy may reinstate fired Capt. Brett Crozier to again command aircraft carrier, the Theodore Roosevelt: ""No final d… https://t.co/M62CiZ7bNX",14
1250941444463964168,2020-04-17 00:17:36,Illinois will coordinate with six surrounding states on reopening economies and lifting stay-at-home restrictions.… https://t.co/9WV500UuYy,9
1250938300757618690,2020-04-17 00:05:06,"Two suburban sisters came home after their college campuses closed. Within days, both their parents were in the ICU… https://t.co/vyJDAuyMSr",19
1250935197744447490,2020-04-16 23:52:47,Today marks one month since restaurants were closed for dine-in customers. Tomorrow marks one month since schools w… https://t.co/nX17WLzGiX,7
1250931637594054664,2020-04-16 23:38:38,Restaurants and bars have renewed their plea for government assistance — and this time they’re armed with new data… https://t.co/N8q6AYsv4t,6
1250927848866680832,2020-04-16 23:23:34,President Trump laid out guidelines aimed at restoring normal activity in places that have strong testing and are s… https://t.co/etSTUOQitH,2
1250925754575196169,2020-04-16 23:15:15,"""We can’t continue to allow our black and brown communities to be hit the hardest by every single catastrophe.”

To… https://t.co/6ykbiRPGFK",12
1250922657450688512,2020-04-16 23:02:57,"Insurers are denying claims for COVID-19, saying it’s “uninsurable.” Chicago-area businesses are suing, saying that… https://t.co/emjcAuuJrR",19
1250917942776287236,2020-04-16 22:44:13,"Here are today’s top stories in Chicago politics, from @byldonovan https://t.co/fXB8OvVGuK",5
1250916062369062913,2020-04-16 22:36:44,ComEd says it suspend service disconnections and waive late fees — until June 1 at least — as customers face new fi… https://t.co/ZN1wCGBHWg,24
1250912792523214848,2020-04-16 22:23:45,"The wisdom Dr. Fauci brings to the coronavirus response is insulted during President Trump's daily ego trip, writes… https://t.co/JlqyWXYIRU",19
1250909092907974656,2020-04-16 22:09:03,Watch live: President Trump and the coronavirus task force are sharing the latest updates in the U.S. battle agains… https://t.co/qTva6O1yWc,1
1250908383214960642,2020-04-16 22:06:13,"Ivanka Trump, disregarding federal guidelines she has touted on social media, travels to President Trump's New Jers… https://t.co/MLs7tlaNQT",22
1250905771405172737,2020-04-16 21:55:51,"Dr. Anthony Fauci is America's voice of reason on the president’s pandemic advisory committee. He should quit, writ… https://t.co/afDohNjktB",10
1250902632014716928,2020-04-16 21:43:22,Preventative measures related to the COVID-19 pandemic may have done wonders to combat this year’s particularly har… https://t.co/yqbEMZt8VK,8
1250899125043945473,2020-04-16 21:29:26,"RT @gcgarvey: Daily work log for Garvey, Inc., during quarantine operations. https://t.co/dqPwIZoMwF",3
1250898601217228801,2020-04-16 21:27:21,Wrigley Field is now being used as a satellite food pantry location. Take a look inside: https://t.co/shfwJEPsXI,21
1250895834549555200,2020-04-16 21:16:22,"RT @tvjedi: My first weekly column: Sometimes, the perfect movie setting is right here in the Chicago suburbs https://t.co/qgPZqAJrBU",3
1250893759342096385,2020-04-16 21:08:07,"Tracking the coronavirus outbreak in Illinois: 1,072 deaths, 25,733 confirmed cases, 122,589 tests

https://t.co/3XfVlpUO1l",10
1250891478106324992,2020-04-16 20:59:03,Have you recovered from COVID-19? A clinic in Chicago's south suburbs is now offering antibody testing to gauge you… https://t.co/XAgqXkcloh,9
1250887955595624449,2020-04-16 20:45:03,Community leaders have demanded that the city of Chicago strip $19.7 million in tax subsidies from the company that… https://t.co/ROwZ1HCwmW,6
1250881168116981762,2020-04-16 20:18:05,"Gov. Pritzker says Illinois is expanding COVID-19 testing to include anyone with symptoms, as officials announce th… https://t.co/3MvczcYkAM",16
