id,created_at,text,retweet_count
1185300147825188864,2019-10-18 21:02:31,"Congratulations for making history, @Astro_Christina and @Astro_Jessica. Because of you, every girl knows that even… https://t.co/4QFGNkBEv1",259
1185257233942229004,2019-10-18 18:12:00,"From day one, a Biden administration will be focused on rebuilding the backbone of our country — the middle class.… https://t.co/TCnI9OyMFI",1303
1185239618574151681,2019-10-18 17:02:00,"Venezuela’s election to the UN Human Rights Council is a travesty. Nicolás Maduro is a dictator, plain and simple.… https://t.co/zhDdmcItjq",470
1185223198121627648,2019-10-18 15:56:45,Trump is only reinstating “targeted” funds to Central America. I support full restoration of bipartisan funding to… https://t.co/H0S3xuhfED,333
1185212690714652673,2019-10-18 15:15:00,"Eliminate all private dollars from federal elections.

Overturn Citizens United and end dark money groups.

Ban lob… https://t.co/6VzBxtN5Ui",8078
1185005072352239624,2019-10-18 01:30:00,"When leaders like Admiral McRaven speak, we should listen. Donald Trump is a threat to our national security — his… https://t.co/8uDWHi9Iqy",2960
1184981164785692672,2019-10-17 23:55:00,Donald Trump is the most reckless and incompetent Commander-in-Chief we’ve ever had.,16424
1184966065220128768,2019-10-17 22:55:00,Every young person deserves to be affirmed and accepted exactly as they are — regardless of sexual orientation or g… https://t.co/KRJYHLnDQv,618
1184958515460411398,2019-10-17 22:25:00,"Proud to stand with @CTULocal1, @SEIU73, and every teacher and support staff member striking today for better staff… https://t.co/Yn5xvoPZPF",247
1184953482601779200,2019-10-17 22:05:00,"Today, we’re officially launching our fall line! Head to https://t.co/CQm11tCOcn to stock up on new t-shirts, stick… https://t.co/MnxnBjuXFM",233
1184895256938065921,2019-10-17 18:13:38,Hosting a major foreign leader summit at a Trump hotel? Donald Trump continues to abuse his power to line his own p… https://t.co/g2Wh6nUrEF,5927
1184882263403782144,2019-10-17 17:22:00,"From banning assault weapons to passing Obamacare — I know what it takes to pass important, consequential legislati… https://t.co/M7Hrzv1Fdr",460
1184827750156242945,2019-10-17 13:45:23,"Elijah Cummings was a true public servant, his life defined by the love of his community and a fierce commitment to… https://t.co/RSTpyV8sTg",2029
1184650737630011393,2019-10-17 02:02:00,"The Kurds were integral in helping us defeat ISIS — and too many lost their lives. Now, President Trump has abandoned them. It's shameful.",3839
1184622551940636673,2019-10-17 00:10:00,Diplomacy isn’t just a series of handshakes and photo ops. But Donald Trump doesn't understand that — and he never… https://t.co/A0GoZIu3wl,640
1184607452248936449,2019-10-16 23:10:00,"The next president will face an enormous challenge of picking up the pieces of America’s foreign policy, salvaging… https://t.co/FCrmwRxDLW",975
1184595624441929728,2019-10-16 22:23:00,President Trump — what a delusional man. https://t.co/kJAn9SewcW,905
1184577681624633344,2019-10-16 21:11:42,I’m about to take the stage in Iowa to discuss Donald Trump’s reckless actions in Syria. Tune in now to watch live: https://t.co/hnj0gIF0D1,635
1184565057352536064,2019-10-16 20:21:32,"This afternoon, I'll be discussing Donald Trump's recent actions in Syria and how his erratic, impulsive decisions… https://t.co/dvNFXewaJk",294
1184560895768137729,2019-10-16 20:05:00,"Unlike President Trump, I know what it takes to negotiate with Erdoğan. And if I were president, I would make him p… https://t.co/O4rUzshAJ3",775
1184545796349411328,2019-10-16 19:05:00,"The events of this past week in Syria have made clear just how dangerous Donald Trump is to our national security,… https://t.co/Lpb5KZTZ4S",1521
1184524243956097025,2019-10-16 17:39:21,".@realDonaldTrump, you want to talk about corruption? I’ve released 21 years of my tax returns — release yours or s… https://t.co/iWqDLfKIzW",18487
1184336164553216000,2019-10-16 05:12:00,I won't need any on-the-job training. I'll be ready on day one. #DemDebate https://t.co/LxNzmyI6yW,975
1184333537698291712,2019-10-16 05:01:33,"I’m relying on your support to power my campaign. Together, I know we can defeat Donald Trump and protect our democ… https://t.co/w8DweqD7nY",755
1184318490850856961,2019-10-16 04:01:46,It's time we pick our heads up and remember who we are. This is the United States of America — there is not a singl… https://t.co/63YbxdNCfH,1234
1184309045294960641,2019-10-16 03:24:14,"I just stepped off the #DemDebate stage, where I laid out my bold vision for the country and how I’ll deliver real… https://t.co/eXcYT7h2pd",328
1184308415948115968,2019-10-16 03:21:44,"We have an erratic, crazy president who knows not a damn thing about foreign policy and operates out of fear for hi… https://t.co/R8mzJe1SdU",1008
1184306245584543747,2019-10-16 03:13:06,That’s all we have for tonight’s #DemDebate! Make sure to follow @TeamJoe to stay up-to-date on everything happenin… https://t.co/u9hCGkSQlb,118
1184299888030474240,2019-10-16 02:47:51,"Joe Biden is the only candidate on the #DemDebate stage who has actually beaten the @NRA — and he did it twice.

As… https://t.co/nonhwZbmGJ",352
1184296664753983488,2019-10-16 02:35:02,"Let’s put this in perspective: if you eliminate every single solitary soldier, tank, satellite, nuclear weapon, eli… https://t.co/5AYIknhwkO",2140
1184294114319327233,2019-10-16 02:24:54,"Roe v. Wade is the law of the land. Period.
 
As president, Joe Biden will stand up to attacks on a woman’s constit… https://t.co/YasMXpWQWi",799
1184291808110694400,2019-10-16 02:15:44,Medicare for All will cost at least $30 trillion over 10 years — and it will be paid for in part by raising taxes o… https://t.co/mbOLLxOmOA,303
1184283057425133569,2019-10-16 01:40:58,Joe Biden has a bold plan to end our gun violence epidemic. But it’s going to take more than plans—it’s going to ta… https://t.co/P7HyVomqLL,239
1184278950698201088,2019-10-16 01:24:39,"“We have an erratic, crazy President who knows not a damn thing about foreign policy.”

#DemDebate",6529
1184277161508851712,2019-10-16 01:17:32,"Three — that's how many times President Trump asked foreign governments to interfere in our political process.

Why… https://t.co/7PEJlYTT5J",581
1184275781943476224,2019-10-16 01:12:03,The United States has a vital national interest in Syria to ensure the lasting defeat of ISIS. We know that this te… https://t.co/6SlxuCeA0Q,218
1184275485456588802,2019-10-16 01:10:53,Donald Trump betrayed our partners in the Syrian Democratic Forces and put at risk our gains against ISIS. This is… https://t.co/H3pHTyRkfC,495
1184273842925195269,2019-10-16 01:04:21,"As president, Joe Biden will repeal Trump’s tax cuts for corporations and the super-wealthy, and build a tax code t… https://t.co/juy95RVJwJ",329
1184270938080206850,2019-10-16 00:52:48,"Our firefighters and teachers work tirelessly to make our communities safer, better places to live. They should not… https://t.co/YRExDZTSF9",351
1184270737156313088,2019-10-16 00:52:01,"On day one, Joe Biden will move to:

✅ Eliminate the Trump tax cut for the super-wealthy
✅ Eliminate the unjustifie… https://t.co/cCB3plhQvZ",295
1184268060632502272,2019-10-16 00:41:22,Donald Trump is the most corrupt president in modern American history. He must be impeached. #DemDebate https://t.co/2MJI33u28D,1804
1184266561168838662,2019-10-16 00:35:25,"We can’t beat Donald Trump with double talk on health care.

Joe Biden doesn’t just know what his health care plan… https://t.co/GNu0EsCXiX",184
1184263647889121280,2019-10-16 00:23:50,Medicare for All will cost *checks notes* 30x more than Joe Biden's plan to protect and build on Obamacare — and it… https://t.co/gL7dlDpbJf,168
1184262429120835585,2019-10-16 00:19:00,"“Russia, if you’re listening…”

“I would like you to do us a favor…” to Ukraine’s president

“China should start an… https://t.co/toa0eAjzxe",2565
1184259445909573633,2019-10-16 00:07:09,A president who puts his own self-interest ahead of the public good and national security poses a threat to each an… https://t.co/cTZnlzmSxy,376
1184258208514396160,2019-10-16 00:02:14,Hey everyone — @TeamJoe here! We’re taking over the account to keep you in the loop on tonight’s #DemDebate. Make s… https://t.co/YlPJRjsOoC,256
1184251765522341889,2019-10-15 23:36:37,"Folks, we have to do more than beat Donald Trump.

We have to beat him like a drum.

When I take the #DemDebate sta… https://t.co/gU4BFlAC7v",233
1184251764884885505,2019-10-15 23:36:37,"From the Voting Rights Act renewal, to the ban on assault weapons, to the Violence Against Women Act, to Obamacare,… https://t.co/Qd4UQyVcGa",162
1184251763928502272,2019-10-15 23:36:37,"Fixing what's broken in this country will take vision—and yes, it will take plans. But that’s not enough.

It also… https://t.co/746qb5d7EG",40
1184251763328729090,2019-10-15 23:36:37,This election is about you. Your children. Your family. And you can’t wait for a president fighting for you when it… https://t.co/l8kSA0xDja,55
1184251762393436161,2019-10-15 23:36:37,"For days, pundits have let Donald Trump define the conversation around tonight's #DemDebate.

Well, Trump doesn't g… https://t.co/mqI4nf9dYs",493
1184242799710859264,2019-10-15 23:01:00,Philadelphia's office cleaners work hard every day to keep the city's buildings clean. They deserve the dignity tha… https://t.co/NgibLOQ7f6,276
1184206057649909762,2019-10-15 20:35:00,Overturning Citizens United isn’t enough. Ridding our politics of big money and corporate special interests demands… https://t.co/p38qWzAFRH,1778
1184180892023087104,2019-10-15 18:55:00,"President Trump is leading the most corrupt administration in modern American history. It’s got to end.

We must re… https://t.co/X1WBr51sXo",2966
1183912875552722944,2019-10-15 01:10:00,Donald Trump is the most corrupt president in modern American history.,29872
1183899034336940032,2019-10-15 00:15:00,The news from Fort Worth is heartbreaking. Atatiana Jefferson should still be alive today. We cannot allow this to… https://t.co/MYueC9zDR1,633
1183891484858179584,2019-10-14 23:45:00,"Donald Trump is the definition of corruption. At every turn, he has abused the power of the presidency to benefit h… https://t.co/v1ztNNTFSy",3130
1183876385087119363,2019-10-14 22:45:00,"Overturning Citizens United is an important step in ending the corrupting influence of money in our politics, but w… https://t.co/xWB3tRnKXo",678
1183842159658582017,2019-10-14 20:29:00,"America was built on a simple proposition: we're all created equal. We haven't yet fully lived up to that ideal, bu… https://t.co/FzFhR1sova",520
1183821020530130946,2019-10-14 19:05:00,"On #IndigenousPeoplesDay, we recognize the resiliency of indigenous communities and celebrate their rich contributi… https://t.co/vjjPneDOCb",766
1183792582964346883,2019-10-14 17:12:00,"Our Constitution begins with three simple words, “We the People” — not “We the Donors.” But for too long, corporati… https://t.co/Ce6vhMrwpL",1865
1183575401966125059,2019-10-14 02:49:00,"Corporations should not value their profits over the health and safety of their employees. As president, I will sig… https://t.co/Y9ZPi9nOJu",432
1183554274002911232,2019-10-14 01:25:02,"President Trump betrayed our partners, the Syrian Democratic Forces, and endangered our hard-won gains against ISIS… https://t.co/80pSw3nUhk",6026
1183525825251020800,2019-10-13 23:32:00,Donald Trump is a threat to our democracy. He must be impeached.,23374
1183513242280366080,2019-10-13 22:42:00,It is wonderful to see Sesame Street raising awareness about the effect of substance use disorder on families. We n… https://t.co/JiHaaFHeWP,574
1183506950857863173,2019-10-13 22:17:00,The Affordable Care Act has been under relentless attack for the past nine years — I will not stand for it. As pres… https://t.co/1TzgoQWvHd,746
1183487825016213506,2019-10-13 21:01:00,"Thank you, @UFCW! I promise you won’t have a better ally in the White House if I’m president. I’m a union guy and a… https://t.co/OlTPwtnYO3",267
1183465897446563845,2019-10-13 19:33:52,"I’m about to take the stage at the @UFCW Presidential Forum in Iowa, where I’ll discuss my plans to strengthen Amer… https://t.co/7LZofkViEa",237
1183432316426829825,2019-10-13 17:20:26,The devastating effects of gun violence don’t end when the shooting is over—survivors may face mental health and su… https://t.co/Ko1ej4zYuh,902
1183173893055533058,2019-10-13 00:13:33,@SarahEMcBride @MaraKeisling @NCTEActionFund Thanks Sarah. I'm proud of you and so is Beau.,9
1183170484269174784,2019-10-13 00:00:00,A good education should be a reliable pathway to the middle class—not saddle you with mountains of debt. My new pla… https://t.co/b5he6KHqmI,634
1183155384158052352,2019-10-12 23:00:00,Immigrants have always made us stronger as a nation — our diversity has always been our greatest strength. Donald T… https://t.co/oU8ikTkeLv,1611
1183136509785821184,2019-10-12 21:45:00,President Trump's attacks on Congresswoman Omar and Somali refugees have no place in our nation — let alone the Whi… https://t.co/3n0YP9brr6,5233
1183116097450663939,2019-10-12 20:23:53,"I was proud to work with Matthew’s parents, Judy and Dennis, to extend our hate crimes law to cover sexual orientat… https://t.co/7PrGvujPcQ",378
1183116096896937984,2019-10-12 20:23:53,"21 years ago, Matthew Shepard passed away after a brutal anti-gay hate crime — an attack that shook the conscience… https://t.co/ekg1D9SlBX",1035
1183079887134957569,2019-10-12 18:00:00,President Trump believes he can and will get away with anything he does. We all laughed when he said he could stand… https://t.co/knqreQc0WJ,4255
1183052204481171461,2019-10-12 16:10:00,"We believe Americans should decide American elections. But Trump will do anything to get re-elected, including viol… https://t.co/jsQWgeii2x",7076
1182789222505308162,2019-10-11 22:45:00,"Our planet is at a critical moment — and if we re-elect Donald Trump, it may never recover.

On day one, I’ll take… https://t.co/SquM4Tcd1o",1802
1182747194572460032,2019-10-11 19:58:00,"Let me make something clear to President Trump: I’m not going anywhere.

You’re not going to destroy me. And you’re… https://t.co/HTTcT4PDK9",10848
1182732850237304833,2019-10-11 19:01:00,Living open and proud is a daily act of bravery — bravery that resides in the heart of every single LGBTQ individua… https://t.co/a7y1N4r13t,861
1182709950096777216,2019-10-11 17:30:00,Today is a reminder to every girl on the planet: nothing is beyond your capacity or capability. And all of us must… https://t.co/zo1IZ7Uraa,1516
1182699419696799747,2019-10-11 16:48:09,"To LGBTQ people suffering persecution anywhere: the American people are on your side. And as president, I will ensu… https://t.co/LKbsba7hoE",217
1182699418698559488,2019-10-11 16:48:09,LGBTQ rights are human rights. Uganda's proposed new law is inhumane. Using religion or culture to license discrimi… https://t.co/fWZtPoHydJ,496
1182688558672498689,2019-10-11 16:05:00,Using religion or culture to discriminate against or demonize LGBTQ individuals is never justified—not anywhere in… https://t.co/RDsCBV8RkS,763
1182504092817444865,2019-10-11 03:52:00,I spent my night at the HRC forum talking about the fundamental respect every human being deserves. You spent yours… https://t.co/TuGJtJJL6h,8259
1182501072734183426,2019-10-11 03:40:00,Honored to be asked a question at tonight's #EqualityTownHall by my friend Judy Shepard. It was a privilege to work… https://t.co/RA0tVdGjLK,345
1182473893841260544,2019-10-11 01:52:00,We have to make sure that no hospital or health care provider can discriminate against someone simply because of wh… https://t.co/txzMeTZxLt,562
1182457032638631936,2019-10-11 00:45:00,There is no distinction between mental health and physical health — it’s health. Period. We've got to combat the st… https://t.co/0094Qw3qtk,1863
1182443563784818689,2019-10-10 23:51:29,"RT @TeamJoe: “There is no one in the field who has done more, with results to show for it, to advance the rights and welfare of LGBTQ peopl…",197
1182442688030937089,2019-10-10 23:48:00,Looking forward to joining @AndersonCooper at tonight’s #EqualityTownHall to discuss the work that remains in the f… https://t.co/cbntuty0RA,134
1182440674806788098,2019-10-10 23:40:00,"For all the hard-won progress we've made in the fight for LGBTQ equality, we're not done — not nearly.

We must sta… https://t.co/uDhmwNeTrZ",751
1182435138300530688,2019-10-10 23:18:00,Americans should decide American elections. Period. https://t.co/oc5HavIiuf,1169
1182374992274579457,2019-10-10 19:19:00,I sat down with @MaraKeisling of the @NCTEActionFund to discuss the progress we’ve made on LGBTQ rights and the wor… https://t.co/erNp795qLs,194
1182351336299302912,2019-10-10 17:45:00,President Trump picked a fight with the wrong guy. https://t.co/5s7izCLSzt,2153
1182340904780218368,2019-10-10 17:03:33,"Trump made this decision on a whim, after a phone call with Turkish President Erdogan. There was no process. No con… https://t.co/j1HMl6cwTJ",1241
1182340903261868033,2019-10-10 17:03:32,"But that's not all — he betrayed our brave troops, who sacrificed alongside them. He betrayed our word as a nation… https://t.co/TU5oA1yoy5",799
1182340902129487877,2019-10-10 17:03:32,Donald Trump sold out the Syrian Democratic Forces — the courageous Kurds and Arabs who fought with us to smash ISI… https://t.co/BWgZijnCI5,2062
1182304779692691456,2019-10-10 14:40:00,"In full view of the American people, Donald Trump has violated his oath of office and betrayed this nation. He must… https://t.co/pbtbvwuxdw",8369
1182103452790509573,2019-10-10 01:20:00,President Trump has decided that we don't have the power or the political will to hold him accountable. He's not ju… https://t.co/B1ULPIfsgE,5113
1182073253889622018,2019-10-09 23:20:00,"Like every bully, President Trump is lashing out because he’s afraid. He’s afraid of how badly I will beat him next… https://t.co/tamwycjMqq",2476
1182044180245352450,2019-10-09 21:24:28,"Only a little farther north, Timothy Ragland won his race to become both the youngest and first African American ma… https://t.co/1gQr7xhYv6",308
1182044179192598528,2019-10-09 21:24:28,"Last night, history was made in the birthplace of the civil rights movement, when Steven Reed became the first Afri… https://t.co/zopf037iGK",498
1182041117640003584,2019-10-09 21:12:18,President Trump sees no limit to his power. He believes he can — and will — get away with anything he does. https://t.co/wxCjXIubfM,1340
1182028458735497216,2019-10-09 20:22:00,"To preserve our Constitution, our democracy, and our basic integrity — Donald Trump should be impeached. https://t.co/fa14AGZdW9",2496
1182019902204334080,2019-10-09 19:48:00,"Two days ago, Trump impulsively gave Turkey a green light to invade Syria, blindsiding our military. Today, we see… https://t.co/KX9wO5qeqh",7624
1182005917602201600,2019-10-09 18:52:26,"Every day Donald Trump is in the White House, he poses a grave threat to our democracy. We must make him a one-term… https://t.co/k8ECpYfXc3",633
1181999504498843648,2019-10-09 18:26:57,"With his words and with his actions, President Trump has indicted himself.

He should be impeached.",8679
1181997336052080647,2019-10-09 18:18:20,"Thanks for watching. Stop stonewalling the Congress. Honor your oath. Respect the Constitution.

And speaking of ta… https://t.co/83oQuWBe2r",19479
1181984733162590215,2019-10-09 17:28:15,Join me now as I take the stage: https://t.co/xQ62JANeIt,577
1181979945599455232,2019-10-09 17:09:13,I’m about to take the stage in New Hampshire to discuss the grave threat Donald Trump poses to our democracy and th… https://t.co/2jqIXYXUCe,536
1181970371878277121,2019-10-09 16:31:11,"This afternoon, I’ll be speaking about President Trump’s abuse of power and the grave threat he poses to our democr… https://t.co/EN9n90aiL7",825
1181738548426416130,2019-10-09 01:10:00,Jill and I send our best wishes to those taking part in the Hindu festival of Navratri. As the nine days of celebra… https://t.co/ZhP6mBZSwe,713
1181724707072040960,2019-10-09 00:15:00,"I have spent my entire career fighting the abuse of power.

Donald Trump has spent his entire career abusing his power.",12136
1181712124197736448,2019-10-08 23:25:00,"In public and in private, President Trump has asked foreign governments to interfere in our elections on his behalf… https://t.co/f9EtmIsG6v",1344
1181673117225115648,2019-10-08 20:50:00,Jill and I wish Jewish communities around the world an easy fast as they gather to observe Yom Kippur. The Day of A… https://t.co/NUMhT25S1t,558
1181638272419803136,2019-10-08 18:31:32,President Trump must stop stonewalling Congress and fully cooperate with the investigations. The American people de… https://t.co/1FSvHorCy9,1878
1181625805513773057,2019-10-08 17:42:00,No one should live in fear of being fired because of who they are or whom they love. We must stand up to President… https://t.co/ae8k5wteEb,3074
1181612507397537792,2019-10-08 16:49:09,We will make historic investments in education and training to ensure every American has a reliable path to the mid… https://t.co/imFaGWQBDr,100
1181612506726506497,2019-10-08 16:49:09,Historically Black Colleges and Universities and Minority-Serving Institutions play a vital role in our communities… https://t.co/TrC23aN4HZ,123
1181612505996627970,2019-10-08 16:49:09,A Biden administration will take concrete action to address the student debt crisis in our country. We will expand… https://t.co/4gAYXNnBHQ,60
1181612505115873280,2019-10-08 16:49:09,.@DrBiden calls community colleges America’s best kept secret — she's right. A Biden administration will invest in… https://t.co/9PGXtY3FlF,48
1181612504365092864,2019-10-08 16:49:08,"A good education should be a reliable pathway to the middle class. But for too many, earning a credential or degree… https://t.co/LVnNwozeOn",246
1181362319193976833,2019-10-08 00:15:00,"Firefighters and teachers should not pay a higher tax rate than the wealthiest in our country. As president, I will… https://t.co/edrtXXLUqP",4374
1181336650602950657,2019-10-07 22:33:00,"Abuse of power is the defining characteristic of the Trump presidency.

Donald Trump has abused the foreign policy… https://t.co/2KPxYAlQzo",5262
1181322054181761024,2019-10-07 21:35:00,"Today, I'm proud the campaign is launching Women for Biden. There's so much at stake in this election — and so much… https://t.co/jXjP5FdYdr",854
1181291857134919682,2019-10-07 19:35:00,"As president, I will make passing the Equality Act a top legislative priority. A Biden administration won’t rest un… https://t.co/oeGk19xmuJ",303
1181291856480604160,2019-10-07 19:35:00,"A president should use the full might of the executive branch to secure justice, dignity, and safety for all. Inste… https://t.co/qU1KQ89llN",317
1181291855780237314,2019-10-07 19:35:00,"This week, the Trump Administration is set to argue before the Supreme Court that it’s legal to discriminate agains… https://t.co/0Zb6ZuVCbz",1044
1181263417765548032,2019-10-07 17:42:00,"We cannot, and will not, stand for President Trump’s corruption. We will beat him like a drum.",7554
1180965202482778112,2019-10-06 21:57:00,"If we stand together we can, and will, end our gun violence epidemic. Read my full plan to address this public heal… https://t.co/5oqZjUcDZe",649
1180946076590886912,2019-10-06 20:41:00,President Trump continuously dishonors everything it means to hold the office of President of the United States of… https://t.co/ogg2yeXCYA,12306
1180935003699580932,2019-10-06 19:57:00,Elena @De11eDonne is the pride of Delaware. Wishing her well as she recovers — we need more professional athletes l… https://t.co/gPcsQibi7l,273
1180917857242234883,2019-10-06 18:48:52,"In my experience, asking a foreign government to manufacture lies about your domestic political opponent is not “do… https://t.co/EBIfl7A3F8",7290
1180914870805352448,2019-10-06 18:37:00,No family should be struggling to make ends meet. American farmers are hurting as a result of President Trump’s bro… https://t.co/1GMAm6i3tI,1527
1180903546407010304,2019-10-06 17:52:00,Our planet just experienced the hottest September on record — yet President Trump continues to dismiss the devastat… https://t.co/Ip6uRwbtma,2152
1180887681913499648,2019-10-06 16:48:57,"It's clear who President Trump works for. He gave giant tax cuts to the super-wealthy and corporations. Now, he’s c… https://t.co/oCin0bwSAM",4842
1180879135670857730,2019-10-06 16:15:00,Jill and I are devastated to hear about last night’s shooting in Kansas City. No one should ever have to fear that… https://t.co/kNASdcPp98,2119
1180658582125080581,2019-10-06 01:38:36,"Every day it becomes clearer, we cannot give Donald Trump four more years in the White House. Stand with me, and to… https://t.co/ecw4otrnxT",626
1180654653127692288,2019-10-06 01:22:59,"And to Trump and those who facilitate his abuses of power, and all the special interests funding his attacks agains… https://t.co/Vt2WFsjonh",935
1180654515302883329,2019-10-06 01:22:26,"While the House does its job on impeachment, I’m going to stay focused on what matters: improving the lives of Amer… https://t.co/w7bO77gA5z",421
