id,created_at,text,retweet_count
1156383375030214657,2019-07-31 01:57:35,"RT @TeamJoe: President Trump doesn’t get the basics when it comes to tariffs. It’s American farmers, workers, and consumers who are paying…",216
1156379690904559622,2019-07-31 01:42:57,RT @TeamJoe: We must recognize that the impacts of climate change disproportionately fall on communities of color and low-income communitie…,87
1156374417691369474,2019-07-31 01:22:00,"On what would have been his 46th birthday, my thoughts are with the family of my friend Reverend Clementa Pinckney.… https://t.co/aNhz5yzKuE",204
1156371709265686528,2019-07-31 01:11:14,"RT @TeamJoe: .@JoeBiden is the only candidate who has defeated the @NRA on the national stage—and he did it twice. 

As president, he’ll do…",163
1156365898900475904,2019-07-31 00:48:09,RT @TeamJoe: Obamacare prohibits insurance companies from denying coverage or increasing premiums due to pre-existing conditions—it was gro…,198
1156339203824934912,2019-07-30 23:02:04,"RT @TeamJoe: This Friday, @DrBiden will be in Iowa to meet members of the community! We hope to see you there. RSVP to join her in Glenwood…",63
1156339179527294976,2019-07-30 23:01:58,"RT @TeamJoe: Nevada, this is big: @JoeBiden is heading your way this weekend! Join him in your community to talk about what’s at stake in t…",70
1156326700759863296,2019-07-30 22:12:23,President Trump &amp; Betsy DeVos continue to roll back our progress on LGBTQ rights. No child should feel unsafe in sc… https://t.co/b7tZw8cCEm,266
1156310866456981504,2019-07-30 21:09:28,My plan builds on that legacy with a new public health insurance option like Medicare. Read the full plan here: https://t.co/34NCSYhO2C,177
1156310865324519424,2019-07-30 21:09:28,"54 years ago, President Johnson signed Medicare and Medicaid into law. This landmark legislation changed the lives… https://t.co/HmD6u6Ufbq",306
1156286359541354496,2019-07-30 19:32:05,I’m grateful to Joe and Michelle for sharing their story and glad to hear Matthew is receiving the treatment he nee… https://t.co/6xWY4lg3DD,139
1156271238471462912,2019-07-30 18:32:00,President Trump has failed on his promises for American workers time and time again. We need to rebuild the middle… https://t.co/nnltfznpZD,387
1156005990061318145,2019-07-30 00:58:00,"Two years ago, President Trump gave giant tax cuts to the super-wealthy and corporations. Now, he wants to rip free… https://t.co/w2Tf1EJnzq",1496
1155980069384282112,2019-07-29 23:15:00,We have a moral obligation to do everything in our power to stop America’s gun violence epidemic — that starts with… https://t.co/ncoR0Ak34n,555
1155969547343556608,2019-07-29 22:33:11,The Affordable Care Act changed the life of @DrBiden’s sister — like it did millions of Americans — by giving her a… https://t.co/Yqwd15On40,298
1155946347280916480,2019-07-29 21:01:00,.@TheRevAl is a champion in the fight for civil rights. The fact that President Trump continues to use the power of… https://t.co/UgUItT7WrM,1283
1155914818202865665,2019-07-29 18:55:43,"Iowa, I have some big news: @DrBiden is heading your way on August 1st to open two of our field offices. Join her i… https://t.co/lEi9Tgp2uE",132
1155866822979178496,2019-07-29 15:45:00,We’re gathering #TeamJoe in Detroit on July 30th and 31st to show the power of our grassroots movement at the secon… https://t.co/g0Vjq1f6kN,155
1155702372338937861,2019-07-29 04:51:32,This violence is not normal. How many more families will have to lose a loved one before we fix our broken gun laws… https://t.co/2hBedt6UyF,1861
1155584966186717185,2019-07-28 21:05:00,"Instead of starting from scratch, we need to build on the Affordable Care Act. I'll expand on the progress we made—… https://t.co/r1TIQfezy2",323
1155573389471305728,2019-07-28 20:19:00,"Far too often, students who experience mental health problems do not get the care they need. As President, I will d… https://t.co/UvvyP17Lvt",498
1155529097612677121,2019-07-28 17:23:00,"We need to show the power of our grassroots movement. If you’re in the Detroit area, come together with #TeamJoe in… https://t.co/NVC6O53zNj",125
1155499150454095872,2019-07-28 15:24:00,"Congratulations to our @TeamJoe #DemDebate contest winner—Kellie from North Carolina!

Can’t wait to see you at the… https://t.co/ReaSsaraJE",251
1155479682990714880,2019-07-28 14:06:38,I worked hard to pass the Affordable Care Act—it was a milestone for American health care. I will continue to oppos… https://t.co/g0gBAHo6q9,301
1155479681954717696,2019-07-28 14:06:38,"Since the historic passage of the Affordable Care Act, Congressional Republicans have been fighting to it tear down… https://t.co/QTMmguPmAO",422
1155193889105600513,2019-07-27 19:11:00,Trump’s trade wars are squeezing American farmers. In states like South Dakota—where agriculture is a top industry—… https://t.co/99jD15JVKJ,363
1155176535428460545,2019-07-27 18:02:02,.@RepCummings is one of the finest people I’ve ever served with. It is despicable for you to attack him and the peo… https://t.co/udotbJKEWv,10924
1155166206443212800,2019-07-27 17:21:00,"Here’s the deal: I will oppose every effort by Republicans, Democrats, &amp; anyone else seeking to tear down Obamacare… https://t.co/mvEzyfkHhy",437
1155129767022211074,2019-07-27 14:56:12,A border wall is the physical embodiment of @realDonaldTrump’s inability to develop effective immigration policy.… https://t.co/WsZJ4gwJTo,675
1155128457786843136,2019-07-27 14:51:00,"Climate change is an existential threat to our planet. As President, not only will I recommit us to the Paris Agree… https://t.co/dLYDuamOfO",278
1155102646489047045,2019-07-27 13:08:26,"As president, I’ll make it a priority to take action against polluters who knowingly harm our environment and poiso… https://t.co/HHzyQ7sweW",207
1155102645423616001,2019-07-27 13:08:26,We can't be blind to the way environmental burdens—like air pollution—are distributed unevenly along racial and soc… https://t.co/R1E9PIQr7h,262
1154919417614147585,2019-07-27 01:00:21,"Today, on the Act's anniversary, we must recommit to fully breaking down barriers so everyone has the opportunity t… https://t.co/fzQPnc5gRH",240
1154919416532017152,2019-07-27 01:00:20,"Growing up with a stutter, my parents taught me from a young age that being different is no barrier to success. Ins… https://t.co/9Nj14a6Pxs",240
1154919415554727936,2019-07-27 01:00:20,"I've always been proud to have cosponsored the Americans with Disabilities Act, signed into law 29 years ago. Thank… https://t.co/1brDOxHWtD",393
1154875483428986881,2019-07-26 22:05:46,"Earlier this week, @DrBiden,@RepRichmond, and I had the opportunity to spend some time with the great folks at… https://t.co/wOw5geDRGy",186
1154839557118074881,2019-07-26 19:43:00,The marine transit system in Alaska is vital to rural communities—but faces draconian cuts in funding. IBU is on st… https://t.co/uTFa2yelrs,178
1154837541201338368,2019-07-26 19:35:00,Trump is fighting tooth &amp; nail to deny those fleeing dangerous situations their right to seek asylum in our nation.… https://t.co/tPAML78USv,439
1154809858555883522,2019-07-26 17:45:00,Trump’s tariff war with China is crushing American farmers. It's easy to talk tough when someone else feels the pai… https://t.co/gSk7tQLsOs,348
1154779660305260544,2019-07-26 15:45:00,"Let's call Trump’s travel ban what it is: a disgrace. We are a nation of immigrants, and we need a leader who recog… https://t.co/Sa1dmxWM57",414
1154753691628507138,2019-07-26 14:01:49,"Because a union fought for their private health insurance plan, Marcy and her husband were able to retire with dign… https://t.co/yk6p9wze7w",266
1154753637274533888,2019-07-26 14:01:36,"Like so many other Americans, Marcy prefers to keep her private insurance while recognizing that a public health in… https://t.co/686DByFw30",410
1154500277124251648,2019-07-25 21:14:50,"Since 1973, over 160 individuals in this country have been sentenced to death and were later exonerated. Because we… https://t.co/6fzYOV2WUI",514
1154474657275240450,2019-07-25 19:33:02,Had the opportunity to discuss my plans to advance equity and opportunity for communities of color all across the n… https://t.co/yYZ19hCsoB,118
1154454908482945024,2019-07-25 18:14:33,Governor @RicardoRossello’s resignation is a testament to the power of everyday people to effect change and a criti… https://t.co/ShAyaSun4H,218
1154453525331664901,2019-07-25 18:09:03,"The black agenda is America’s agenda. This morning, I discussed my plans for communities of color on the @TJMShow.

https://t.co/Q07kNyGp2J",150
1154443201048129536,2019-07-25 17:28:02,Here’s the deal: health care is a right. Every American should have the peace of mind that comes from  access to af… https://t.co/T42zb52lIv,249
1154423731449712640,2019-07-25 16:10:40,"Denali's death marks the 3rd murder of a trans woman in South Carolina this year.

Violence against the transgender… https://t.co/nasLtK2wIv",267
1154204620354228224,2019-07-25 01:40:00,Russia undermined our democracy by interfering in the 2016 election. That's a fact. We need a President who will st… https://t.co/1xucLrtAb1,1939
1154195410589761538,2019-07-25 01:03:24,One of the great things about being on the trail is getting a chance to have lunch with great folks like… https://t.co/JNrIe9xPJG,136
1154141707337961474,2019-07-24 21:30:00,"As President, I will provide states with funds to shift from incarceration to prevention, including addressing fact… https://t.co/EJazx4xgQo",173
1154122831501778945,2019-07-24 20:15:00,"Thank you, @NAACP, for hosting a thoughtful discussion in Detroit. As I shared today, there’s nothing we can’t do i… https://t.co/I5x9MSnM7p",135
1154119059685826560,2019-07-24 20:00:00,I believe in redemption. Formerly incarcerated individuals deserve the opportunity to be productive members of soci… https://t.co/yR2JW3pTzz,128
1154111507531096064,2019-07-24 19:30:00,"Certain life experiences are strongly correlated with an increased likelihood of future incarceration - abuse, illi… https://t.co/0HsPrQPQYC",92
1154051047285039104,2019-07-24 15:29:45,I'm about to take the stage at the @NAACP Presidential Candidates Forum. Watch live! https://t.co/7OrinSc8gy,116
1154008699087859713,2019-07-24 12:41:28,"RT @TeamJoe: Watch as our very own @SymoneDSanders breaks down @JoeBiden’s newly released plan to reform the criminal justice system.

To v…",160
1153807800016896000,2019-07-23 23:23:10,It’s about time we start rewarding workers with the resources to live with dignity &amp; respect—that begins with bette… https://t.co/Cr769BteWM,195
1153794417674903552,2019-07-23 22:30:00,"I had the opportunity to visit @YEPNOLA in New Orleans, Louisiana with @RepRichmond today. I commend the work they’… https://t.co/ohCKEMqmuQ",128
1153791650205855752,2019-07-23 22:19:00,We currently have insufficient data to eliminate racial &amp; ethnic biases in our criminal justice system. As presiden… https://t.co/5kzsgZMXnx,188
1153783092911300611,2019-07-23 21:45:00,We must reform our juvenile justice system to give children a second chance to live up to their potential. My plan… https://t.co/hk92QhyxLN,128
1153748791138426880,2019-07-23 19:28:42,"RT @TeamJoe: .@JoeBiden believes in second chances, which is why his newly released criminal justice plan sets a goal of ensuring 100% of f…",138
1153729151272148994,2019-07-23 18:10:39,My plan will counter the rise in hate crimes &amp; reinvigorate community-oriented policing in order to root out persis… https://t.co/8LCiwBJqKa,165
1153723538358046720,2019-07-23 17:48:21,The Equifax settlement is a reminder of the trust we put in major corporations that possess large amounts of person… https://t.co/bCJNd0oHG6,148
1153658129562951681,2019-07-23 13:28:26,"Today I released my plan to reform our criminal justice system. 

Equality, equity, justice—these ideas form the Am… https://t.co/cCgDtzHn8Z",356
1153605674313474048,2019-07-23 10:00:00,Too many people are incarcerated in the US – and many don’t have resources to successfully rejoin society after ser… https://t.co/lD0rcnePYi,477
1153414702346752009,2019-07-22 21:21:09,Trump’s words and actions are damaging our place in the world and our futures. We are a nation founded on diversity… https://t.co/cMSCBHyF42,542
1153390505809477632,2019-07-22 19:45:00,Our plan to revitalize rural America will provide a path to the middle-class for people in small towns and remote a… https://t.co/SuOJwfzpxP,200
1153365624179089409,2019-07-22 18:06:07,Trump’s continued racist attacks against these members of Congress cannot be tolerated or excused. This is not who… https://t.co/0bioOJBxHh,981
1153356532857225220,2019-07-22 17:30:00,"Drug corporations are profiteering off the pocketbooks of sick individuals.

Under a Biden administration, we’ll pu… https://t.co/7taCipieoa",254
1153338916700925952,2019-07-22 16:20:00,"Americans work hard every day, and they deserve a worry-free retirement with a steady income. I’ll put Social Secur… https://t.co/L2PAgYs6fI",351
1153081331682807811,2019-07-21 23:16:27,"9 years ago today, I proudly stood alongside President Obama as he signed the Wall Street reform and consumer prote… https://t.co/L0knHpWs2j",857
1153035668123267072,2019-07-21 20:15:00,I was never more proud to serve as Vice President than on the day President Obama signed the Affordable Care Act. A… https://t.co/cEzGywP7rl,874
1153009244205199361,2019-07-21 18:30:00,Ended my trip to Nevada by participating in a @nvdems Local Brews and National Views. Thank you to all who attended… https://t.co/l2EDhAyXE5,134
1152986730301140992,2019-07-21 17:00:32,RT @TeamJoe: It's #NationalIceCreamDay and we all know how much @JoeBiden loves ice cream! We want to know if #TeamJoe loves it too. Grab a…,242
1152979045736337408,2019-07-21 16:30:00,"Every American deserves the peace of mind that comes with quality, affordable health care.

My new plan will allow… https://t.co/7Sr5iAATaz",445
1152952598024073216,2019-07-21 14:44:54,Happy #NationalIceCreamDay! I hope everyone enjoys some ice cream on this hot summer day. I’ll be eating a pint of… https://t.co/d30ZIpAWv0,1242
1152895999150440451,2019-07-21 11:00:00,I know if we come together there is nothing we can’t do. That gives me the strength to know we can defeat Donald Tr… https://t.co/mp0WlrdtdS,1541
1152739969598799872,2019-07-21 00:40:00,"Today was our first nationwide Day of Action! It was great to spend the day in Las Vegas, Nevada kicking off our ph… https://t.co/wIYchBVPu4",157
1152735416275132416,2019-07-21 00:21:54,"Seven years ago, our nation watched in horror at the news from Aurora, Colorado. 12 innocent lives, full of so much… https://t.co/gxnogRPrX6",342
1152718375514230787,2019-07-20 23:14:11,That's what we're capable of when we come together in service of something larger than ourselves. That's the America I have faith in.,195
1152718374046175232,2019-07-20 23:14:11,"In that moment, we weren't thinking about being Democrats or Republicans. We weren't thinking about a way to contor… https://t.co/CTX6xVDDq7",186
1152718372905345024,2019-07-20 23:14:11,"Fifty years ago today, in every corner of our country, Americans gathered together to watch our nation put three as… https://t.co/xCPokjp2s5",338
1152680922057236482,2019-07-20 20:45:22,RT @HaleyARing: First day of action for @JoeBiden out in Buena Vista County!!! The humidity doesn’t stop #TeamJoe and @BuenaVistaDems !! #I…,110
1152680741857386496,2019-07-20 20:44:39,RT @Sal_DeFrancesco: A little summer heat ☀️ can't keep @TeamJoe down! Big thanks to all the volunteers out there knocking on doors to help…,77
1152663734621528064,2019-07-20 19:37:04,"RT @DrBiden: Every knock, every phone call, and every conversation matter — all of these small moments add up to something bigger than all…",269
1152638882002997248,2019-07-20 17:58:19,I’m heading to Detroit at the end of the month for our second Democratic debate. Supporters in every part of the co… https://t.co/5QuGCzDZMG,221
1152631756748726273,2019-07-20 17:30:00,This heat wave is a reminder that we’re already feeling the impacts of climate change.. It’s clear we need to take… https://t.co/OI1W9omYSf,704
1152597783074893824,2019-07-20 15:15:00,"I’m running for president to restore the soul of this nation, rebuild its backbone — the middle class, and unify al… https://t.co/215ft1gB7K",1303
1152579988891340802,2019-07-20 14:04:17,"Los comentarios del gobernador @RicardoRossello son vergonzosos. El lenguaje de odio no debe ser protegido, indepen… https://t.co/JF6AXjIKkg",230
1152558478776504320,2019-07-20 12:38:49,Governor @RicardoRossello's comments are shameful. Hateful language should be given no safe harbor -- regardless of… https://t.co/2icGklxGMb,897
1152397111801131011,2019-07-20 01:57:36,It was great meeting so many folks today at Tamales Liliana in Los Angeles. Thank you @HildaSolis for having lunch… https://t.co/S88TBSOCk8,145
1152313660787908610,2019-07-19 20:26:00,"Here's the deal, my plan to build on Obamacare will expand health care coverage and lower costs — without raising t… https://t.co/M9H01dTRkm",287
1152275911770685440,2019-07-19 17:56:00,President Trump’s comments this week were despicable. https://t.co/fOPHDDr1S4,926
1152250494275878912,2019-07-19 16:15:00,"Tomorrow, I’m heading to Nevada for our first Day of Action! Talking with neighbors about what’s at stake in this e… https://t.co/0ba211Vuhv",134
1152226586705313793,2019-07-19 14:40:00,"In America, health care is a right for all — not a privilege for the wealthy few.

As president, I’ll repeal Presid… https://t.co/1dwW5aQIoz",487
1152016900315942912,2019-07-19 00:46:47,"RT @TeamJoe: 🚨 Big News 🚨

We just found out @JoeBiden will be on night two of the second Democratic debate! We’re bringing together #TeamJ…",148
1151982730172932096,2019-07-18 22:31:00,".@DrBiden is visiting South Carolina tomorrow, and I’m excited for the folks of Summerville to have the opportunity… https://t.co/Mj3U3RfqON",179
1151964359167553536,2019-07-18 21:18:00,Stopped by Dulan's On Crenshaw to serve some food and chat about why I'm running for president. A great way to star… https://t.co/g96A8nn19h,189
1151952280360574976,2019-07-18 20:30:00,America’s teachers shouldn’t have to work a second job after a full day in the classroom just to make ends meet — b… https://t.co/O5d4ax307V,232
1151937181633667077,2019-07-18 19:30:00,"The ACA was and is a big deal. It took a century of presidents trying to expand health care access, and President O… https://t.co/sU3peyX5n9",529
1151926065310384133,2019-07-18 18:45:50,"Rebuilding America’s middle class is the major moral obligation of our time. And today, House Democrats took an imp… https://t.co/H6MKZ5tYIs",242
1151892134225559552,2019-07-18 16:31:00,"This Saturday, our campaign will be hosting a nationwide Day of Action. Supporters across the country will be comin… https://t.co/jPkD4mfLmg",183
1151868355374174208,2019-07-18 14:56:31,I believe protecting the ACA is the most important thing we can do. It covered 20 million Americans and protects ov… https://t.co/tLPo0EKdU6,103
1151840112768106499,2019-07-18 13:04:17,"Like Mark and Marianne, the lives of millions of Americans depend on the Affordable Care Act. We can’t tear it down… https://t.co/y7a9ao6pda",415
1151661204521328641,2019-07-18 01:13:22,"Let's make sure he doesn’t get four more years in the White House. If you’re with me, join our campaign and let’s g… https://t.co/nanZLIIrhj",360
1151661203351117825,2019-07-18 01:13:22,"So, Mr. President, I am here to tell you this. This is OUR country: The United States of America. You'll never unde… https://t.co/mTAZC7wON8",644
1151661202117922816,2019-07-18 01:13:22,"These members of Congress — children of immigrants, just like so many of us — are an example of exactly what makes America great.",147
1151661201212022784,2019-07-18 01:13:21,"Here's what has always made America great:

Honesty. Decency. Treating everyone with dignity. Demonizing no one — n… https://t.co/Jcl1wQdTqv",212
1151661200276672514,2019-07-18 01:13:21,Donald Trump thinks that our nation's great diversity makes us weak — because he has no idea what makes us great.,127
1151661199160958976,2019-07-18 01:13:21,"We’ve heard it before throughout our history, but it has no place in America in 2019.

It’s clear that Donald Trump… https://t.co/97aCZjAu8X",131
1151661197839753217,2019-07-18 01:13:21,"Four days ago, the President of the United States suggested that four elected members of Congress, all women of col… https://t.co/soQCS8KRZQ",1045
1151630157037350913,2019-07-17 23:10:00,"During Beau’s fight with glioblastoma, we learned about the incredible breakthroughs made in cancer treatment — and… https://t.co/C5ksS3AOPL",460
1151615584230150144,2019-07-17 22:12:05,"Wrapped up our trip with stops in Sioux City and Council Bluffs, where we discussed our new plan to ensure that eve… https://t.co/kbAVbdZXFu",160
1151579857937215488,2019-07-17 19:50:08,"We will provide rural hospitals with the adequate funding and flexibility they need to keep their doors open, doubl… https://t.co/6BSRWIU020",105
1151579856683118592,2019-07-17 19:50:07,"Rural health care will be a top priority in the Biden administration. Under our plan, rural hospitals won’t be thre… https://t.co/snrF3tqg24",100
1151579855579951104,2019-07-17 19:50:07,A Biden administration will help rural communities fully access federal resources and tackle persistent poverty in rural America.,21
1151579854489432076,2019-07-17 19:50:07,"We will pursue a trade policy that works for American farmers, transform our agriculture sector, triple funding for… https://t.co/EAzDoqBiqI",29
1151579853545758720,2019-07-17 19:50:07,My plan recognizes how much rural communities contribute to this nation and how much they’ve been hurt by this pres… https://t.co/BZXxLl0xuU,26
1151579851360485378,2019-07-17 19:50:06,"Rural communities power our nation. They feed our bodies and fuel our engines. A healthy, vibrant rural America is… https://t.co/xreUfkbx2j",188
1151569758694731777,2019-07-17 19:10:00,"In a Biden administration, we’ll give people the choice to buy into a public option like Medicare. That’s the best… https://t.co/cdolYTpi35",289
1151518169112203269,2019-07-17 15:45:00,"Justice Stevens was a decent, honorable man who served our country well. He understood that the most important thin… https://t.co/h6UxO9cdRz",173
1151272298835578881,2019-07-16 23:28:00,"Had the opportunity to speak with some great folks in Manning, Iowa, today about our new plan to revitalize rural e… https://t.co/Apf75HYWHV",136
1151233540673216514,2019-07-16 20:53:59,President Trump’s entire re-election strategy is based on fear and hatred of migrants — this is just the latest exa… https://t.co/d6FAJxPVqJ,361
1151233539523981312,2019-07-16 20:53:59,"Our Statue of Liberty invites in the tired, the poor, the huddled masses yearning to breathe free. Now President Tr… https://t.co/uo4UcYqHzr",644
1151228762123620353,2019-07-16 20:35:00,"Summer vacation season has started, but many hardworking Americans like the @ATUComm members currently striking the… https://t.co/R9WiFiObZW",106
1151215172704509952,2019-07-16 19:41:00,Thank you to Governor Tom Vilsack and @ChristieVilsack for opening up your home for yesterday’s house party. It was… https://t.co/abL56HyRbZ,112
1151202589242822656,2019-07-16 18:51:00,.@DrBiden and I had a very important meeting with @DrakeUGriff while at Drake University yesterday. https://t.co/CvQrwyggb9,165
1151194346978512896,2019-07-16 18:18:15,I’m glad to hear Matt is doing well — stories like his remind us of the need to protect and build upon the Affordab… https://t.co/rNspTIZJJs,168
1150943381129814017,2019-07-16 01:41:00,"At the #AARPIowaForum, I laid out my plan for older Americans. A Biden administration will lower drug costs, protec… https://t.co/NRkIOBC5Xj",217
1150860586047156224,2019-07-15 20:12:00,"Iowa, I hope you’ll join us this week to hear about our bold vision for the future of our country. Head to… https://t.co/wYkQ1C9C6j",157
1150779271583059968,2019-07-15 14:48:53,"In a Biden administration, we’ll protect the Affordable Care Act and the progress we’ve made — and won’t rest until… https://t.co/RLTqhWFRFB",234
1150778836482699266,2019-07-15 14:47:09,"In America, health care is a right — not a privilege dependent on your gender, race, sexual orientation, income or… https://t.co/N5FIf4odo0",243
1150777789995528193,2019-07-15 14:43:00,Our plan will stand up to the abuse of power by prescription drug corporations and take concrete steps to lower dru… https://t.co/A8gu26nuvd,155
1150776640894636032,2019-07-15 14:38:26,"For too many Americans with insurance, health care costs are still too high. Our plan will not only provide coverag… https://t.co/jZa1Iuw2c0",135
1150775755313487874,2019-07-15 14:34:55,We will provide premium-free access to this public option — with the full scope of Medicaid benefits — for people w… https://t.co/ap3CN9dqoR,141
1150774989207101440,2019-07-15 14:31:52,Our plan will give Americans the choice to buy into a public option like Medicare. That’s the best way to lower cos… https://t.co/TThjZF5V8Z,158
1150774078233387008,2019-07-15 14:28:15,I understand the appeal of Medicare for All — but folks supporting it should be clear that it means getting rid of… https://t.co/zEx3g3IVqU,165
