id,created_at,text,retweet_count
1219701591885996033,2020-01-21 19:21:35,"RT @JoeForNH: 🚨@JoeBiden is coming back to the Granite State! 🚨

RSVP ⬇️

https://t.co/kmKXasDt6W
https://t.co/XeFkKJyOpE

#NHPolitics http…",97
1219699683943014401,2020-01-21 19:14:00,I was reminded this weekend by Pastor McCallum that we've got to bring a sense of community back to this country. T… https://t.co/bXr6KEBfgC,734
1219476824264257537,2020-01-21 04:28:26,"Social Security is the bedrock of American retirement. And in my administration, we won't just protect it. We'll ex… https://t.co/ZjNNgbPGhW",845
1219469818237259776,2020-01-21 04:00:35,"Thanks for acknowledging this, Bernie. These kinds of attacks have no place in this primary. Let’s all keep our foc… https://t.co/oTHp1ABYZj",5192
1219449299760832514,2020-01-21 02:39:03,"The courage shown today by the lawmakers, staff, and gun safety advocates in Richmond is inspiring. It's long past… https://t.co/DZg1YVT1Bc",722
1219414303469522945,2020-01-21 00:20:00,From my days as a public defender to my time as Vice President — I've spent my entire career fighting against discr… https://t.co/5PZqfLW5qK,1860
1219394286439084033,2020-01-20 23:00:27,"In times of crisis and division, a president should seek to calm and heal. But time and again, President Trump has… https://t.co/szO1GgV0nt",4006
1219363972672978946,2020-01-20 21:00:00,"As Dr. Martin Luther King Jr. said, “The arc of the moral universe is long, but it bends toward justice.” As we see… https://t.co/E31mrAZTz9",1054
1219350885521858562,2020-01-20 20:08:00,Honored to have won Jacquelyn's endorsement. https://t.co/tGpNZjXacu,1968
1219265521159458819,2020-01-20 14:28:47,Donald Trump's poisonous rhetoric and divisive politics have brought America to an inflection point. In this moment… https://t.co/EwC1XV6341,3293
1219070147543158784,2020-01-20 01:32:27,This is a big victory for South Carolina. The right to vote is the most fundamental American right there is — we ha… https://t.co/JkiEJDd3wI,2110
1219004502566674432,2020-01-19 21:11:36,"The big banks didn't need an additional $32 billion in savings, and their shareholders certainly didn't need an ext… https://t.co/bwkFWMrfsA",1646
1218985478013235200,2020-01-19 19:56:00,The 60th anniversary of our alliance with Japan reminds us that close partnership and deep cooperation are among ou… https://t.co/ZpGn5eWS51,847
1218945416596795393,2020-01-19 17:16:48,"I stand with the snow plow drivers who work day in and day out to keep our roads safe, often in dangerous condition… https://t.co/pkqIw834N1",338
1218930361402634242,2020-01-19 16:16:59,"Thank you @Captsully for sharing your story. There’s a lot of kids who I bet needed to hear it. 

Being different i… https://t.co/17pVXO4KA6",2186
1218684496293384192,2020-01-19 00:00:00,Donald Trump continues to embrace corruption at home and abroad. Rather than addressing the root causes pushing peo… https://t.co/OfyqCrnL2z,1384
1218658070512861184,2020-01-18 22:15:00,"There used to be a basic bargain in this country—when you worked hard, you shared in the prosperity you helped crea… https://t.co/NEtii6w86F",1734
1218622334929518593,2020-01-18 19:53:00,"Together, we're going to beat Donald Trump and take back this country.

Chip in if you’re ready to leave him in the… https://t.co/w5FmfATlbM",1214
1218594149558972416,2020-01-18 18:01:00,Weapons of war have no place in our communities. It’s time we take on the @NRA and ban assault weapons for good.,3930
1218567473768747008,2020-01-18 16:15:00,"Vermont — you don't have to wait until March 3rd to cast your ballot, you can early vote now! Head to… https://t.co/sPOyYL960E",409
1218327140053082114,2020-01-18 00:20:00,"Happy birthday, @MichelleObama. You’re a shining light in the lives of all that have the honor of knowing you. Jill… https://t.co/WXfi7jJ9Ub",1561
1218305723706363913,2020-01-17 22:54:54,We need a president who respects our troops — and who will restore honor and integrity to the Oval Office. https://t.co/q9o1dUJ00h,1032
1218305640042504192,2020-01-17 22:54:34,"Donald Trump says he prefers war heroes who ""weren't captured."" He attacks Gold Star families. Now he calls our gen… https://t.co/H57OuevvHZ",5353
1218294441255014403,2020-01-17 22:10:04,No malarkey here. https://t.co/7ODeSCfYMu,435
1218285113164824577,2020-01-17 21:33:00,"Minnesota — early voting is now open! Don’t wait until March 3rd to cast your ballot, head to the polls and be one… https://t.co/kDBm8uqXEK",351
1218245602623909890,2020-01-17 18:56:00,"It is a moral failing when children are ripped from their parents' arms, locked away in overcrowded detention cente… https://t.co/2IOwy44Swy",2828
1218169872791764994,2020-01-17 13:55:04,"This isn't just about who I am, this is about who we are as a country. We're tough, resilient, but always full of h… https://t.co/rSB6bU7imf",3483
1217982368499236864,2020-01-17 01:30:00,Hate never goes away; it just hides. And when leaders give it oxygen — as Donald Trump has done — it comes roaring… https://t.co/St4sSVVK4w,2209
1217971138162298881,2020-01-17 00:45:22,"America’s farmers have had enough of your empty promises, Mr. President. https://t.co/nsOyktOqkR https://t.co/9NSJj7pRjY",760
1217962049726226433,2020-01-17 00:09:15,"Let's be clear: white supremacy, racism, and violence have no place in America. We have to root out these evils and… https://t.co/OoHmvQQ9KM",1807
1217937084876513282,2020-01-16 22:30:03,Voting is a right. https://t.co/Ch2ZCfLqXz,1582
1217918195115257856,2020-01-16 21:15:00,A president has to be able to not only fight — but heal and bring our country together. I promise you that’s what I… https://t.co/bgooGIXguy,754
1217891772862468096,2020-01-16 19:30:00,The character of our nation is on the ballot in this election. We are so much better than who Donald Trump thinks w… https://t.co/Lu4bENJjiF,739
1217864525640278020,2020-01-16 17:41:44,"If true, this constitutes an unprecedented attack on our Foreign Service. Amb. Yovanovitch spent her life advancing… https://t.co/Sxi12Thhkl",1488
1217637216937267206,2020-01-16 02:38:29,"America has never lived up to our promise of equality for all, but we've never stopped trying. Virginia brought us… https://t.co/uUV7uvFWWE",600
1217613689068642305,2020-01-16 01:05:00,I'm more optimistic about our future today than I was when I got elected to the Senate as a 29-year-old. If we come… https://t.co/2LkLDkOLIP,1128
1217604963825848320,2020-01-16 00:30:20,"My thoughts and prayers are with Mustafa Kassem's family at this difficult time. His death, after six years in an E… https://t.co/kbdYyRhq7d",605
1217583673282789377,2020-01-15 23:05:43,"This seems like a great reason to rejoin the Paris Agreement, @realDonaldTrump. https://t.co/HHI4KUokcF",1668
1217570907176046592,2020-01-15 22:15:00,"I’m proud that today, our campaign is launching HBCU Students for Biden. This program will be dedicated to helping… https://t.co/7pz3nMGpA1",199
1217546999433744386,2020-01-15 20:40:00,"I'm ready to debate Donald Trump on the economy. The American people are getting clobbered, and the wealthy are the… https://t.co/rY1NLuIRq7",1014
1217516800369405952,2020-01-15 18:40:00,Cornell is right — everything is at stake this November. We have to get Donald Trump out of the White House and uni… https://t.co/wfHZWFPWaI,797
1217493376267886594,2020-01-15 17:06:55,Historically Black Colleges and Universities have always been the heartbeat of our country’s fight for justice. Tha… https://t.co/x0VTM16v0i,811
1217321765174759424,2020-01-15 05:45:00,"I just got off the debate stage in Iowa, where we're in the homestretch before the caucus. With just 19 days left,… https://t.co/2khMFttdY3",516
1217299473128443904,2020-01-15 04:16:25,"This is the United States of America. There’s not a single thing beyond our capacity, if we do it together. Let’s go do it. #DemDebate",730
1217298932151263232,2020-01-15 04:14:16,"With just 20 days until the Iowa Caucus, we need your help to fuel our campaign. Every donation—big or small—goes a… https://t.co/GD59RoTeVt",210
1217296167870115841,2020-01-15 04:03:17,"Look, I’ve been the object of Donald Trump’s affection now more than anyone else on this stage. I’ve taken all the… https://t.co/lneLWHempf",1508
1217289913969840130,2020-01-15 03:38:26,Republicans have savaged my only surviving son. They’ve spread lies about me that networks won’t even carry. It doe… https://t.co/bFydLCOGRv,6639
1217288891625025537,2020-01-15 03:34:22,Child care is personal to me: I was a single parent as a young senator. I commuted home to Delaware every night to… https://t.co/QZzgx3BwFo,596
1217286036092604417,2020-01-15 03:23:01,"Make no mistake, the situation with Iran is a crisis of Donald Trump’s own making. He claimed walking away from the… https://t.co/NZdiSY57Xr",488
1217284316973207553,2020-01-15 03:16:11,"Under the Biden administration, labor and environmental groups will be at the table to negotiate trade agreements.… https://t.co/Sf4Zaxt7tx",279
1217281361247178752,2020-01-15 03:04:27,Medicare should be able to negotiate prices with drug companies. #DemDebate,250
1217280340114448384,2020-01-15 03:00:23,"I’ve been very clear about what my health care plan would do: Build on Obamacare by giving Americans more choice, r… https://t.co/wF5At7uZBd",409
1217275855401103360,2020-01-15 02:42:34,"If we don’t write the global rules of the road for trade, cyber, climate change, and so much more, they may be writ… https://t.co/IZPm8TsmSL",266
1217273974427652097,2020-01-15 02:35:06,"I wouldn’t meet with Kim Jong Un without pre-conditions. By meeting with him, Donald Trump gave Kim Jong Un what he… https://t.co/Zus7p5leNS",441
1217270827873460226,2020-01-15 02:22:35,No president can take our country to war without the informed consent of the American people. #DemDebate,433
1217270360443424768,2020-01-15 02:20:44,There’s a big difference between sending tens of thousands of American combat troops to the Middle East indefinitel… https://t.co/MZu1RdrtPr,269
1217269640893734912,2020-01-15 02:17:52,No one should shed a tear for Qassem Soleimani. But Trump’s reckless escalation and thoughtless withdrawal from the… https://t.co/ZDH2gYA4O2,623
1217268959508078592,2020-01-15 02:15:10,When Trump discarded the Iran nuclear deal he promised it would produce a “better” one and curb Iranian aggression—… https://t.co/PyDwl96SxI,302
1217267798025568256,2020-01-15 02:10:33,In 2009 President Obama asked me to oversee our effort to bring home our combat troops. I’ll put my record and my j… https://t.co/VrCs68kiwc,329
1217261367234711552,2020-01-15 01:45:00,I’m about to step on stage for tonight’s #DemDebate in Iowa. Make sure to follow along here and on @TeamJoe for upd… https://t.co/Co9bW290II,290
1217250530164183040,2020-01-15 01:01:56,So much of what’s tearing this country apart can be fixed if we treat each other with basic dignity and respect onc… https://t.co/Ng05Ivo4o0,1433
1217198381812080643,2020-01-14 21:34:43,Donald Trump has once again sided with corporations over American workers by making it easier for them to get away… https://t.co/ECrrYrdOAb,1650
1217145604691771392,2020-01-14 18:05:00,"We’re in a battle for the soul of our nation — and Donald Trump is poison to our soul. He has:

- Fanned the flames… https://t.co/odgPxTmNKh",8110
1217091659076337664,2020-01-14 14:30:38,"Why are you so obsessed with me, Mr. President? https://t.co/BbAawEvQo6",9496
1216920521369096192,2020-01-14 03:10:36,"I'm married to a teacher, I see firsthand how difficult it is. We've got to let educators do their job so our stude… https://t.co/VVPXL7EL4a",2007
1216906004308414465,2020-01-14 02:12:55,"From day one, Donald Trump has been determined to roll back every environmental protection he could get his hands o… https://t.co/eytH24qizW",2726
1216888913199013889,2020-01-14 01:05:00,The stakes of this election could not be higher. Eight years of Donald Trump will fundamentally alter the character… https://t.co/ZRr3YZRUSa,3099
1216873556241416193,2020-01-14 00:03:58,"When we said to give us your tired, poor, and huddled masses, we absolutely did not mean ""unless they are fleeing v… https://t.co/ZDGkokdl9x",1340
1216842742145462275,2020-01-13 22:01:32,"Transit workers are being attacked every day, often while buses are moving, putting bus drivers and riders in harm'… https://t.co/xSbGkoFuzM",326
1216818448900263938,2020-01-13 20:25:00,Donald Trump has no strategy when it comes to Iran. No endgame. The only way out of his self-made crisis is through… https://t.co/bZEELWOVFv,1651
1216788361198866434,2020-01-13 18:25:26,Come on. Your administration has been arguing in court to repeal protections for people with pre-existing condition… https://t.co/p5KJS1jt77,8663
1216758302421352451,2020-01-13 16:26:00,"Cory, you campaigned with joy and heart, and instead of just talking about bringing people together, you did it eve… https://t.co/t88BqZrYAM",4422
1216737889276612609,2020-01-13 15:04:53,"RT @JoeForIA: .@JoeBiden's leadership is needed now more than ever before. 

Help him when the #iacaucus, no matter where you live. 

Sign…",186
1216546909579567104,2020-01-13 02:26:00,Puerto Rico should not be treated any differently than if this happened anywhere else in America — it's wrong. We s… https://t.co/SvE0bvv5MV,2807
1216495106037035011,2020-01-12 23:00:09,"There’s enormous opportunity once we get rid of Donald Trump. We can:

- Address the climate emergency
- Build a mo… https://t.co/rXFilCDpaL",7936
1216464610318061577,2020-01-12 20:58:58,Trump’s reckless policies have needlessly endangered our interests in the Middle East. But none of us should be und… https://t.co/nugyKtjGbJ,2685
1216424855257534464,2020-01-12 18:21:00,"Gracias por su apoyo, Mayor @EricGarcetti. Estoy orgulloso de caminar junto a los bomberos, los Angelenos, y los Am… https://t.co/M7OE62OH8B",221
1216422087138693120,2020-01-12 18:10:00,"Thank you for your endorsement, Mayor @EricGarcetti. I’m proud to walk with firefighters, Angelenos, and Americans.… https://t.co/qe3XHAADzc",785
1216160510183428096,2020-01-12 00:50:35,"I want to congratulate my friend Iowa Attorney General Tom Miller on making history. I've known Tom for years, he h… https://t.co/OGzMOwcszb",362
1216109024040476672,2020-01-11 21:26:00,I've seen firsthand how hard our educators work for little pay and with few resources. They deserve better. It's ti… https://t.co/PdrDIe5wmM,995
1216081341965590529,2020-01-11 19:36:00,What kind of nation are we if we simply accept that kids learn active shooter drills with their ABCs? We have to ta… https://t.co/M1qj5avGpR,2660
1216056642313359361,2020-01-11 17:57:51,Congratulations to President Tsai and the people of Taiwan for another successful election. You are stronger becaus… https://t.co/szC6xea8QU,1748
1216053407779360768,2020-01-11 17:45:00,Members of Teamsters Local 104 are striking against ASARCO for their unfair labor practices—I called into the picke… https://t.co/MIXgS3Uogm,620
1215808474501844992,2020-01-11 01:31:43,"Firefighters represent the best of America — courageous, selfless, and always answering the call to duty. I'm grate… https://t.co/HN02V4JGD7",1813
1215786650137055234,2020-01-11 00:05:00,Being a nation of immigrants is and has always been one of our greatest strengths. Our diversity has always made us… https://t.co/asjOhdy28P,1435
1215740345113141248,2020-01-10 21:01:00,Make no mistake: the situation with Iran is a crisis of Donald Trump's own making. He brought us to the brink of wa… https://t.co/mEGFYxn28f,6630
1215703603098288129,2020-01-10 18:35:00,"I've released 21 years of my tax returns. Why haven't you released any of yours, Mr. President?

Release your taxes… https://t.co/IAzvDmTjbx",8053
1215653271961919489,2020-01-10 15:15:00,"Donald Trump brought us dangerously close to starting a new war with Iran without any semblance of a plan.

This mo… https://t.co/8POSDYYgko",2575
1215457388825923584,2020-01-10 02:16:38,"I started the Cancer Moonshot so we could be the generation that finally cures cancer.

You then tried to slash nea… https://t.co/ZLTQ1rhxu7",9741
1215393056603561984,2020-01-09 22:01:00,This election is about the soul of America — and a nation that allows our epidemic of school shootings to continue… https://t.co/6UqsjwWcwQ,948
1215358611024678913,2020-01-09 19:44:07,Facebook continues to put their profits over the truth — allowing politicians like Donald Trump to spend an unthink… https://t.co/LCYOCvJ1mi,2378
1215322527012196353,2020-01-09 17:20:44,"RT @JoeForNH: This election is different — the stakes are higher. It’s going to take a strong, experienced leader to put us back on track.…",370
1215322407642202112,2020-01-09 17:20:16,RT @TeamJoe: Folks from across the country are heading to Iowa to talk to voters about @JoeBiden! Want to join them? Sign up now ⬇️,122
1215298432958529537,2020-01-09 15:45:00,"We are so much better than who Donald Trump thinks we are. We don’t have to give in to his dark, petty, angry visio… https://t.co/bSXu70wZf0",4059
1215082273822953472,2020-01-09 01:26:03,"Instead of using his statement today to lay out a coherent strategy on Iran, Donald Trump used it to mislead the co… https://t.co/wZOEgf7ES8",2162
1215082272682119170,2020-01-09 01:26:03,I'm thankful no one was hurt in last night's attack. But we're only in this mess because Donald Trump pulled out of… https://t.co/MUwPl8Pgxo,4961
1215069324538499072,2020-01-09 00:34:36,Gabby is one of the strongest people I know. The resilience she has shown is remarkable. I'm inspired by her courag… https://t.co/5SXFjICQ89,759
1215054324553764864,2020-01-08 23:35:00,"3,820 days — that's how long it's been since the federal minimum wage was last raised. It’s unacceptable. Raising t… https://t.co/uU25ETOaKT",884
1215009026125303811,2020-01-08 20:35:00,"Pope Francis is absolutely right. As a nation, we have a moral obligation to ensure everyone has access to the care… https://t.co/5icmDNLdgi",2922
1214980085339623425,2020-01-08 18:40:00,"We have to rebuild the middle class. But this time, we have to make sure that people historically left out of the m… https://t.co/N6HuEYjN0d",724
1214722638733406209,2020-01-08 01:37:00,"I’m going to hold off on commenting on the news tonight until we know more, but there is one thing I will say: Jill… https://t.co/CCGeVREgCy",10870
1214675579498192898,2020-01-07 22:30:00,"Donald Trump says he wants to end endless wars in the Middle East, yet he is bringing us dangerously close to start… https://t.co/wNRAVpW3FX",1436
1214669387417952258,2020-01-07 22:05:24,"Estoy con el pueblo de Puerto Rico, nuestros conciudadanos, en este momento de necesidad. Es inconcebible que gran… https://t.co/GGlqRNZO1f",615
1214646310256726016,2020-01-07 20:33:42,"I stand with the people of Puerto Rico, our fellow citizens, in this moment of need. It’s unconscionable that so mu… https://t.co/7bX8yhGSsa",1077
1214641417160724484,2020-01-07 20:14:15,"Nicolás Maduro is a dictator. I strongly condemn his regime’s violent takeover of the Venezuelan National Assembly,… https://t.co/xvHpCWo9PA",1301
1214627763832807424,2020-01-07 19:20:00,Donald Trump is the most reckless &amp; incompetent commander in chief we've ever had. Every day he directs American na… https://t.co/88NUv5mK7i,876
1214607032113913857,2020-01-07 17:57:37,"At 1:00 PM, I'll be speaking about the escalating situation with Iran and the imperative need to restore respected,… https://t.co/DxiNtoZosD",999
1214340404289703936,2020-01-07 00:18:08,"Trump wants to ignore climate science when making infrastructure decisions. In the Biden Administration, every doll… https://t.co/FBglIHsGUs",1290
1214298343435915264,2020-01-06 21:31:00,"On Día de los Reyes, as Christmas comes to a close, we are reminded of the call of the three kings: to give of ours… https://t.co/1iTEXRMWA5",595
1214267892482469888,2020-01-06 19:30:00,Let's be clear: Donald Trump does not have the authority to take us into war with Iran without Congressional approv… https://t.co/Dk6r88qONV,8819
1214226912270311425,2020-01-06 16:47:09,John Deere is laying off yet another round of workers in Iowa because of Donald Trump's reckless trade war. All he'… https://t.co/rMiRRC4kCl,5828
1213987660802465793,2020-01-06 00:56:27,I stand in solidarity with those marching in New York against the rise of anti-Semitism. This is what the battle fo… https://t.co/pH29h9fgJR,1686
1213981505443287040,2020-01-06 00:32:00,"Our Statue of Liberty invites in the tired, the poor, the huddled masses yearning to breathe free. But Donald Trump… https://t.co/In0bh2sizQ",1306
1213955345372065792,2020-01-05 22:48:03,This is a crisis of Donald Trump’s own making. He claimed pulling out of the Iran deal would deter Iranian aggressi… https://t.co/4PxQ5z6XIp,13230
1213908021304332288,2020-01-05 19:40:00,"Hey @realDonaldTrump, do you think the American people want another war in the Middle East? Des Moines certainly do… https://t.co/KV33JkRxlE",3397
1213663155743842304,2020-01-05 03:26:59,"The more the walls close in on this guy, the more irrational he becomes. https://t.co/Nba7Color1",8675
1213606448699232257,2020-01-04 23:41:39,"The world is burning, yet Donald Trump continues to deny the evidence of climate change before all of our eyes. We… https://t.co/WRdwlNWuua",5537
1213573089910493184,2020-01-04 21:29:06,"This simply shouldn’t happen in America. Folks deserve access to affordable, quality long-term care in their homes.… https://t.co/gO7HU51kPo",480
1213555699671851015,2020-01-04 20:20:00,"We can overcome four years of Donald Trump, but if we give him eight years in the White House he will forever and f… https://t.co/bA7qSFHPSp",5870
1213515434420391937,2020-01-04 17:40:00,"On the trail, I hear countless stories from folks whose lives have been changed by Obamacare. We can't afford to st… https://t.co/y0rzkVDcy8",2775
1213265034601611264,2020-01-04 01:05:00,The prospect of direct conflict with Iran is greater than ever. Does Donald Trump have a strategy for what comes ne… https://t.co/zprIDyAb7X,4169
1213217722508570624,2020-01-03 21:57:00,We need a leader who will be ready on day one to pick up the pieces of Donald Trump's broken foreign policy and rep… https://t.co/ERsDi9Se3Y,3734
1213139497111687168,2020-01-03 16:46:09,RT @TeamJoe: Members of #TeamJoe across the country are fired up and heading to Iowa to spread our campaign’s message to voters. Ready to j…,146
1213131655474376705,2020-01-03 16:15:00,"Our world has been set on edge by an erratic, unstable, and dangerously incompetent commander in chief. The stakes… https://t.co/4n14rBc0S9",10903
1212954848666234880,2020-01-03 04:32:26,My statement on the killing of Qassem Soleimani. https://t.co/4Q9tlLAYFB,6989
1212922129886388224,2020-01-03 02:22:25,Donald Trump stacked the Supreme Court with justices to try to overturn Roe v. Wade—and now Republicans are seizing… https://t.co/BF5vfQsH89,2490
1212908938590670848,2020-01-03 01:30:00,"We're just one full day into 2020 and there have already been at least three mass shootings across the country.
 
E… https://t.co/naGwCz68Br",2026
1212898749305020416,2020-01-03 00:49:31,"Before the holidays, Jill walked across the Gateway International Bridge into Matamoros, Mexico, where families are… https://t.co/1mrlO39cvT",1175
1212871441093255168,2020-01-02 23:01:00,"If you're a teacher or a firefighter, you're probably paying more in taxes than Amazon or Netflix. We've got to mak… https://t.co/nPnRKWLmVl",3076
1212811057313583106,2020-01-02 19:01:03,I'm excited to share that we raised $22.7 million this last quarter — our biggest quarter so far this campaign! Tha… https://t.co/0hEr2dO9oF,2485
1212794433617436672,2020-01-02 17:55:00,"Like Vicky said, we need a president who will restore integrity to the White House. https://t.co/i8k2OwsK7k",1354
1212768009430937601,2020-01-02 16:10:00,"It was a privilege to work with @JulianCastro during the Obama Administration, and a true honor to be in this talen… https://t.co/mmc29jQpha",2371
1212556035283705858,2020-01-02 02:07:41,Every day that Donald Trump remains in the White House puts the future of our planet at risk. We have to beat him t… https://t.co/ERL5EGtlYV,2092
1212540258681851905,2020-01-02 01:05:00,This election is about the soul of our nation — and Donald Trump is poison to our soul. https://t.co/cwzycLJV0d,10576
1212524152608833536,2020-01-02 00:01:00,"With just over one month until the Iowa Caucus, we need all hands on deck to talk with folks about what's at stake… https://t.co/GvAy348wIg",393
1212442112219844609,2020-01-01 18:35:00,"Every single human being deserves to be treated with dignity. Everyone. The poor and the powerless, the marginalize… https://t.co/VDBGSeEUT1",2556
1212180387260010496,2020-01-01 01:15:00,Our final fundraising deadline of 2019 is just hours away and we need your help. Every donation — big or small — go… https://t.co/nCN3fX9reG,279
1212153964206198789,2019-12-31 23:30:00,"As we move into the New Year, there's one thing I know: in 2020 we're going to beat Donald Trump and take back this country.",8080
1212131972295929856,2019-12-31 22:02:37,2019 was a year of record violence — it will be a moral failure if we allow 2020 to be the same. We have to elect l… https://t.co/TWdKLZeh1e,1001
1212112439623458826,2019-12-31 20:45:00,"Next year could give us one of two things: a new administration or four more years of Donald Trump.

We can defeat… https://t.co/nAIXce52dO",478
