id,created_at,text,retweet_count
1185511078677008385,2019-10-19 11:00:41,हमें अपनी सैन्य शक्ति और पुलिसकर्मियों की बहादुरी पर हमेशा गर्व रहा है। यही कारण है कि हमारी सरकार ने उनके कल्याण के लिए कई निर्णय लिए हैं। https://t.co/WdrdBuGFPZ,1724
1185511017482113024,2019-10-19 11:00:26,"Six years ago, I had come to Rewari as the newly appointed PM candidate of my Party. That time I had made a set of promises to the people. 

Today, I asked if I fulfilled those. Here’s what the people said. https://t.co/0aCPK78qpd",1771
1185510809381658625,2019-10-19 10:59:37,"अपने स्वार्थ के लिए लोगों को बांटना, उनका फायदा उठाना, कांग्रेस और उसके जैसे दलों की पुरानी आदत रही है।

इन लोगों ने हरियाणा के साथ भी यही किया। https://t.co/Xziu65G4hO",2108
1185510678485848066,2019-10-19 10:59:06,Here is one thing I am very proud our Government has got the honour of doing. Have a look. https://t.co/5GqNIKSOjS,1511
1185480980108201986,2019-10-19 09:01:05,It is always special to be in Rewari. Watch my speech. https://t.co/bCbmheJemt,2281
1185443680523436032,2019-10-19 06:32:52,Sirsa is home to exceptional and warm-hearted people. It’s an honour to serve them. Watch from Ellenabad https://t.co/wKYJnODZce,2046
1185251311555510275,2019-10-18 17:48:28,"Thank you Mumbai!

Today’s rally, like the others across Maharashtra, indicates the people’s mood. 

We seek another term based on our work in the last five years. We want to continue building infrastructure, boost agriculture and farmer welfare, ensure water for every home. https://t.co/wcFLwRrxte",2427
1185222186484715525,2019-10-18 15:52:44,"हमारी सरकार के काम करने का तरीका है- हम जो संकल्प लेते हैं, उसे सिद्ध करते हैं। 

#पुन्हा_आणूया_आपले_सरकार #PunhaAnuyaAapleSarkar https://t.co/hDAtuLC3ev",2914
1185221694706745344,2019-10-18 15:50:47,"It is a dream of every Indian to have his or her own house. 

Our Government is ensuring that the dream of ‘Housing for All’ is fulfilled. 

This also includes destroying the real estate mafia, which had a free run during the time of Congress-NCP. https://t.co/qcCriJaWaq",2129
1185221490116943872,2019-10-18 15:49:58,"Our focus is to create a nation of job creators. 

From the earlier burden of red tape, there is a red carpet for investors and innovators. 

The system of faceless tax assessments will help several Indians. 

Angel tax becoming history will help our youth. https://t.co/izLG7Q2fHq",1589
1185221161455505409,2019-10-18 15:48:39,"Mumbai, a city that has contributed so much to our nation. 

This dynamic city, our financial capital is also home to the best human capital. 

The NDA, at the Centre and in Maharashtra is working to enhance ‘Ease of Living.’ https://t.co/TL5FTo0XM9",1620
1185203639796649984,2019-10-18 14:39:02,Addressing a rally in Mumbai. Watch my speech. https://t.co/AXtxPGJhrX,2112
1185184864191954945,2019-10-18 13:24:25,"Reached Mumbai. About to address a rally in this vibrant city. 

Here’s a photo of the spectacular sky while on the way to Mumbai. https://t.co/u929cYFvon",2848
1185150155084972038,2019-10-18 11:06:30,"Great fervour in Gohana and Hisar. 

The mood on the ground favours the development oriented policies of BJP. 

Haryana saw a video of how Congress leaders were counting seats outside Parliament and arguing about their dismal prospects across the state. 😂 https://t.co/U5lmJyKOi3",1418
1185148743764459520,2019-10-18 11:00:54,"सोनीपत को उद्यम और उद्यमियों का हब बनाने का प्रयास जारी है।

इसलिए आधुनिक इन्फ्रास्ट्रक्चर का निर्माण तेज गति से हो रहा है। https://t.co/Ew5mZh18wE",1454
1185148360635768832,2019-10-18 10:59:22,"एक तरफ दर्द, दूसरी तरफ हमदर्द!

ये है कांग्रेस की कहानी… भारतीय सेना का अपमान करो, उनका मजाक उड़ाओ और उन्हीं के दावों के आधार पर पड़ोसी देश शोर मचाता है। https://t.co/zuDoEDH9eH",2393
1185147812729634816,2019-10-18 10:57:12,"सोनीपत का मतलब ही है: किसान, जवान और पहलवान!

लोकसभा चुनावों में सोनीपत और हरियाणा ने बड़े-बड़ों का अहंकार मिट्टी में मिला दिया। https://t.co/biR517fGAb",1664
1185147457165881344,2019-10-18 10:55:47,कर्मठ किसानों के कल्याण के लिए हम प्रतिबद्ध हैं। https://t.co/yzvNktF4uR,1401
1185147106593366016,2019-10-18 10:54:23,"आज हरियाणा में अगर भाजपा के पक्ष में अभूतपूर्व समर्थन दिख रहा है, तो उसके पीछे 5 वर्षों के हमारे काम भी हैं और हमारे विरोधियों के कारनामे भी हैं। https://t.co/SBLEpNrF3a",1822
1185120619416846337,2019-10-18 09:09:08,"Talking about the BJP’s development agenda in Hisar, Haryana. Have a look. https://t.co/NEmwiMEYCl",1791
1185094416244989953,2019-10-18 07:25:01,Speaking at a massive rally in Gohana. Watch. https://t.co/5voDRUh8ed,2391
1184883575008747522,2019-10-17 17:27:13,"Humbled by the affection in Pune, a city of immense energy and vibrancy. 

It is the place from where several social reformers hail. It is a centre of learning. It now also home to dynamic youth innovating in the world of start ups. 

Here are glimpses from today’s rally. https://t.co/I4HvQBYsfg",1984
1184882639930609665,2019-10-17 17:23:30,"I kept saying that those who looted the poor will be punished for their misdeeds. That time opposition leaders mocked me. 

Today, those words are coming true. And, this will continue.

I again say- No looter will go unpunished. 

We value the hard earned money of our people. https://t.co/aOL1hqCo3E",5217
1184880860287373313,2019-10-17 17:16:25,"जितनी बड़ी अर्थव्यवस्था होगी, उतनी तेजी से हम गरीबी को हरा पाएंगे।

जितनी बड़ी अर्थव्यवस्था होगी, उतनी ही तेजी से मध्यम वर्ग का जीवन स्तर ऊपर उठा पाएंगे।

जितनी बड़ी अर्थव्यवस्था होगी, उतनी ही तेजी से युवाओं की आकांक्षाओं को हम पूरा कर पाएंगे। https://t.co/nhMQN7IlAJ",3056
1184880766163009546,2019-10-17 17:16:03,"The decisions on Articles 370 and 35(A) will:

Further integration.

Boost inclusion.

Begin industrial growth for Jammu, Kashmir and Ladakh. 

Increase investment. 

Create the proper environment for innovation. 

It ends the era of exclusion. https://t.co/G84LLjXkrP",2384
1184831781322625024,2019-10-17 14:01:24,Prayed at the Shree Vaijnath Jyotirling Devsthan in Parli. Feeling blessed. 🙏🏼 https://t.co/8wc4dEV0xo,2780
1184828517155950592,2019-10-17 13:48:26,"Beed and Satara have showered me with immense affection! 

Today’s rallies in these two places were memorable. Elaborated on the good governance efforts of the NDA in Maharashtra. 

Except corruption and mockery, Congress-NCP have nothing to offer to the people. https://t.co/7yMO61NJMK",1779
1184827302577729539,2019-10-17 13:43:36,"हमने अपनी कार्यशक्ति के दम पर, जमीन पर जनहित-जनकल्याण के कार्यक्रम उतारे और कांग्रेस-एनसीपी अपनी स्वार्थशक्ति की वजह से उसका मजाक उड़ाती रही। हर योजना, हर फैसले की आलोचना करती रही। https://t.co/2zQBky8WU9",1747
1184826829015699457,2019-10-17 13:41:43,"आज जब बीड आया हूं तो मुझे मेरे मित्र गोपीनाथ मुंडे जी की बहुत याद आई। 

चाहे कनेक्टिविटी हो या पर्यटन को बढ़ावा देने की बात हो, हम उनके सपनों को पूरा कर रहे हैं। https://t.co/48YX7pR6Mf",2548
1184825699766435842,2019-10-17 13:37:14,"बीते 5 वर्ष अगर घर, गैस, बिजली, शौचालय जैसी व्यवस्था के लिए थे, तो आने वाले 5 वर्षों का सबसे बड़ा संकल्प हमने पानी का लिया है। हर घर जल पहुंचाने के निश्चय के साथ हम काम कर रहे हैं। https://t.co/a6LDCsAFuE",2766
1184813537316634625,2019-10-17 12:48:54,Euphoric atmosphere here in Pune. Watch my speech. https://t.co/0aqGrxCWsP,2313
1184779953750986752,2019-10-17 10:35:27,We are working tirelessly to fulfil the dreams of Shivaji Maharaj. Watch from Satara. https://t.co/dZm6XO9tfq,2850
1184725538172092416,2019-10-17 06:59:14,The bond between Beed and BJP can never be broken! Watch from Parli. https://t.co/d1kA2xjHVu,2389
1184716196865806341,2019-10-17 06:22:06,أشعر بالقلق إزاء خبر حادث حافلة قرب مكة في المملكة العربية السعودية. أقدم واجب العزاء لأسر الذين فقدوا حياتهم. وأدعو الشفاء العاجل للجرحى.,622
1184676930441940992,2019-10-17 03:46:05,"Extremely adorable! 

Do convey my blessings to young Nihal. Wishing him the very best, in whatever he seeks to do. I am also sure he will find an amazing mentor and guide in you, @GulPanag. https://t.co/CQN5hMPg7Z",4188
1184672410836054017,2019-10-17 03:28:07,Anguished by the news of a bus crash near Mecca in Saudi Arabia. Condolences to the families of those who lost their lives. Praying for a quick recovery of the injured.,2766
1184486477377327104,2019-10-16 15:09:17,"Congress and NCP gave a free hand to the real estate mafia. The NDA has always protected those who suffered due to this mafia. 

हमारी नीति स्पष्ट है- माफिया को माफ नहीं, बल्कि माफियागीरी साफ कर दी जाएगी। https://t.co/9izX6E2L93",3484
1184486251694419968,2019-10-16 15:08:23,Harnessing the blue economy for Maharashtra‘s and India’s progress. https://t.co/I8ibnNXsFA,1640
1184485736411566080,2019-10-16 15:06:20,"Thank you Panvel! Today’s rally was excellent, with people from all walks of life joining the programme. https://t.co/vSzxFhU5Ft",2158
1184453012409839616,2019-10-16 12:56:18,"Different places, same spirit, same vibrancy! 

Have a look at these pictures from today’s rallies in Akola and Jalna. 

The corruption of Congress and NCP continues to haunt. People are in no mood to vote for those who have misused public money. 

Maharashtra wants NDA again! https://t.co/0sb0m3VGxz",1679
1184451925627957249,2019-10-16 12:51:59,"भाजपा और महायुति की सरकार ने जो भी योजनाएं बनाई हैं, वो सर्वव्यापी हैं, सर्वसमावेशी हैं, सबका भला करने वाली हैं। https://t.co/czDkSATEuh",1902
1184451533666050049,2019-10-16 12:50:26,"हमारा सपना - सूखामुक्त भारत, सूखामुक्त जालना। https://t.co/iVSKFDYygj",1901
1184451194690785280,2019-10-16 12:49:05,"मराठवाड़ा से कांग्रेस के कई मुख्यमंत्री हुए, लेकिन पार्टी ने हमेशा इस क्षेत्र को उपेक्षित रखा। 

यह एनडीए है, जिसने इस क्षेत्र में इन्फ्रास्ट्रक्चर का विकास किया है। https://t.co/bPKqADPZnG",1481
1184450979569131520,2019-10-16 12:48:14,Congress finally admits- it needs lessons in nationalism! https://t.co/nKqGRV683b,2660
1184425077116260352,2019-10-16 11:05:18,Top INC-NCP leaders are going to be defeated! People want NDA again. Watch from Panvel. https://t.co/Pg94tkLUs2,2450
1184376974308855808,2019-10-16 07:54:09,People in Jalna are happy with the work of the NDA Government. They’ll vote for us again! Watch. https://t.co/FZkeBmtyrk,2254
1184347039045308421,2019-10-16 05:55:12,Come to Akola to see the wide support for BJP! https://t.co/ZJYrotIr1L,2872
1184297661987471360,2019-10-16 02:39:00,"ଓଡିଶାର ମୁଖ୍ୟମନ୍ତ୍ରୀ ଶ୍ରୀ ନବୀନ ପଟ୍ଟନାୟକଜୀଙ୍କୁ  ଜନ୍ମ ଦିନର ଶୁଭେଚ୍ଛା । ତାଙ୍କର ଦୀର୍ଘ ଓ ନିରାମୟ ଜୀବନ କାମନା କରୁଛି ।

Greetings to Odisha’s CM Shri Naveen Patnaik Ji on his birthday. May he be blessed with a long and healthy life. @Naveen_Odisha",2109
1184126249356054531,2019-10-15 15:17:52,"स्वरोजगार को बढ़ावा देने के लिए सरकार हर प्रयास कर रही है। इसकी वजह से, विशेष तौर पर टूरिज्म के क्षेत्र में युवाओं के लिए बहुत अवसर बन रहे हैं। https://t.co/HlHE5UoRTr",2070
1184126210189611009,2019-10-15 15:17:43,"राष्ट्रहित में, हरियाणा के हित में जो भी उचित होगा, उसके लिए हम डंके की चोट पर फैसले लेंगे। https://t.co/3Okaa1GzQG",1951
1184126161820864512,2019-10-15 15:17:31,"जब-जब, जिस-जिस बात को लेकर देश खुश होता है, उस-उस बात को लेकर कांग्रेस के नेताओं को तकलीफ होने लगती है। https://t.co/Z6359t1zAy",4204
1184126115767410688,2019-10-15 15:17:20,"Through the power of their vote, the people of Haryana will give a befitting reply to Congress for giving priority to petty politics over national interest. https://t.co/Pdh1T8E7uq",2390
1184125857968709632,2019-10-15 15:16:19,"Haryana's Nari Shakti is excelling in all fields.

The Central Government and Haryana Government are undertaking numerous efforts to further empowerment of women. https://t.co/4I2Ub9whZ6",1558
1184125611062620160,2019-10-15 15:15:20,"Campaigned in Dadri and Kurukshetra. 

These pictures indicate the strong support for @BJP4Haryana. 

People from all sections of society are supporting the development agenda of our Party. https://t.co/TytzjGTxNx",1426
1184037737977896961,2019-10-15 09:26:09,Speaking in Kurukshetra. Watch my speech. https://t.co/WP4yQh7jqk,2478
1184005765377351680,2019-10-15 07:19:06,The mood in Haryana favours BJP’s development agenda. Watch from Dadri. https://t.co/fhuFkvBmVz,2594
1183939030594908167,2019-10-15 02:53:56,"This month’s #MannKiBaat will take place on 27th October, which is also the day of Diwali. 

Share your inputs for the programme. Dial 1800-11-7800, write on the NaMo App or on the MyGov Open Forum! 

https://t.co/iQUpDOtGCf https://t.co/B4pwYJlQQd",1840
1183938244917915648,2019-10-15 02:50:48,"An important milestone in the journey of creating a healthy India!

It would make every Indian proud that in a year, over 50 lakh citizens have benefited from free of cost treatment thanks to Ayushman Bharat. Apart from curing, this scheme is empowering several Indians. https://t.co/0aNb6VkmMh",2209
1183937639579152384,2019-10-15 02:48:24,Birthday wishes to @DrMNPandeyMP Ji. He is working tirelessly to enhance skill development opportunities for India’s youth. May he be blessed with good health and a long life in service of the nation.,1330
1183937479843307521,2019-10-15 02:47:46,"Greetings to @naqvimukhtar Ji on his birthday. Naqvi Ji has always been a hardworking leader, who has served the Party and Government in various capacities. His passion towards empowering the poor and furthering social harmony is remarkable. Praying for his long and healthy life.",1585
1183937250750418944,2019-10-15 02:46:51,"डॉ. एपीजे अब्दुल कलाम जी को उनकी जयंती पर विनम्र श्रद्धांजलि। उन्होंने 21वीं सदी के सक्षम और समर्थ भारत का सपना देखा और इस दिशा में अपना विशिष्ट योगदान दिया। उनका आदर्श जीवन देशवासियों को सदैव प्रेरित करता रहेगा।

India salutes Dr. APJ Abdul Kalam Ji on his Jayanti. https://t.co/PPgPrkqQRG",6544
1183787402390691840,2019-10-14 16:51:25,"Earlier today, had a very good meeting with King Willem-Alexander and Queen Maxima of the Netherlands. We had extensive talks on ways to expand bilateral cooperation between our nations. https://t.co/QzOuAAHfCE",2829
1183759244346048512,2019-10-14 14:59:31,"हरियाणा में सरकारी भर्ती का मतलब पहले होता था- रिश्वतखोरी और युवाओं से लूट। नौकरियों के लिए जितने तरह के खेल होते थे, उसने कई नेताओं को जेल तक पहुंचाया है।

ये स्थिति अब बदल चुकी है।

5 साल पहले तक जो खर्ची और पर्ची का कल्चर बदनामी का कारण बनता था, उस पर लगाम लगाई गई है। https://t.co/140Najnw2g",3139
1183758924035395584,2019-10-14 14:58:15,"देश की राय साफ है। अब सिर्फ विरोध और प्रतिरोध की राजनीति नहीं चलेगी।

विकास की राजनीति ही जनता की पसंद है। https://t.co/uKux9SN5kD",2451
1183758857517944832,2019-10-14 14:57:59,आर्टिकल 370 के कारण दलितों के साथ अन्याय हो रहा था। https://t.co/RyrzBhXr62,2219
1183758333242560512,2019-10-14 14:55:54,"कुछ लोग आर्टिकल 370 के फैसले पर सवाल उठा रहे हैं, विदेशों में जाकर मदद मांग रहे हैं।

अगर उनको आर्टिकल 370 और 35 A से इतना ही मोह है, तो हरियाणा की जनता के सामने आकर इसे स्वीकारते क्यों नहीं? https://t.co/YOuicIQh1s",2628
1183758127071498241,2019-10-14 14:55:05,"Five years ago, the Congress mocked us and asked- who is your captain in Haryana. 

Today, we not only have a captain but also a very strong team.

Meanwhile, Congress is busy in politics of self-interest instead of thinking about Haryana’s interests. https://t.co/sarDnjZYt0",2058
1183740424365707264,2019-10-14 13:44:44,I also congratulate Esther Duflo and Michael Kremer for wining the prestigious Nobel.,1757
1183740421568172034,2019-10-14 13:44:43,Congratulations to Abhijit Banerjee on being conferred the 2019 Sveriges Riksbank Prize in Economic Sciences in Memory of Alfred Nobel. He has made notable contributions in the field of poverty alleviation.,5221
1183691246113419265,2019-10-14 10:29:19,Haryana supports BJP’s development agenda. Watch from Ballabhgarh. https://t.co/iW6ZikirWI,2749
1183432116501004288,2019-10-13 17:19:38,"विपक्ष को चुनौती है कि यदि हिम्मत है तो स्पष्टता के साथ देश के सामने आए और अपने घोषणापत्र में ये ऐलान करे कि वो एक बार फिर जम्मू-कश्मीर और लद्दाख में आर्टिकल 370 को लागू करेंगे।

अगर आप ये कर सकते हैं तो हिम्मत दिखाइए, वरना घड़ियाली आंसू बहाना बंद कर, देश के साथ खड़े हो जाइए। https://t.co/pXHemJCMzk",7597
1183429821352697856,2019-10-13 17:10:31,"आज नया भारत ठान चुका है कि उसे अतीत के अनावश्यक बंधनों में बंधकर नहीं रहना है।

आज नया भारत अपने वर्तमान को मजबूत तो कर ही रहा है, खुद को भविष्य के लिए भी तैयार कर रहा है।

5 अगस्त को भाजपा-एनडीए सरकार ने एक अभूतपूर्व फैसला लिया, जिसके बारे में सोचना तक पहले असंभव लगता था। https://t.co/MFbpDLECl8",3593
1183429245105655808,2019-10-13 17:08:13,"हमारा संकल्प किसानों के साथ-साथ आदिवासी समाज, श्रमिकों और छोटे दुकानदारों एवं कारोबारियों के लिए भी है।

इनके लिए 60 वर्ष की आयु के बाद पेंशन की सुविधा शुरू की गई है।

वहीं, आदिवासी क्षेत्रों के विकास के लिए सड़क, स्कूल, स्वास्थ्य और स्वरोजगार पर तेजी से काम चल रहा है। https://t.co/GEsF1P1erF",1984
1183428924086222849,2019-10-13 17:06:57,"जल संपदा के संरक्षण और निर्माण की गति तेज करने के लिए हमने अब दो और बड़े कदम उठाए हैं।

पहला, पानी से जुड़े सभी विभाग अब जल शक्ति मंत्रालय के तहत लाए गए हैं।

दूसरा, सरकार बनते ही हमने जल जीवन मिशन शुरू कर दिया। https://t.co/ZBdpZnrKvC",2200
1183428448464719874,2019-10-13 17:05:03,"चाहे गरीबों के घर या शौचालय का निर्माण हो, एलपीजी गैस कनेक्शन हो, बिजली कनेक्शन हो, गरीबों का मुफ्त इलाज हो, हर परिवार का बैंक खाता हो, इन तमाम योजनाओं के केंद्र में आज ‘गरीब’ है, सामान्य जन है।

यही भावना बाबासाहेब भीमराव अम्बेडकर की थी, संत तुकाराम और संत संताजी महाराज की थी। https://t.co/HC7d5QrxV0",2416
1183427553710657538,2019-10-13 17:01:30,"आज हमारी हर नीति, हर रणनीति- जनकल्याण से राष्ट्रकल्याण की है।

जन अभियान से राष्ट्रनिर्माण की है। 

आज देश उस रास्ते को पीछे छोड़ आया है, जहां सिर्फ क्षेत्र, वर्ग और समुदाय के आधार पर योजनाएं बनती थीं। https://t.co/qflaDtQCto",2475
1183318021692985344,2019-10-13 09:46:16,Addressing a rally in Sakoli. Watch. https://t.co/SZ1fKtxOun,2256
