id,created_at,text,retweet_count
1221452664162017280,2020-01-26 15:19:43,"Rise of the people’s Padma!

Celebrating unsung heroes and outstanding achievements of those working at the grassroots to transform the lives of 130 crore Indians. #MannKiBaat https://t.co/zrL9bzlWv4",2696
1221452377028382722,2020-01-26 15:18:34,"For almost 25 years, thousands of people belonging to the Bru-Reang community had to live in uncomfortable and inhuman conditions. Governments came and went but their plight did not improve.

This month, a historic accord was signed that gives them dignity and development. https://t.co/r5TRhmKpTB",2878
1221451719093047296,2020-01-26 15:15:57,"During #MannKiBaat today, I thanked the people of Assam. Here is why... https://t.co/2tLGI9ffn5",1977
1221451597428883456,2020-01-26 15:15:28,"Let us celebrate those who work towards water conservation. 

Use #JalShakti4India and share efforts towards conserving water. #MannKiBaat https://t.co/e5kCrkBW8T",2215
1221451352603164673,2020-01-26 15:14:30,When I first read the ‘#MannKiBaat Charter’ I was happy. It showed how an avid listener has brilliantly encapsulated the essence of ‘Mann Ki Baat’ including its power to drive positive social transformations. https://t.co/nxVM1u5IZo,2249
1221410024389369857,2020-01-26 12:30:17,2020’s first #MannKiBaat. Tune in. https://t.co/THsN1jZl1K,4389
1221370845966295040,2020-01-26 09:54:36,"This morning, on #RepublicDay, paid homage at the National War Memorial.

India will always be grateful to the brave men and women who sacrificed their lives in service of the nation.

Their exemplary service motivates crores of Indians. https://t.co/zamzvldKKi",3986
1221367815111835648,2020-01-26 09:42:33,Some more glimpses from Rajpath today. #RepublicDay https://t.co/qIdn9JsuHU,3235
1221367389125738496,2020-01-26 09:40:52,"India’s diversity strengthens us.

We are proud that so many cultures live happily in India.

We saw some glimpses of India’s diversity during the #RepublicDay Parade today. https://t.co/N70mS2kAIX",5222
1221366631462506496,2020-01-26 09:37:51,"On #RepublicDay, we see glimpses of India’s military and security prowess. 

Our forces are among the most professional and talented in the world. 

In addition to protecting the nation, their role in assisting people during humanitarian crisis is also noteworthy. https://t.co/wjTHbrUXEd",3497
1221365719297875968,2020-01-26 09:34:14,"Here are some glimpses from the #RepublicDay Parade.

This is a day to remember the remarkable individuals who gave us a comprehensive Constitution that ensures the well-being of 130 crore Indians. https://t.co/JTzKzn0Gxx",3208
1221351677887836160,2020-01-26 08:38:26,"Thank you the greetings on India’s #RepublicDay, President @ibusolih. 

It is a matter of immense delight that friendship between India and Maldives is getting even stronger, benefitting the people of our nations. https://t.co/uLBTDy81iM",2271
1221351425227145216,2020-01-26 08:37:26,"Thank you PM Mahinda Rajapaksa for the #RepublicDay wishes. 

India cherishes the deep rooted friendship with Sri Lanka. @PresRajapaksa https://t.co/qrNKY3e4dc",2138
1221246732249358336,2020-01-26 01:41:25,"Wishing everyone a happy #RepublicDay. 

सभी देशवासियों को गणतंत्र दिवस की बहुत-बहुत बधाई। 

जय हिंद!",21981
1221095895816720386,2020-01-25 15:42:03,"Congratulations to all those who have been conferred the Padma Awards. The awardees include extraordinary individuals who have made exceptional contributions to our society, nation and humanity. 

https://t.co/POdpBsPtq4",7178
1221058382536290305,2020-01-25 13:12:59,"2020’s first #MannKiBaat will take place tomorrow, on Republic Day. 

Keeping in mind the Republic Day celebrations in the morning, the ‘Mann Ki Baat’ will take place at 6 PM. https://t.co/9O4dVMnvp1",3524
1221055785284882432,2020-01-25 13:02:39,"Apart from robust bilateral cooperation, India and Brazil are also working together at various multilateral forums. We see immense synergies on various issues including the need to uproot the menace of terrorism. 

India and Brazil will keep working together for a better planet. https://t.co/YukXFug6zN",3999
1221055420825055232,2020-01-25 13:01:13,"Today’s talks with President @jairbolsonaro covered sectors such as energy, healthcare, technology, animal husbandry and more. 

India and Brazil are focusing on expanding cooperation in the defence sector. https://t.co/L03F6aREsc",1890
1221054929177137152,2020-01-25 12:59:15,"Today’s meeting with President @jairbolsonaro is our third in the last eight months. 

This reflects the topmost priority we accord to further expanding India-Brazil ties. 

It is gladdening that President Bolsonaro has graced our Republic Day celebrations as the Chief Guest. https://t.co/lhObKbdgIr",2268
1221054444806295552,2020-01-25 12:57:20,"Além da forte cooperação bilateral, a Índia e o Brasil estão, também, trabalhando juntos em vários fóruns multilaterais. Nós vemos imensas sinergias em várias questões, incluindo na necessidade de eliminar ameaça de terrorismo. https://t.co/RNOIEeVFBA",1036
1221054425453809664,2020-01-25 12:57:15,"Hoje as conversas com o presidente @jairbolsonaro cobriram setores como: energia, saúde, tecnologia, pecuária e outros. 

A Índia e o Brasil estão focando na expansão da cooperação no setor de defesa.

A capacitação em setores como o de alimentos, também, foi discutida hoje. https://t.co/HorXSiMa82",1047
1221054410786332673,2020-01-25 12:57:12,Foi com alegria que o presidente Bolsonaro agraciou nossas celebrações do Dia da República como convidado principal.,367
1221054406075904002,2020-01-25 12:57:11,"Hoje a reunião com o presidente @jairbolsonaro é a nossa terceira dos últimos oito meses. 
Isso reflete a prioridade máxima que damos à futuras expansões dos laços Índia-Brasil. https://t.co/PlGJpnNmwC",2369
1220977064120999937,2020-01-25 07:49:51,Addressing the press with President @jairbolsonaro. Watch. https://t.co/4f4pJscRnq,3558
1220946467868696577,2020-01-25 05:48:16,"हिमाचल प्रदेश के सभी निवासियों को 50वें पूर्ण राज्यत्व दिवस की बहुत-बहुत बधाई। अपने गौरवशाली इतिहास, समृद्ध सांस्कृतिक विरासत और नैसर्गिक सुंदरता के लिए प्रसिद्ध यह राज्य विकास के नित नए मानदंड स्थापित करे और देश की समृद्धि में अपना बहुमूल्य योगदान यूं ही देता रहे।",3859
1220928198692655104,2020-01-25 04:35:40,"Greetings on National Voters Day. 

We express gratitude to ECI for their many efforts towards making our electoral process more vibrant and participative. 

May this day inspire us to work towards increased voter awareness and turnout, which makes our democracy stronger",4064
1220734831262302217,2020-01-24 15:47:18,भारत का मतलब है... https://t.co/UJTrNPnfZt,9278
1220734323915218947,2020-01-24 15:45:17,"The colours of India!

Delighted to interact with young friends from all over the nation. They would be taking part in the Republic Day programme. 

Spoke to them on a wide range of subjects. 

Here are some glimpses from the programme. https://t.co/itmNgrbd3B",2683
1220732281985228800,2020-01-24 15:37:10,उत्तर प्रदेश ने मुख्यमंत्री श्री योगी आदित्यनाथ जी के कुशल नेतृत्व में प्रगति के नए-नए आयाम स्थापित किए हैं। राज्य ने सभी क्षेत्रों में अभूतपूर्व उन्नति की है। मुझे विश्वास है कि आने वाले वर्षों में यह प्रदेश विकास का एक नया अध्याय लिखेगा। @myogiadityanath,1567
1220732277627318272,2020-01-24 15:37:09,"अध्यात्म, शिक्षा और कला-संस्कृति की विरासत से समृद्ध उत्तर प्रदेश के सभी लोगों को राज्य के स्थापना दिवस की बहुत-बहुत बधाई। मेरी कामना है कि यह राज्य इसी प्रकार विकास के पथ पर निरंतर अग्रसर रहे और न्यू इंडिया के निर्माण में अपना महत्वपूर्ण योगदान देता रहे।",3572
1220715045958623232,2020-01-24 14:28:41,"A warm welcome to President @jairbolsonaro! 

We are delighted to host him and we look forward to his taking part in our Republic Day celebrations. 

His visit will add strength to India-Brazil relations. https://t.co/Ir5xqBbeSe",2214
1220714601253351424,2020-01-24 14:26:55,"Calorosas boas-vindas ao presidente @jairbolsonaro! 

A Índia está feliz em recêbo-lo e nós esperamos ansiosamente por sua participação nas celebrações do Dia da República.

Sua visita reforçará as relações Brasil-Índia. https://t.co/nxrtJuWfQA",1629
1220713948363808769,2020-01-24 14:24:19,"Samanyu Pothuraju’s achievements in mountain climbing are extraordinary. Interacting with him, I got to know that he among the youngest to have conquered Mt. Kilimanjaro, which is Africa’s highest peak. Best wishes to him and may he keep scaling greater heights! https://t.co/gyYFl9o5al",1912
1220703661011144711,2020-01-24 13:43:27,"Tanish Goel personifies the spirit of hardwork, dedication and innovation. His passion towards saving lives is evident in his work. His efforts have been recognised internationally. 

May he keep innovating and realising his dreams! https://t.co/yihezKJJ95",1467
1220703397143359488,2020-01-24 13:42:24,"Suneetha Murje Prabhu is making a valuable contribution as far as lowering vector borne diseases in India is concerned. 

I congratulate her on winning the Bal Shakti Puraskar 2020 and wish her the very best for her future endeavours. https://t.co/n1MoK4Jzq2",1507
1220703083115708417,2020-01-24 13:41:09,"Sivabharathi Anbu Bharathi is doing excellent work in agriculture, particularly helping rice farmers. 

He has achieved breakthroughs in raising paddy seedlings. He has also innovated on ways to resolve rice pest infestation. 

Glad that he won the Bal Shakti Puraskar 2020. https://t.co/fbmlvdq2MT",1339
1220702837858013184,2020-01-24 13:40:10,"Saving people from floods and frauds….this is what Sagnik Anupam is passionate about.

He has effectively used technology to strengthen our disaster management capabilities. 

Congrats on being conferred the Bal Shakti Puraskar 2020. https://t.co/ceMDXFSFoP",1230
1220702473859608578,2020-01-24 13:38:43,Richard Joseph is amazing! He has provided an affordable and environment friendly solution to controlling pests. His work will help several of our hardworking farmers. I hope more youngsters take inspiration from Richard and innovate for the agriculture sector. https://t.co/h425d8QPsx,1427
1220702210797056002,2020-01-24 13:37:41,"Raghav Puri’s works include using AI to ensure better study of history as well as a project to help Alzheimer’s patients. 

And yes, he also has done great work in the aviation sector.

Proud of him! Delighted that he got the Bal Shakti Puraskar 2020. https://t.co/iT8cUSQfh0",1260
1220701933251579904,2020-01-24 13:36:35,"Parth Bansal is a compassionate innovator. He may have made the ‘Utility Stick’ for his grandmother but in the coming days, his work can benefit several people suffering from Parkinson’s. 

I am sure Parth will continue to work and innovate with the same energy. https://t.co/SpKmlyBqP9",1314
1220701387413213184,2020-01-24 13:34:24,"The fantastic Paritosh Dahiya has brought children and technology even more closer. 

He is a worthy recipient of the 2020 Bal Shakti Puraskar in the field of innovation. 

Congratulations to him! https://t.co/MXOn65Wez2",1276
1220700870876200963,2020-01-24 13:32:21,"My young friend Hridayeshwar Singh Bhati’s life journey motivates us all. 

He did not let setbacks deter him. His pioneering work makes chess even more popular among the youth. 

I hope he continues to innovate and ideate with the same zeal in the times to come. https://t.co/bKcaiw53lo",1465
1220700428268134407,2020-01-24 13:30:36,"Harnessing India’s sporting talent by leveraging the power of technology! 

Many budding footballers will thank Arjun Pandey for his innovative spirit. 

His work towards recognising sporting skills in rural India is commendable.

More power to him! https://t.co/1DGXXik4b6",1299
1220699825991307266,2020-01-24 13:28:12,"I am delighted that the very talented Harshita Arora has been conferred the Bal Shakti Puraskar 2020!

She has been focussing on a wide range of sectors. Her passion towards science, technology and human welfare are clearly visible. https://t.co/DgpZaXbViQ",1832
1220697838235136005,2020-01-24 13:20:18,"A wonderful fusion of innovation and safety of women, as well as concern towards welfare of children! 

Aparna Chandrasekharan’s efforts have received laurels both in India and overseas. 

Congratulations to her for getting the Bal Shakti Puraskar 2020. https://t.co/6NCBhAHvhd",1619
1220697456515723267,2020-01-24 13:18:47,"Kudos to my young friend Harsh Agrawal on being conferred the Bal Shakti Puraskar 2020. His pathbreaking work in the health sector will benefit several people in the times to come.

Best wishes to him for his future endeavours. https://t.co/m2uMFQY8rB",1240
1220697211731877890,2020-01-24 13:17:49,"Our Yuva Shakti is contributing towards a healthier India! 

Meet the dynamic Anmol Rathi, who has worked on an affordable way to enable early detection of pancreatic cancer. 

India salutes his innovative zeal. https://t.co/pdzvk0GEcR",1425
1220695455970971648,2020-01-24 13:10:50,"Can you imagine winning the Mathematics Genius Award, bagging gold medals at international Olympiads successively and representing your nation globally by the age of 14? That's what brilliant Yash Mishra has done. Congratulations Yash and all the best for the future. https://t.co/uKBnPHftiI",1806
1220695220364300289,2020-01-24 13:09:54,"Young Venkatasubramanian did not allow any barriers to hold his spirit back. He has won medals in national abacus competitions. He's also an active scout and an awarded Karate exponent. We are proud of you, Venkatasubramanian. Congrats on winning the Bal Puraskar. https://t.co/HxGfEfn2LH",1217
1220695025543049217,2020-01-24 13:09:08,"Be it English Olympiad, Geogenius Olympiad or Science Olypiad, young Siddharth Kumar Gopal excels in all of them. Such budding geniuses and their knowledge will be vital for India's growth in the 21st century. Congratulations Siddharth for winning the Bal Puraskar. https://t.co/2jKbDNm66b",1308
1220694832399581184,2020-01-24 13:08:22,"Meet Onkar Singh, who wrote ‘When The Time Stops’, a book on theoretical physics at a rather young age. Congratulations Onkar, on winning the Bal Puraskar. Keep writing... https://t.co/CqiO12IKxU",1500
1220694545232384000,2020-01-24 13:07:13,"Winning Hong Kong Mathematics Olympiad- check.

Topping the International Society for Olympiad's competitions- check.

Jennisha Sunil Agrawal makes it look easy but it certainly takes a lot of hardwork! 

Congratulations to this amazing Bal Puraskar awardee. https://t.co/2JOYIU2hCb",1315
1220694295717408769,2020-01-24 13:06:14,Youngsters like Devesh Pankaj Bhaiya are the reason for my optimism about India. He is just 12 and has already written an internationally acclaimed work on light pollution. He's also topped science Olympiads and competitions. I congratulate him on winning the Bal Puraskar. https://t.co/PeEH2WAP37,1631
1220693995606568967,2020-01-24 13:05:02,"Meet my friend Chirag Falor, a Bal Puraskar awardee. Winner of national and international math and science competitions, he represented India in the International Olympiad Award on Astronomy and Astrophysics. Chirag has a bright future ahead and I wish him success. https://t.co/B2YPdIsWb3",1392
1220693613853593600,2020-01-24 13:03:31,Sukriti Chiripal works with less privileged children in many cities through her NGO and encourages as well as helps them to educate themselves. She has used innovative means to provide books and stationery to needy children. I wish Sukriti the very best in her noble mission. https://t.co/92gGmweUgo,1479
1220693282956562433,2020-01-24 13:02:12,"When youthful energy meets social awareness and a zeal to do something meaningful, we get young leaders like Shaurya Sinha. His social venture connects Divyang sisters and brothers to corporate organisations and finds work opportunities for them. Very happy to meet you Shaurya. https://t.co/ggLYooCFSH",1362
1220692955217854465,2020-01-24 13:00:54,"Parth Sarthi has displayed immense persistence and compassion. Using technology, he has helped reunite many families with their missing children. My best wishes to Parth on all his future endeavours and on winning the Bal Shakti Puraskar. https://t.co/5ScWv3JQQl",1390
1220692712900321282,2020-01-24 12:59:56,"Youngsters like Parikul Bhardwaj are setting an example of leadership and selfless service towards society. As a student volunteer, she played a crucial role in saving the lives of 45 pilgrims during the Kedarnath Yatra. Delighted to meet Parikul and my best wishes to her. https://t.co/jSFodmvN61",1574
1220692321697554433,2020-01-24 12:58:23,"Meet the talented Yash Aradhya S from Karnataka, who has shown immense potential in the field of motorsports. In just seven years, he has won seven Championships, 59 races and even represented India at many international events. My best wishes for his future endeavours. https://t.co/jM0FQM8CzW",1376
1220692120219971585,2020-01-24 12:57:35,"Vinayak Bahadur’s exemplary skills in Badminton are an inspiration for many. I was impressed by his will-power, through which he overcame many challenges. Glad that he has been awarded the Bal Shakti Puraskar. https://t.co/OfqJWAbuK9",1151
1220691887947841536,2020-01-24 12:56:40,"Great to meet my young friend Sudipti Hajela, who hails from Madhya Pradesh. Her passion towards equestrian events is admirable. She has been practising since the age of six. May she continue to win many more laurels! https://t.co/qicuZrXh01",1237
1220691499379068928,2020-01-24 12:55:07,Delhi’s Sanchita Tiwari has made India proud on world stage. She is one of the recipients of Bal Shakti Puraskar this year for her exceptional achievements in archery. She was also the torch bearer at the Khelo India Youth Games in 2018. Many congratulations to her. https://t.co/qkfZMNxJC9,1247
1220690997841022977,2020-01-24 12:53:07,"Meet my young friend Rushil Khosla. At a young age of 13 years, he holds the Number 1 rank in Asia Tennis Federation in the under-14 category. Last year, he also won the under-12 Doubles National Championship. It was great to meet him. https://t.co/mkBCqjFaVi",1217
1220690554461155328,2020-01-24 12:51:22,"Haryana’s Prithu Gupta is a master at playing Chess. My young friend has made India proud at a world stage. At the age of 15, he bagged the Grand Master title, considered to be very prestigious. My best wishes to the passionate young man. https://t.co/YgtsN0Sm2Y",1342
1220690251892396033,2020-01-24 12:50:10,"Skiff sailing is not known to many. It is heart-warming to see Pearl Milind Colvalcar excel in this unique area. Interacting with her, I got to know that she has also won the “Youngest Sailor” Award at a sailing event in Hyderabad. https://t.co/TEgUFhXEFz",1210
1220689930197692417,2020-01-24 12:48:53,"Neha, my young friend from Haryana is an ace boxer. She has made India proud at the global stage. Many congratulations to her on being awarded the Bal Shakti Puraskar 2020 in the field of sports.

Best wishes to her for her future endeavours. https://t.co/sRSJOdNdtV",1382
1220689536918773762,2020-01-24 12:47:19,"It gave me immense joy to interact with Khushi Hooda, who hails from Haryana. Her commitment to excel at Golf at such a young age is worthy of praise. https://t.co/HyMa5fq7y9",1341
1220689205031927809,2020-01-24 12:46:00,"I congratulate Esha Singh on her phenomenal achievement. She is the youngest national record holder in 10 Meter Air Pistol Shooting, which is an extraordinary feat. https://t.co/lXvpPvNslL",1482
1220688801183330306,2020-01-24 12:44:24,"Met Pema, a great exhibit of selfless bravery in the face of adversity. She helped save lives when the boundary wall of her school collapsed amidst landslides without caring for her own life. https://t.co/b3oDsVrPJn",1412
1220687968999882752,2020-01-24 12:41:05,"Akula Sai Samhitha has already won more than 60 medals in Skating! Not only this, she is also the youngest Indian girl to win a Gold Medal at the Asian Roller Skating Championship. Was very happy to meet this brilliant youngster. https://t.co/IhJEwcy7gA",1300
1220687648756355074,2020-01-24 12:39:49,"Was happy to meet Aarushi Sharma who has already made a name for herself at such a young age with her accomplishments in badminton. From winning multiple medals in the National Games to winning a medal for India at Asia Pacific Youth championship, Aarushi has always excelled! https://t.co/q6Cat8f4ue",1406
1220686875217678336,2020-01-24 12:36:44,Was very happy to meet Soumyadip Jana. His act of valour will inspire everyone. Young Soumyadip fought and resisted armed terrorists and protected his mother &amp; sister. He suffered grave injuries but his spirit remains strong. https://t.co/IfQkZpmmro,1963
1220686625530732545,2020-01-24 12:35:45,Was wonderful to meet young Lalkansung. He showed tremendous bravery when he fearlessly dived in the pond and rescued girls from drowning. https://t.co/HlI2Xn3Aj8,1499
1220686493531832320,2020-01-24 12:35:13,Ishaan Sharma not only showed indomitable courage but also showed the spirit of ‘Atithi Devo Bhava’ in action when he saved the life of a Russian tourist from robbers. He also ensured that the robbers were caught within 24 hours. Was good meeting the brave Ishaan! https://t.co/q6UMITJhnQ,1406
1220685560437567495,2020-01-24 12:31:31,"It was a joyful occasion today when I met Pragun Pudukoli today, who at such a young age is already acknowledged as a prolific writer with a passion for science, environment and nature. We look forward to reading more from his pen in the years to come. https://t.co/TWZOMpKpds",1579
1220684044226068482,2020-01-24 12:25:30,I was overjoyed to meet the young budding painter Riya Jain today. Riya has already won global recognition for her work and we wish her all success in the years to come. https://t.co/1OZ3WDIYnW,1446
1220683948138696710,2020-01-24 12:25:07,"It gave me immense happiness to meet young dance maestro Korok Biswas today. He has never let adversity come in the way of his dedication towards the performing arts, especially Indian classical dance. I wish him good health and further successes in the years to come. https://t.co/XlPCL2DftG",1370
1220683865468985344,2020-01-24 12:24:47,It was a pleasure to meet Gauri Mishra today who enjoys the honour of being among the youngest pianists of India. I pray to Almighty that you may continue to build on your excellence and earn further laurels for the country. https://t.co/iTH81Ya9Qf,1314
1220683722699075585,2020-01-24 12:24:13,"I am pleased to meet the young magician Darsh Malani today. Darsh, who has been creating magic across the world, has also shared the joys of magic with families of martyrs, including Kargil legends. We are proud of you. https://t.co/PqgZHsBmw0",1467
1220683593678114817,2020-01-24 12:23:42,"Saluting the young music maestro Manoj Atharva Kumar Lohar from Maharashtra. 

I wish him a long life and all success in his future musical endeavours as he builds on his skills with Tabla vadan. https://t.co/kGJ1I8UGkn",1931
1220679615309463552,2020-01-24 12:07:54,"Had a delightful interaction with those who have been awarded the Rashtriya Bal Puraskar, 2020.

India is proud of these youngsters! 

https://t.co/0Jnjv9PAvO",2847
1220664286856396800,2020-01-24 11:06:59,Interacting with those taking part in our Republic Day celebrations. Watch. https://t.co/YzHGg0yp2b,3791
1220584075821371393,2020-01-24 05:48:15,"Interacting with recipients of Rashtriya Bal Puraskar, 2020. Watch. https://t.co/aMwRIevyIf",4218
1220177983740219392,2020-01-23 02:54:35,"Tributes to the great Balasaheb Thackeray on his Jayanti. Courageous and indomitable, he never hesitated from raising issues of public welfare. He always remained proud of Indian ethos and values. He continues to inspire millions.",8492
1220177665203888128,2020-01-23 02:53:19,India will always remain grateful to Netaji Subhas Chandra Bose for his bravery and indelible contribution to resisting colonialism. He stood up for the progress and well-being of his fellow Indians. https://t.co/otUlFanULs,10456
1220176946044243971,2020-01-23 02:50:28,"On 23rd January 1897, Janakinath Bose wrote in his diary, “A son was born at midday.”

This son became a valorous freedom fighter and thinker who devoted his life towards one great cause- India’s freedom. 

I refer to Netaji Bose, who we proudly remember on his Jayanti today. https://t.co/wp3UjudKJ4",8214
