id,created_at,text,retweet_count
1158756092471418881,2019-08-06 15:05:55,"जम्मू कश्मीर कन्नै सरबंधत बिल्लें दा पास होना उनेंगी महान श्रद्धांजलि होग जिनें भारत दी एकता आस्तै कम्म कीता। डाक्टर भीम राव अम्बेडकर, जिन्दे दफा 370 बारै विचार सब्बै जानदे न, ते डाक्टर श्यामा प्रसाद मुखर्जी जिनें भारत दी एकता ते अखंडता आस्तै अपनी अपनी पूरी जिंदगी लाई दिती।",612
1158756090739249152,2019-08-06 15:05:55,लद्दाख दे लोकें गी खास मुमारखबाद। उन्दे आस्तै एह् बड़ी खुशी दा मुकाम ऐ जे उन्दी केन्द्र शासत प्रदेश बनाने दी चिरकी मंग पूरी होई ऐ। खुशहाली गी गति थ्होग ते विकास दियां बेहतर सुविधां यकीनी बनी सकङन।,582
1158756088960864256,2019-08-06 15:05:54,जम्मू-कश्मीर कन्नै सरबंधत बिल एकता ते सशक्तिकरण गी यकीनी बनाङन। एह् कदम जम्मू-कश्मीर दे नौजवानें गी मुक्ख धारा च लेइयै औग ते उनेंगी अपना हुनर ते योग्यता दस्सने दे बेशुमार मौके उपलब्ध कराग। मुकामी अधारभूत संरचना च सार्थक सुधार होग।,556
1158756087018864641,2019-08-06 15:05:54,"मैं जम्मू-कश्मीर दे भैनें ते भ्राएं गी उन्दी हिम्मत ते संकल्प लेई सलाम करना। केइएं स्वार्थी दलें, केइएं बरें लेई भावनात्मक ब्लैकमेल कीता, कदें बी लोकें दे सशक्तिकरण आस्तै नेईं सोचेआ। जम्मू-कश्मीर हुन उन्दे चंगुल थमां मुक्त होई गेया ऐ। इक नमां सवेरा, बेहतर कल इंतजार करारदा ऐ।",693
1158756085253074947,2019-08-06 15:05:54,"अस किट्ठे आं तां ऐं, किट्ठे होइयै इक सौ 30 करोड़ भारतवासियें दे सुखनें गी पूरे करगे।

साढ़े संसदीय लोकतंत्र दा इक ऐतिहासिक मौका, जित्थै जम्मू कश्मीर कन्नै सरबंधत महत्वै आले बिल मते समर्थन कन्नै पास करी लैते गे न।

इस कारण जम्मू कश्मीर गी फायदे होंगन।",4136
1158755491209568256,2019-08-06 15:03:32,ہمارے وزیر داخلہ @AmitShah لگاتار اس امر کو یقینی بنانے کے لئے کوشاں رہے ہیں کہ جموں و کشمیر کے عوام کے لئے بہتر حالات زندگی فراہم کرائے جا سکیں۔ ان کی عہدبستگی اور جانفشانی ان بلوں کی منظوری سے ظاہر ہے۔ میں بطور خاص امت بھائی کو مبارکباد پیش کرنا چاہوں گا۔,1442
1158755489175334914,2019-08-06 15:03:31,نائب صدر جمہوریہ ہند اور راجیہ سبھاکے چیئر مین @MVenkaiahNaidu Garu اور اسپیکر @ombirlakota Ji نے دونوں ایوانوں میں عمدہ طریقے سے کاروائی چلائی، اس کے لئے وہ پورے ملک کی جانب سے ستائش کے حقدار ہیں۔,1360
1158755486759436288,2019-08-06 15:03:31,جموں و کشمیر کے عوام اس امر پر فخر کا احساس کریں گے کہ اراکین پارلیمنٹ نے اپنے اختلافات فراموش کرکے جموں و کشمیر کے خاکے پر کھل کر مباحثے میں حصہ لیا اور امن، ترقی اور خوشحالی کو یقینی بنانے میں دلچسپی لی۔,494
1158755484611911683,2019-08-06 15:03:30,اس کے لئے میں تمام اراکین پارلیمنٹ، مختلف النوع سیاسی پارٹیوں اور ان کے قائدین کو مبارکباد پیش کرتا ہوں۔,415
1158755482741329926,2019-08-06 15:03:30,پارلیمنٹ میں سیاسی پارٹیوں نے اس موقع پر اپنی بیداری کا ثبوت پیش کرتے ہوئے اپنی حمایت دی، نظریاتی اختلافات کو فراموش کرکے مالا مال بحث میں حصہ لیا جس نے ہماری پارلیمانی جمہوریت کے وقار میں اضافہ کیا ہے۔,403
1158755481147416581,2019-08-06 15:03:29,اور ڈاکٹر ایس پی مکھرجی جنہوں نے اپنی پوری زندگی بھارت کے اتحاد اور سالمیت کے لئے وقف کر دی تھی۔,393
1158755479398449152,2019-08-06 15:03:29,جموں و کشمیر سے متعلق کلیدی بلوں کی منظوری عظیم  المرتبت سردار پٹیل کو معقول ترین خراج عقیدت ہے جنہوں نے بھارت کے اتحاد کے لئے کام کیا ہے۔ ڈاکٹر بابا صاحب امبیڈکر جن کے آرٹیکل 370 کے بارے میں خیالات سے سب واقف ہیں,387
1158755477552951296,2019-08-06 15:03:29,لداخ کے عوام کو خصوصی مبارکباد! یہ بات از حد مسرت کی ہے کہ  مرکز کا زیر انتظام علاقہ قرار دیے جانے کا ان کا دیرینہ مطالبہ پایۂ تکمیل کو پہنچا ہے۔ یہ فیصلہ ان کے خطے کی مجموعی خوشحالی کو مہمیز کرے گا اور بہتر ترقیاتی سہولتوں کو یقینی بنائے گا۔,385
1158755475820691461,2019-08-06 15:03:28,جموں و کشمیر سے متعلق بل اتحاد  اور اختیار کاری کو یقینی بنائیں گے۔ یہ اقدامات جموں و کشمیر کے نوجوانوں کو قومی دھارے میں لائیں گے اور انہیں اپنی ہنر مندی اور صلاحیت کا مظاہرہ کرنے کے وسیع مواقع فراہم کریں گے۔ مقامی بنیادی ڈھانچے میں اہم اصلاح رونما ہو گی۔,403
1158755474059038721,2019-08-06 15:03:28,میں جموں و کشمیر کے اپنے بھائی بہنوں کو ان کی جرأت اور وسیع النظری کے لئے سلام کرتا ہوں۔ برسوں سے مفاد پرست گروپ جو جذباتی بلیک میلنگ میں یقین رکھتے تھے، انہوں نے عوام کو بااختیار بنانے کی کبھی پرواہ  نہیں کی۔ جموں و کشمیر اب ان بیڑیوں سے آزاد ہو چکا ہے۔,484
1158755472372932608,2019-08-06 15:03:27,ہم ایک ساتھ ہیں، ہم ایک ساتھ اٹھیں گے اور ہم ایک ساتھ مل کر 130 کروڑ ہندوستانیوں کے خوابوں کو شرمندہ ٔ تعبیر کریں گے! ہماری پارلیمانی جمہوریت میں ایک یادگار لمحہ، جب جموں و کشمیر سے متعلق سنگ میل بل زبردست حمایت کے ساتھ منظور ہوئے ہیں۔ جموں و کشمیر کو اس سے فائدہ پہنچے گا۔,2694
1158752872986640387,2019-08-06 14:53:08,हमारे गृह मंत्री @AmitShah जम्मू-कश्मीर और लद्दाख के लोगों के बेहतर जीवन को सुनिश्चित करने के लिए निरंतर कार्य कर रहे हैं। उनके समर्पण और अथक प्रयासों से ही इन विधेयकों का पारित होना संभव हो पाया है। इसके लिए मैं अमित भाई को विशेष बधाई देता हूं!,7932
1158752800030908418,2019-08-06 14:52:50,"देश के उपराष्ट्रपति और राज्यसभा के चेयरमैन @MVenkaiahNaidu गारू और लोकसभा के स्पीकर @ombirlakota जी ने अपने-अपने सदन में जिस प्रकार से कार्यवाही का प्रभावी संचालन किया, उसके लिए मैं उन्हें पूरे देश की ओर से बधाई देता हूं।",3954
1158752611069124608,2019-08-06 14:52:05,"जम्मू-कश्मीर और लद्दाख के लोगों को गर्व होगा कि सांसदों ने वैचारिक मतभेदों को भुलाकर उनके भविष्य को लेकर चर्चा की। साथ ही साथ वहां शांति, प्रगति और समृद्धि की राह सुनिश्चित की। RS में 125:61 और LS में 370:70 का विशाल बहुमत इस फैसले के प्रति भारी समर्थन को दिखाता है।",5351
1158752514734297089,2019-08-06 14:51:42,"संसद में जिस प्रकार विभिन्न पार्टियों ने दलगत राजनीति से ऊपर उठकर और वैचारिक मतभेदों को भुलाकर सार्थक चर्चा की, उसने हमारे संसदीय लोकतंत्र की गरिमा को बढ़ाने का काम किया है। इसके लिए मैं सभी सांसदों, राजनीतिक दलों और उनके नेताओं को बधाई देता हूं।",4011
1158752469582659584,2019-08-06 14:51:31,"इन विधेयकों का पारित होना देश के कई महान नेताओं को सच्ची श्रद्धांजलि है: सरदार पटेल, जो देश की एकता के लिए समर्पित थे; बाबासाहेब अम्बेडकर, जिनके विचार सर्वविदित हैं; डॉ. श्यामा प्रसाद मुखर्जी, जिन्होंने भारत की एकता और अखंडता के लिए अपना जीवन समर्पित कर दिया।",4839
1158752357682839552,2019-08-06 14:51:05,लद्दाख के लोगों को विशेष रूप से बधाई! मुझे इस बात की बेहद खुशी है कि केंद्र शासित प्रदेश घोषित करने की उनकी दशकों पुरानी मांग आज पूरी हो गई है। इस फैसले से लद्दाख के विकास को अभूतपूर्व बल मिलेगा। लोगों के जीवन में समृद्धि और खुशहाली आएगी।,4540
1158752316712878081,2019-08-06 14:50:55,"ये कदम जम्मू-कश्मीर और लद्दाख के युवाओं को मुख्यधारा में लाएंगे, साथ ही उन्हें उनके कौशल और प्रतिभा को प्रदर्शित करने के अनगिनत अवसर प्रदान करेंगे। इससे वहां के इन्फ्रास्ट्रक्चर में सुधार होगा, व्यापार-उद्योग को बढ़ावा मिलेगा, रोजगार के नए अवसर बनेंगे और आपसी दूरियां मिटेंगी।",3770
1158752090522435584,2019-08-06 14:50:01,"मैं जम्मू-कश्मीर की बहनों और भाइयों के साहस और जज्बे को सलाम करता हूं। वर्षों तक कुछ स्वार्थी तत्वों ने इमोशनल ब्लैकमेलिंग का काम किया, लोगों को गुमराह किया और विकास की अनदेखी की। जम्मू-कश्मीर और लद्दाख अब ऐसे लोगों के चंगुल से आजाद है। एक नई सुबह, एक बेहतर कल के लिए तैयार है!",6260
1158752019378667520,2019-08-06 14:49:44,"ऐतिहासिक क्षण। एकता और अखंडता के लिए सारा देश एकजुट। जय हिंद!
 
हमारे संसदीय लोकतंत्र के लिए यह एक गौरव का क्षण है, जहां जम्मू-कश्मीर से जुड़े ऐतिहासिक बिल भारी समर्थन से पारित किए गए हैं।",9540
1158750396275257345,2019-08-06 14:43:17,"Our Home Minister @AmitShah Ji has  been continuously working towards ensuring a better life for the people of Jammu, Kashmir and Ladakh. His commitment and diligence is clearly visible in the passage of these Bills. I would like to specially congratulate Amit Bhai! @HMOIndia",7560
1158750184139964416,2019-08-06 14:42:27,"India’s Vice President and Chairman of the Rajya Sabha, @MVenkaiahNaidu Garu as well as Speaker @ombirlakota Ji conducted proceedings of both Houses in an excellent manner, for which they deserve praise from the entire nation. @VPSecretariat @loksabhaspeaker",3705
1158749758552301568,2019-08-06 14:40:45,"People of Jammu, Kashmir and Ladakh would be proud that MPs overcame differences and discussed the future of these regions as well as ensuring peace, progress and prosperity there. The widespread support can be clearly seen in the final numbers, 125:61 in RS and 370:70 in LS.",5017
1158749354322083840,2019-08-06 14:39:09,"In Parliament, political parties rose to the occasion, overcame ideological differences and took part in a rich debate that increased the pride of our Parliamentary democracy. For that, I congratulate all MPs, various political parties and their leaders.",4222
1158749223237505034,2019-08-06 14:38:37,"The passage of key Bills pertaining to Jammu, Kashmir and Ladakh are a fitting tribute to the great Sardar Patel, who worked for India’s unity, Dr. Babasaheb Ambedkar, whose views are well known and Dr. SP Mookerjee who devoted his life for India’s unity and integrity.",5222
1158748143736909827,2019-08-06 14:34:20,Special congratulations to the people of Ladakh! It is a matter of great joy that their long-standing demand of being declared a Union Territory has been fulfilled. This decision will give impetus to the overall prosperity of the region and ensure better developmental facilities.,5143
1158747985670336517,2019-08-06 14:33:42,"The Bills pertaining to Jammu, Kashmir and Ladakh will ensure integration and empowerment. These steps will bring the youth into the mainstream and give them innumerable opportunities to showcase their skills and talents. Local infrastructure will significantly improve.",4626
1158747764756365315,2019-08-06 14:32:50,"I salute my sisters and brothers of Jammu, Kashmir  and Ladakh for their courage and resilience. For years, vested interest groups who believed in emotional blackmail never cared for people’s empowerment. J&amp;K is now free from their shackles. A new dawn, better tomorrow awaits!",22937
1158747246717853696,2019-08-06 14:30:46,"Together we are, together we shall rise and together we will fulfil the dreams of 130 crore Indians!

A momentous occasion in our Parliamentary democracy, where landmark bills pertaining to Jammu and Kashmir have been passed with overwhelming support!",12120
1158703283327778816,2019-08-06 11:36:05,"My young friend, Jamyang Tsering Namgyal who is @MPLadakh delivered an outstanding speech in the Lok Sabha while discussing key bills on J&amp;K. He coherently presents the aspirations of our sisters and brothers from Ladakh. It is a must hear! https://t.co/XN8dGcTwx6",25682
1158383468927045632,2019-08-05 14:25:15,"Home Minister @AmitShah Ji’s speech in the Rajya Sabha was extensive and insightful. It accurately highlighted the monumental injustices of the past and coherently presented our vision for the sisters and brothers of J&amp;K. Do hear. 

https://t.co/ho7PPzyz5w",29443
1158030523639447552,2019-08-04 15:02:46,"Sharing some glimpses from the second day of the ‘Sansad Karyashala’ where once again we had productive discussions. 

Highlighted ways to strengthen our organisation and work for India’s progress with even greater vigour. https://t.co/FCzcNZMa1f",5825
1157952777932423168,2019-08-04 09:53:50,"תודה לך
מאחל יום חברות  שמח לאזרחי ישראל הנהדרים ולידידי הטוב 
@netanyahu

הודו וישראל הוכיחו את ידידותם לאורך הזמן. הקשר שלנו הוא חזק ונצחי. מאחל שהידידות בין המדינות שלנו תצמח ותפרח אף יותר בעתיד https://t.co/PsZTgMoXMU",8628
1157891199455375360,2019-08-04 05:49:09,ઘેરા દુઃખની લાગણી સાથે સદગતના આત્માની શાંતિ માટે અંતરમનથી પ્રાર્થના તથા શોકગ્રસ્ત પરિવાર અને એમના વાચકવર્ગને સાંત્વના.,2011
1157891196850774016,2019-08-04 05:49:08,જેમની કોલમ સવારને માહિતીસભર કરી દે એવા કટારલેખક અને પત્રકાર શ્રી કાંતિ ભટ્ટના  નિધનથી વાચક જગતને મોટી ખોટ પડી છે. એમણે જે વિપુલ પ્રમાણમાં લેખન કર્યું છે એનાથી વર્તમાન પત્રકારિતા અને વાંચતું ગુજરાત સમૃધ્ધ બન્યું છે.,2877
1157688625816956929,2019-08-03 16:24:11,"Day 1 of the @BJP4India ‘Sansad Karyashala’ witnessed excellent deliberations on several subjects. 

This is a great forum for Party MPs to extensively engage on issues pertaining to the nation and our organisation. https://t.co/FP6KA32l7O",4078
1157126566796677121,2019-08-02 03:10:46,"I would urge @BJP4India Karyakartas from other states to interact with Karyakartas from Tripura. The Party’s repeated successes in the state demonstrate the power of development politics and democratic temperament. It also shows that with the right effort, everything is possible.",3482
1157126562631733251,2019-08-02 03:10:45,"Tripura’s faith in @BJP4India remains unwavering! 

I thank the people of the state for blessing the party in the Panchayat Elections across the state. The transformative work in Tripura’s rural areas is positively impacting many lives. 

Kudos to the local unit for the hardwork! https://t.co/miki9OKf53",4985
1157122101221789696,2019-08-02 02:53:01,"Greetings to Gujarat CM @vijayrupanibjp Ji on his birthday. Vijay Bhai has made a mark as a committed leader, who is serving the state with remarkable dedication. May he be blessed with a long life and good health.",3076
1156564642837061633,2019-07-31 13:57:53,"Other issues discussed during PRAGATI include progress in Sugamya Bharat Abhiyan, improving accessibility across India, furthering water conservation and infrastructure projects in various states.",2420
1156564640228237312,2019-07-31 13:57:52,"Healthy India, developed India. 

During PRAGATI, had extensive discussions on Ayushman Bharat. It is a matter of satisfaction that over 35 lakh beneficiaries availed free treatment in hospitals under PMJAY. We are focusing on ways to improve coverage in Aspirational Districts.",2817
1156564637548027905,2019-07-31 13:57:52,"Today’s PRAGATI session, the first of the new term, witnessed excellent discussions on multiple policy issues. We had in-depth reviews on ways to fulfil the vision of ‘Housing for All.’ 

https://t.co/rXMgYkwGC2",4774
1156202074880634882,2019-07-30 13:57:10,तीन तलाक बिल का पास होना महिला सशक्तिकरण की दिशा में एक बहुत बड़ा कदम है। तुष्टिकरण के नाम पर देश की करोड़ों माताओं-बहनों को उनके अधिकार से वंचित रखने का पाप किया गया। मुझे इस बात का गर्व है कि मुस्लिम महिलाओं को उनका हक देने का गौरव हमारी सरकार को प्राप्त हुआ है।,16888
1156201999043461121,2019-07-30 13:56:52,पूरे देश के लिए आज एक ऐतिहासिक दिन है। आज करोड़ों मुस्लिम माताओं-बहनों की जीत हुई है और उन्हें सम्मान से जीने का हक मिला है। सदियों से तीन तलाक की कुप्रथा से पीड़ित मुस्लिम महिलाओं को आज न्याय मिला है। इस ऐतिहासिक मौके पर मैं सभी सांसदों का आभार व्यक्त करता हूं।,15130
1156201646075994112,2019-07-30 13:55:28,"This is an occasion to salute the remarkable courage of those Muslim women who have suffered great wrongs just due to the practice of Triple Talaq.

The abolition of Triple Talaq will contribute to women empowerment and give women the dignity they deserve in our society.",7226
1156201296904351745,2019-07-30 13:54:05,"I thank all parties and MPs who have supported the passage of The Muslim Women (Protection of Rights on Marriage) Bill, 2019 in both Houses of Parliament. They have risen to the occasion and this step of theirs will forever be remembered in India’s history.",6218
1156200911426875393,2019-07-30 13:52:33,"An archaic and medieval practice has finally been confined to the dustbin of history! 

Parliament abolishes Triple Talaq and corrects a historical wrong done to Muslim women. This is a victory of gender justice and will further equality in society. 

India rejoices today!",15616
1156037018826051585,2019-07-30 03:01:18,"A welcome step, which will enable more people to visit these places and discover aspects of #IncredibleIndia. https://t.co/NW8fsPXHNx",5426
1155864320812580864,2019-07-29 15:35:03,Spoke to Bihar CM @NitishKumar Ji and Deputy CM @SushilModi Ji and reviewed the situation arising due to floods in various parts of Bihar. The Centre has been working with the State Government to help those affected and we will continue providing all possible assistance needed.,3443
1155760207693090816,2019-07-29 08:41:21,"India- where you find lush green forests, diverse wildlife, beautiful mountains and mighty rivers. 

Watching this programme will make you want to visit different parts of India and add to discourse of environmental conservation.

Thanks @BearGrylls for coming here! @DiscoveryIN https://t.co/AksPyHfo7X",18359
1155733572730273792,2019-07-29 06:55:30,સદગતના આત્માને પ્રભુ ચિર શાંતિ અર્પે અને શુભેચ્છકો અને પરિવારજનોને આઘાત સહન કરવાનું બળ મળે એવી પ્રભુને પ્રાર્થના.,1810
1155733571153223682,2019-07-29 06:55:30,"પોરબંદરના પૂર્વ સાંસદ શ્રી વિઠ્ઠલભાઈ રાદડિયાના અવસાનના સમાચાર સાંભળી દુઃખ થયું. ગુજરાતે એક સક્ષમ ખેડૂત નેતા ગુમાવ્યા છે.  સહકાર, કેળવણી અને રાજકીય ક્ષેત્રમાં પ્રદાન બદલ તેઓ હંમેશા યાદ રહેશે.",2555
